URL,Title,Description,Content
https://gizmodo.com/toy-aisle-star-wars-baby-yoda-lego-nerf-marvel-jurassic-1850293437,This Weeks Toy News Celebrates Star Wars Greatest Smallest and Greenest Heroes,Welcome back to Toy Aisle io9s weekly roundup of the greatest toy news the internet has to share This week Hasbros got a new Grogu figure with cheeks you cant wait to pinch Lego embiggens the heads of Return of the Jedis most memorable heroes and Ho,Welcome back to Toy Aisle io9s weekly roundup of the greatest toy news the internet has to share This week Hasbros got a new Grogu figure with cheeks you cant wait to pinch Lego embiggens the h 5586 chars
https://gizmodo.com/cash-app-creator-bob-lee-stabbed-to-death-san-francisco-1850302260,Cash App Creator Bob Lee Stabbed to Death in San Francisco,Bob Lee the creator of Cash App and former CTO at Jack Dorseys Square now Block was stabbed to death in San Francisco on Tuesday morning Read more,Bob Lee the creator of Cash App and former CTO at Jack Dorseys Square now Block was stabbed to death in San Francisco on Tuesday morning Lees death was reported by NBC Bay Area and TechCrunch a 1882 chars
https://gizmodo.com/apple-iphone-ipad-weather-app-ios-1850297880,Apples Weather App Is on the Fritz,The Apple weather app appears to be struggling to meet consumer expectations by simply not working As more and more people rely on technology weve become dependent on it for nearly everything including the usually quick and easy step of referring to a w,The Apple weather app appears to be struggling to meet consumer expectations by simply not working As more and more people rely on technology weve become dependent on it for nearly everything incl 2234 chars
https://gizmodo.com/spider-man-across-spider-verse-trailer-3-new-1850292623,Across the SpiderVerses New Trailer Reveals Its Multiversal Menace,The first two trailers for SpiderMan Across the SpiderVerse have put their focus on Miles Morales Shameik Moore With how long its been since weve seen this take on the young SpiderMan the trailers have gone out of their way to show how much hes com,The first two trailers for SpiderMan Across the SpiderVersehave put their focus on Miles Morales Shameik Moore With how long its been since weve seen this take on the young SpiderMan the trai 1981 chars
https://gizmodo.com/super-mario-bros-theme-library-of-congress-first-game-1850327460,Super Mario Bros Theme Becomes the First Video Game Music to Enter the Library of Congress,Today the Library of Congress announced that 25 recordings representing some of the defining sounds of the nations history and culture will be added to its National Recording Registry For the first time the additions will also include music from a video,Today the Library of Congress announced that 25 recordings representing some of the defining sounds of the nations history and culture will be added to its National Recording Registry For the first 2450 chars
https://gizmodo.com/squirrel-girl-marvel-erica-henderson-ryan-north-new-ya-1850299024,Squirrel Girls Erica Henderson and Ryan North on Their Dangerous New Graphic Novel,When Marvel Comics canceled The Unbeatable Squirrel Girl in 2019 it might not have seemed like a surprise After all for a publisher that puts out 60plus comics each month canceling one book doesnt seem like anything to write home aboutespecially when t,When Marvel Comics canceled The Unbeatable Squirrel Girl in 2019 it might not have seemed like a surprise After all for a publisher that puts out 60plus comics each month canceling one book does 13268 chars
https://gizmodo.com/motorola-budget-phone-headphone-jack-moto-g-power-5g-1850305474,Motorolas New 300 Phone Still Has a Headphone Jack,Motorola may not have updated its flagships in a while but its still pushing through with a reprise of its budget devices The latest to get a refresh is the Moto G Power 5G which comes from a series known for its massive battery life The Moto G Power als,Motorola may not have updated its flagships in a while but its still pushing through with a reprise of its budget devices The latest to get a refresh is the Moto G Power 5G which comes from aserie 2282 chars
https://gizmodo.com/pet-dog-dies-bird-flu-canada-h5n1-1850313666,Pet Dog Dies of Bird Flu After Chewing on a Wild Goose,As a highly pathogenic variant of avian influenza continues to cause mass outbreaks and mortality in wild and domestic birds worldwide another unfortunate animal casualty has emerged A pet dog died of bird flu in Ontario Canada this month the countrys pu,As a highly pathogenic variant of avian influenza continues to cause mass outbreaks and mortality in wild and domestic birds worldwide another unfortunate animal casualty has emerged A pet dog died 3219 chars
https://gizmodo.com/star-wars-skeleton-crew-trailer-footage-description-1850298799,Jon Watts Star Wars Skeleton Crew Shares a First Peek at Jude Laws Space Adventures,Weve known about Star Wars Skeleton Crew for the past yearan Amblinstyle series about a group of spaceadventuring kids plus Jude Law from SpiderMan director Jon Watts and a few more friends including Oscarwinning duo the Daniels At todays Star,Weve known about Star Wars Skeleton Crewfor the past yearan Amblinstyle series about a group of spaceadventuring kids plus Jude Law from SpiderMan director Jon Watts and a few more friends in 3637 chars
https://gizmodo.com/false-memories-can-form-within-seconds-study-finds-1850303900,False Memories Can Form Within Seconds Study Finds,Human memory might be even more unreliable than currently thought In a new study scientists found that its possible for people to form false memories of an event within seconds of it occurring This almostimmediate misremembering seems to be shaped by our,Human memory might be even more unreliable than currently thought In a new study scientists found that its possible for people to form false memories of an event within seconds of it occurring Thi 4236 chars
https://gizmodo.com/midjourney-deep-fake-ai-trump-arrested-pope-1850283812,Dripped out Pope Francis Trump under arrest Putin kneeling before Xi Jinpingthe era of difficult to detect AIgenerated images is upon us,Where does the fun stop and the societal harm begin Artificial intelligence companies behind image and text generators seem to be grappling with that question in realtime as their products gain traction across the internet Simultaneously the same compani,Where does the fun stop and the societal harm begin Artificial intelligence companies behind image and text generators seem to be grappling with that question in realtime as their products gain tr 6046 chars
https://gizmodo.com/gaming-shelf-ttrpg-guns-blazing-basheer-ghouse-kickstar-1850293472,The Gaming Shelf Comes Out Guns Blazing,Im actually delighted to be featuring Gosu Xone of the few times board games to have made it onto this list Im simply not as plugged into what board games are coming out Im sorry everyone Gosu X is a prebuild deck builder that encourages everincreas,Im actually delighted to be featuring Gosu Xone of the few times board games to have made it onto this list Im simply not as plugged into what board games are coming out Im sorry everyone Gosu X  7274 chars
https://www.bbc.co.uk/news/world-asia-india-65200441,World Startup Convention The India startup gala that exploded into a scandal,An event that dubbed itself the worlds biggest funding festival has been accused of duping entrepreneurs,In March hundreds of budding entrepreneurs descended on Noida a suburb of Indias capital Delhi to attend a threeday convention that had dubbed itself the worlds biggest funding festival Eag 7725 chars
https://www.bbc.co.uk/news/business-65184776,Amazon closing UKbased online shop Book Depository,The announcement was met with sadness by many of its customers from around the world,UKbased online store Book Depository is being closed down by its parent company the US technology giant Amazon Book Depository has told customers it will cease operations later this month after a 2209 chars
https://www.bbc.co.uk/news/world-middle-east-65165513,Egypts new lavish mosque angers Egyptians facing poverty,The centre forms part of the new capital which has been purposebuilt to move people from Cairo,Egypt has opened a recordbreaking mosque in its new administrative capital city  but has been widely criticised for the costs involved The government has been building a new city in the desert t 2772 chars
https://www.bbc.co.uk/news/uk-65201949,Do disaster trolls believe the conspiracy theories they promote,Conspiracy theorist Richard D Hall is being sued for defamation but it hasnt stopped his narrative,Do the conspiracy theorists who push the most shocking narratives circulating online really believe them Its a question Im confronted with once again after Manchester Arena bomb survivors filed 5539 chars
https://www.bbc.co.uk/news/world-middle-east-65172448,Khalid Aydd Ahmed alJabouri US says it kills senior IS commander in Syria,Khalid Aydd Ahmed alJabouris death is expected to disrupt the groups ability to plot attacks,The US has said it has carried out a strike in Syria killing a senior Islamic State IS leader it believes was responsible for planning attacks in Europe Khalid Aydd Ahmed alJabouri died in an  551 chars
https://www.bbc.co.uk/sport/football/65214760,Real Madrid Karim Benzema Luka Modric and Toni Kroos to stay next season says Carlo Ancelotti,Coach Carlo Ancelotti believes Karim Benzema Luka Modric and Toni Kroos will stay with Real Madrid next season,Toni Kroos Karim Benzema and Luka Modric have 14 Champions League winners medals between them Coach Carlo Ancelotti believes Karim Benzema Luka Modric and Toni Kroos will stay with Real Madrid ne 1207 chars
https://www.bbc.co.uk/news/world-us-canada-65235861,Kentucky bank shooting What we know about the victims,An incredible friend of the governor a beloved grandmother and a respected boss are among the dead,An incredible friend of the state governor a beloved grandmother and a respected boss were among the victims of a mass shooting at a bank in Kentucky Friends and family have been sharing tribute 3046 chars
https://www.bbc.co.uk/news/world-65223756,Ben Ferencz Last surviving Nuremberg prosecutor dies aged 103,Ben Ferencz was just 27 when he convicted 22 Nazi officials for war crimes and crimes against humanity,The last surviving prosecutor from the postWorld War Two Nuremberg trials has died aged 103 Ben Ferencz was just 27 when he secured the convictions of 22 Nazi officers for war crimes and crimes ag 2866 chars
https://www.bbc.co.uk/news/world-asia-65121831,Cant afford rice quote lands journalist in jail,A reporter in Bangladesh is jailed on charges of publishing false news about high food prices,A journalist at a leading Bangladeshi newspaper has been jailed on charges of publishing false news after his report on high food prices went viral Samsuzzaman Shams of Prothom Alo daily appeared 3406 chars
https://www.bbc.co.uk/news/world-europe-65226916,Pope Francis Easter mass brings relief to public after pontiffs illness,The pontiff looked in really good health said one of the thousands of people in St Peters Square,In the early hours on a stunning Easter morning in Vatican City thousands of people from around the world waited to be let into St Peters Square for Pope Francis mass Once access was opened nu 2664 chars
https://www.bbc.co.uk/news/business-65173246,We turned down a client to uphold gay rights,The global B Corp business accreditation scheme rewards firms that behave ethically,It was during the pandemic that Adrian Ma had an epiphany that persuaded him to make his company more environmentally and socially responsible We were all celebrating people doing great work he  6573 chars
https://www.bbc.co.uk/news/technology-65162257,Martha Lane Fox warns against hysteria over AI,The tech pioneer told the BBC we should see artificial intelligence as an opportunity,Martha Lane Fox has warned against becoming too hysterical or hypedriven over artificial intelligence AI The tech pioneer instead urges more sensible conversations around its capabilities  4706 chars
https://www.bbc.co.uk/news/world-europe-65245065,Western special forces inside Ukraine leak shows,The UK has the largest contingent of special forces in Ukraine according to a leaked classified file,The presence of Western special forces in Ukraine has been the subject of quiet speculation for more than a year But its never been confirmed until now The US Department of Defense is still dea 2058 chars
https://www.bbc.co.uk/news/world-us-canada-65215212,Expelled Tennessee lawmaker Justin Jones vows to return  but can he,Expulsion is extraordinary but Democrat Justin Jones can see a way back to the statehouse,Media caption Watch Expelled lawmaker Justin Jones tells the BBC world should be shocked Expelled Tennessee lawmaker Justin Jones says he will seek reelection for his Nashville seat calling hi 3125 chars
https://www.bbc.co.uk/news/world-latin-america-65174632,The young men of Mexico risking their lives to be Catholic priests,Dozens of priests have been killed in recent years in an area of Mexico plagued with cartel violence,When Miguel Pantaleon was ordained into the Catholic church last month it was the biggest day of his young life The 28yearold trainee priest had spent almost a decade working towards joining th 5320 chars
https://www.bbc.co.uk/news/business-64663105,The Ukrainian refugees making a living somewhere new,After fleeing the war in Ukraine refugees share their experiences of finding work in their new homes,When Anastacia Kozmina and Oleksiyy Danko woke to the sound of bombing they immediately decided to leave Ukraine They joined some eight million Ukrainian refugees faced with finding a safe place to 5456 chars
https://www.bbc.co.uk/sport/tennis/65214718,Boris Becker Sixtime Grand Slam singles champion on prison fame and the future,Former Wimbledon champion Boris Becker says he is building his third chapter after eight months in prison,Becker humbled by brutal spell in prison Tennis great Boris Becker says he is building his lifes third chapter following his release from prison He was released in December and was subseque 4505 chars
https://www.bbc.co.uk/news/world-us-canada-65181338,Trump indictment What happened when other countries prosecuted exleaders,Donald Trump is the first exUS president to face charges but exleaders elsewhere have stood trial,While Donald Trump is the first former US president to be charged with a criminal offence elsewhere many other exleaders have found themselves in the dock And as some of these cases show prosecu 5471 chars
https://www.bbc.co.uk/news/entertainment-arts-65238630,Al Jaffee Recordbreaking US cartoonist dies at 102,Best known for his work on Mad magazine Jaffee was still working up until 2020,Awardwinning American cartoonist Al Jaffee renowned for his work on satirical magazine Mad has died at the age of 102 Jaffee who was still working up until three years ago set a Guinness World 4428 chars
https://www.bbc.co.uk/news/entertainment-arts-65043969,Eurovision 2023 Every song ranked from Albania to the UK,All 37 countries have now submitted their entries But which are the gems and what are the duds,The countdown has begun This Friday marks 40 days until Eurovision week kicks off with a turquoise carpet opening ceremony in Liverpool All 37 songs have now been submitted with lyrics addressi 24145 chars
https://www.bbc.co.uk/news/world-us-canada-65193458,How this historically black college gymnastics team made history,For decades young black gymnasts had to make a difficult choice about where to go to university,Media caption Watch These black gymnasts are making history For decades thousands of black high school gymnasts have been faced with a difficult decision either join a historically black college 6886 chars
https://www.cnn.com/2023/04/07/sport/magnus-carlsen-mouse-slip-hikaru-nakamura-spt-intl/index.html,Magnus Carlsen loses his last competition as world champion after dramatic slip of his mouse,Magnus Carlsen lost against Hikaru Nakamura in the losers final of the Champions Chess Tour Chessable Masters 2023 thanks to a dramatic slip of his mouse in what is his last tournament as the world champion,Magnus Carlsen lost against Hikaru Nakamura in the losers final of the Champions Chess Tour Chessable Masters 2023 thanks to a dramatic slip of his mouse in what is his last tournament as the world c 2136 chars
https://www.cnn.com/2023/04/06/tennis/iga-swiatek-russia-belarus-tennis-wimbledon-spt-intl/index.html,World No 1 says tennis missed opportunity in not banning Russian and Belarusian players,Tennis missed an opportunity to send a strong message to Moscow by failing to impose a blanket ban on players from Russia and its ally Belarus after the invasion of Ukraine world number one Iga witek said,Tennis missed an opportunity to send a strong message to Moscow by failing to impose a blanket ban on players from Russia and its ally Belarus after the invasion of Ukraine world number one Iga wite 1707 chars
https://www.cnn.com/2023/04/06/golf/the-masters-watch-time-preview-spt-intl/index.html,How to watch The Masters live Start time channels and other things to know,For the 87th time the center of the golfing world shifts to Augusta National for The Masters on Thursday,For the 87th time the center of the golfing world shifts to Augusta National for The Masters on Thursday The first major of the season will see Scottie Scheffler attempt to defend the green jacket 5276 chars
https://www.cnn.com/2023/03/31/media/news-organizations-demand-release-wsj/index.html,Leaders of more than 30 news organizations demand Russia release WSJ reporter,The leaders of more than 30 news organizations around the world signed a letter Thursday to the Russian ambassador to the US Anatoly Antonov demanding the release of imprisoned Wall Street Journal reporter Evan Gershkovich,The leaders of more than 30 news organizations around the world signed a letter Thursday to the Russian ambassador to the US Anatoly Antonov demanding the release of imprisoned Wall Street Journal  1545 chars
https://www.cnn.com/2023/04/05/opinions/joe-biden-fighting-antisemitism-speaking-out-passover/index.html,Joe Biden To fight antisemitism we must remember speak out and act,Tonight Jews around the world will gather around the seder table to celebrate Passover They will recount the miraculous story of the Jewish peoples exodus from slavery in Egypt to freedom It is a timeless powerful story of faith hope and redemption that,Editors Note Joe Biden is President of the United States The views expressed in this commentary are his own View more opinion on CNN Tonight Jews around the world will gather around the seder t 7568 chars
https://www.cnn.com/2023/04/04/europe/russia-wall-street-journal-evan-gershkovich-lawyers-intl/index.html,Lawyers gain access to jailed Wall Street Journal reporter Evan Gershkovich say hes in good health,Wall Street Journal reporter Evan Gershkovich was able to meet with his lawyers the paper said in a statement Tuesday adding that the journalist who has been detained in Russia since last week was in good health,Wall Street Journal reporter Evan Gershkovich was able to meet with his lawyers the paper said in a statement Tuesday adding that the journalist who has been detained in Russia since last week was  1823 chars
https://www.cnn.com/2023/03/31/sport/cece-telfer-athletics-spt-intl/index.html,After a regulation change for transgender athletes CeC Telfer is determined to keep pursuing her dreams,CeC Telfer calls it the moment her dreams seemed to be shattered as she questioned whether years of blood sweat and tears were in vain,CeC Telfer calls it the moment her dreams seemed to be shattered as she questioned whether years of blood sweat and tears were in vain Last week governing body World Athletics WA announced it  6294 chars
https://www.cnn.com/2023/04/09/world/ben-ferencz-nuremberg-dies-103-intl/index.html,Benjamin Ferencz last surviving Nuremberg prosecutor dies age 103,Benjamin Ferencz the last surviving prosecutor from the Nuremberg trials has died aged 103,Benjamin Ferencz the last surviving prosecutor from the Nuremberg trials has died aged 103 Ferencz fought in Europe during the Second World War and helped liberate several concentration camps be 2797 chars
https://www.cnn.com/2023/04/09/entertainment/super-mario-bros-movie-box-office/index.html,The Super Mario Bros Movie wins big at the boxoffice with record opening,The Super Mario Bros Movie poweredup at the box office with an impressive opening,The Super Mario Bros Movie powered up at the box office with an impressive opening The movie ran up the score with more than 200 million in the US and Canada for its fiveday opening run accord 1372 chars
https://www.cnn.com/2023/04/04/politics/jill-biden-king-charles-iii-coronation/index.html,First lady Jill Biden will attend the coronation of King Charles III White House announces,First lady Dr Jill Biden is set to travel to London next month for the coronation of King Charles III of the United Kingdom leading the US delegation to the highly anticipated event,First lady Dr Jill Biden is set to travel to London next month for the coronation of King Charles III of the United Kingdom leading the US delegation to the highly anticipated event President Joe 2172 chars
https://www.cnn.com/2023/04/12/entertainment/harry-potter-game-of-thrones-max/index.html,Harry Potter and Game of Thrones franchises to get fresh life on newly minted Max streamer,Warner Bros Discovery announced on Wednesday that the Game of Thrones and Harry Potter franchises will take on new life at the studios newly minted streaming service Max,Fantasy freaks and noble nerds unite Warner Bros Discovery announced on Wednesday that the Game of Thrones and Harry Potter franchises will take on new life at the studios newly minted streaming  2025 chars
https://www.cnn.com/2023/04/05/us/us-navy-submarine-pacific-china-intl-hnk-ml/index.html,In the dark depths of the Pacific US submarines patrol with an eye fixed firmly on China,Hundreds of feet below the surface of the Pacific Ocean cocooned within one of the US Navys most technologically advanced pieces of equipment Rear Adm Jeff Jablon is cleareyed about the two biggest challenges his team faces,Hundreds of feet below the surface of the Pacific Ocean cocooned within one of the US Navys most technologically advanced pieces of equipment Rear Adm Jeff Jablon is cleareyed about the two bigge 9547 chars
https://www.cnn.com/travel/article/world-best-cities-public-transit-photos/index.html,The worlds best cities for public transit according to Time Out,A survey from Time Out ranks the 19 best cities for mass transit including Berlin Tokyo and New York,Editors Note Sign up for Unlocking the World CNN Travels weekly newsletter Get the latest news in aviation food and drink where to stay and other travel developments Europe and Asia dominate a 3539 chars
https://www.cnn.com/2023/04/11/economy/janet-yellen-comments-imf-spring-meeting/index.html,Yellen Not anticipating a downturn in the US economy,US Treasury Secretary Janet Yellen said she believes the American economy remains strong and its banking system is resilient despite some recent turmoil among regional financial institutions,US Treasury Secretary Janet Yellen said she believes the American economy remains strong and its banking system is resilient despite some recent turmoil among regional financial institutions Ive n 2791 chars
https://www.cnn.com/2023/04/10/entertainment/kim-kardashian-emma-roberts-ahs/index.html,Kim Kardashian and Emma Roberts join American Horror Story Season 12,Kim Kardashian has long been known to slay and now she may be taking that to the next level,Kim Kardashian has long been known to slay and now she may be taking that to the next level On Monday the reality star announced on social media that she and actress Emma Roberts are set to be a 1373 chars
https://www.cnn.com/2023/04/03/business/mcdonalds-layoffs/index.html,Wall Street Journal McDonalds closes offices and tells employees to work from home ahead of layoffs,McDonalds instructed corporate employees to work from home this week in anticipation of layoffs according to a report from the Wall Street Journal,McDonalds instructed corporate employees to work from home this week in anticipation of layoffs according to a report from the Wall Street Journal During the week of April 3 we will communicate  1829 chars
https://www.cnn.com/2023/04/09/china/covid-human-origin-china-intl-hnk/index.html,Covid may have originated from humans Chinese scientist claims,The Covid19 virus may have originated from humans a Chinese scientist has claimed,The Covid19 virus may have originated from humans a Chinese scientist has claimed The genetic sequences of viral samples taken from the Huanan Seafood Market in Wuhan thought to be the ground ze 1786 chars
https://www.cnn.com/2023/04/06/opinions/putin-finland-joining-nato-ukraine-ghitis/index.html,Opinion A very bad day for Putin,What was the worst day so far for Russian President Vladimir Putin since launching his unprovoked fullscale invasion of Ukraine last year Its impossible to choose one but Tuesday April 4 2023 must rank high on the list,Editors Note Frida Ghitis a former CNN producer and correspondent is a world affairs columnist She is a weekly opinion contributor to CNN a contributing columnist to The Washington Post and a co 6063 chars
