URL,Title,Description,Content,full_content
https://www.theguardian.com/business/2023/apr/04/chris-brownridge-behind-the-wheel-of-a-greener-image-for-bmw,Chris Brownridge behind the wheel of a greener image for BMW,The chief exec of the German marques UK arm grew up a petrolhead but says hes now more fired up about electric cars and finding sustainable ways to make themWhen as a child in the 1980s Chris Brownridge first admired his grandfathers BMW saloon the bu,When as a child in the 1980s Chris Brownridge first admired his grandfathers BMW saloon the business of selling cars was a fairly straightforward exchange of cash for a vehicle But when he joined 6635 chars,When as a child in the 1980s Chris Brownridge first admired his grandfathers BMW saloon the business of selling cars was a fairly straightforward exchange of cash for a vehicle But when he joined the industry in the 1990s it was in the middle of a wave of change Readily available car finance suddenly meant the public could buy more expensive cars It changed the type of car people bought says Brownridge chief executive of BMW Group UK Drivers could borrow to buy a pricier vehicle in the expectation that it would hold its value and could be sold on later Britons couldnt get enough of it low interest rates helped and BMW rose to become the UKs fourthbiggest seller of cars despite the premium price tag of most of its models And now the industry is facing an even bigger paradigm shift with the transition to electric cars in full swing and newer innovations such as connected and autonomous cars opening the door to different kinds of business Things have changed a lot and are about to change significantly again says Brownridge standing in BMWs flagship showroom on Londons Park Lane I genuinely think we are on the edge of probably the most exciting time in the industry Brownridge is a UK car industry lifer He was born in Oxford  close to the Mini factory which BMW now owns  but when he was small his family moved to Hong Kong so his engineer father could work on the citys mass transit system Ive very fond memories of a very different culture Brownridge says It was a very different world with the UK ruling the city state until the handover in 1997 When Chris Patten last governor of Hong Kong left on the royal yacht Britannia with the then Prince Charles it was quite a sad moment really However his family was always tied to the UK and he returned for his secondary education After university the car industry was the obvious choice I am fascinated by anything with wheels he says It felt very natural to start work with Land Rover then under the Rover Group which was in turn owned by BMW He worked in managing customer relationships and data at Mini Rover and MG Brownridge rose through the BMW ranks via marketing roles overseeing sponsorship of the London 2012 Olympics theres a replica Olympic torch in the corner of the room before taking charge of the Mini brand He became UK chief executive in 2021 overseeing BMWs fourthlargest market after China the US and Germany BMW suffered a flurry of incredulous news reports last autumn when it emerged that it was charging a 15 monthly fee to turn on heated seats Traditionally carmakers would sell cars to dealers and the dealers handled customer relationships but now manufacturers increasingly sell direct to consumers online Dealers are highly sensitive about suggestions of a changing business model  under which carmakers take more control of the customer relationship  and Brownridge is wary of giving details of what BMW is considering Our longterm strategy is to work with our network of retailers he says emphasising the with However he acknowledges that how we transact is being examined Thats something we need to work on with our partners rather than inflict on them he says Because ultimately our success is mutual Being more involved in the customer relationship will give carmakers more opportunities to make money throughout a vehicles life Carmakers say they will also make their products more attractive Customers are not always happy about being asked to pay more after purchase however BMW suffered a flurry of incredulous news reports last autumn when it emerged that it was charging a 15 monthly fee to turn on heated seats Brownridge says some of the coverage that focused on the hardware aspect was overlooking the obvious opportunity for software upgrades that can improve drivers experience But the most eyecatching change to the car industry is the shift to electric technology BMW made one in every 10 batterypowered cars sold in the UK in 2022 and a fifth of its UK sales were battery electric  already putting it on track to meet the governments mandate of 22 battery sales by 2024 which was confirmed last week after this interview took place Carmakers will need to be selling 80 battery vehicles by 2030 and 100 by 2035 The government needs to ensure there is enough green energy to power electric cars and put more investment into the UKs charging network BMW has not always been on board with the UK governments plans In 2020 it and other carmakers argued that a ban on internal combustion engines before 2040 would damage the British industry Asked about that stance Brownridge says the UK governments plans are ambitious  not usually a compliment from executives  but achievable for BMW at least amid very strong demand for electric cars Were ready he says We have the products So we are able to respond However he adds that the government needs to ensure there is enough green energy available to power electric cars and must put more investment into the UKs charging network Brownridge says car buyers focus on sustainability will only increase and will soon extend beyond the fuel powering their cars to how the cars are made A focus on greener materials might give premium carmakers an edge as their higher margins can soak up new costs But the BMW boss cites a company visit to a coalmine west of Cologne in Germany as evidence for why green manufacturing will become increasingly important to carmakers The giant Hambach coalmine is bigger than central London in area and Brownridge says a giant machine there scoops out enough coal every day to cover a football field to a height of almost 100 metres You look at that and think well this cant continue because therell be nothing left he says Customer choice will be heavily influenced by their understanding of the same sustainability for the products I think thats quite exciting CV Age 48 Family Married to Ami for 23 years with two children aged 20 and 17 plus a dog called Dennis Education RGS High Wycombe then economics at Exeter University Pay Im not going to disclose that Last holiday We went to Lyme Regis one of my favourite places We rent a house that overlooks the sea Its like watching a fire watching the sea Its beautiful Best advice hes been given Listen to the people around you and be acutely aware of what affects the quality of your judgments and what impairs it Phrase he overuses What is the problem youre trying to solve I think in our business  in many businesses  people rush to use their knowledge and experience but sometimes miss what theyre trying to achieve How he relaxes I enjoy fiddling with old cars  he owns a 1956 MGA  and I love listening to music  from classical through to Kate Bush and the The
https://www.theguardian.com/lifeandstyle/2023/apr/02/seamas-oreilly-my-young-son-thinks-he-is-a-huge-ireland-rugby-fan,My young son thinks he is a huge Ireland rugby fan,Yet he was reduced to tears when England got thumped in the Six NationsBefore England played Ireland in the final game of the Six Nations we asked my son which team he supported Ireland he said cheerily before adding somewhat cryptically because they ,Before England played Ireland in the final game of the Six Nations we asked my son which team he supported Ireland he said cheerily before adding somewhat cryptically because they dont always do 2934 chars,Before England played Ireland in the final game of the Six Nations we asked my son which team he supported Ireland he said cheerily before adding somewhat cryptically because they dont always do the right thing Were still not sure what that meant or how fervent his Irish patriotism really is since he reacted to Englands defeat with huge racking sobs A lot of this is down to the fact that at four he is touchingly empathetic towards anyone who loses His joy at seeing a goal in football reaches a fever pitch when they all hug each other  his favourite part  but crashes immediately down to Earth once he spots the opposition looking sad and humiliated His ideal football match would be one in which everyone gets a goal but each is then sucked into a time vortex and deleted rendering the scoreline a fair balanced and painless 00 The boys grasp of geography is basically England most Ireland the rest But we cant ignore the possibility that our sense of Irish identity has left him eager to embrace his Englishness To be clear we know hes both and such queries dont give us the same urge to place him in an Irish Heritage ReEducation Camp we have witnessed among some of our other Irish friends here My son isnt particularly well travelled having only ever set foot in England and Ireland and his conception of the former is nebulous He has not yet grasped that his own world largely contained to around a dozen streets in north Walthamstow is a tiny bit of a small corner of a mediumsized country As a result his grasp of geography is basically England most Ireland the rest meaning that any moderately long bit of travel in any direction inevitably prompts him to ask if were in Ireland now Its cute but mildly inconvenient especially when we get off a train in Nottingham East Sussex or even central London and find him distraught that his grandparents arent there to greet him A trip to the map in his bedroom shows the depth of his geographical knowledge He finds Great Britain which he insists is England my apologies to Scotland and Wales but this is just a warmup Horrified by how small this seems by itself he proceeds to annexe an alarming number of other countries too His entire life could not possibly be constrained to that small patch of Earth so large tracts of Europe Asia and Africa must simply be England too Four years as an Englishman have turned my sweet young boy into Cecil Rhodes Auntie Maeves house a 15minute walk from home he locates in Cyprus Pondering the traveltime it takes to reach Uncle Shane in Surrey he places Kingston in Australia He is dumbstruck as we correct him naming countries as best we can leaving him baffled that theres so much he hasnt seen And wheres Ireland we ask He looks at us with condescension before hitting the bullseye first time prodding a small finger at the only country that looks like a teddy bear driving a car Its sort of just a bit of England he says We do not disguise our horror already drafting plans for a reeducation camp in our heads Follow Samas on Twitter shockproofbeats
https://www.theguardian.com/money/2023/apr/03/the-aa-lost-my-mum-80000-on-the-sale-price-of-her-home,The AA lost my mum 80000 on the sale price of her home,It admits it made an error but we lost our buyer and had to go to auctionI am contacting you out of desperation on behalf of my mum She is 76 and recently lost her husband of almost 50 years She is selling the family home and needs to move into a bungalow a,I am contacting you out of desperation on behalf of my mum She is 76 and recently lost her husband of almost 50 years She is selling the family home and needs to move into a bungalow as a matter of 2617 chars,I am contacting you out of desperation on behalf of my mum She is 76 and recently lost her husband of almost 50 years She is selling the family home and needs to move into a bungalow as a matter of urgency She accepted an offer of 295000 in early 2022 however the buyers survey identified some cracks to the external wall and an investigation was recommended We referred this to her insurer the AA and it did its own survey It later confirmed the fix would involve localised repairs but there was nothing to suggest major structural work would be required As no timescale was given and mum needed to move quickly we accepted a lower offer of 280000 to cover the cost of the repairs This however was subject to the buyer seeing a scope of repair report the AA promised to send us We were then informed that the AA had cancelled the policy It said the kitchen window lintel had been replaced two years ago and this constituted a previous claim for subsidence There was no such claim but the AA wont listen By cancelling the policy and failing to provide the report we lost our buyer and are left with a house that cannot be insured or mortgaged and therefore cannot be sold on the open market We have now put the house up for sale via an auction with a guide price of 200000 This is 80000 below the offer we had The AA has since admitted it made an error in cancelling the policy and offered 300 compensation However it has refused to reinstate it or provide the repair report The stress is making my mum ill YH Coalville Just dealing with subsidence can be an ordeal and combined with your mothers worsening health this has put a huge strain on your family When we contacted the AA it reviewed her case and confirmed the policy had been cancelled in error It says We have today spoken to the customer offered our sincerest apologies and accepted fault We believe the best way to support the customer is to act quickly and ensure they are not left out of pocket due to the error Weve agreed to pay the customer 32000 as this is the difference in costs between the auction price of the property 248000 offset against the preagreed sale price 280000 The house was sold at auction and is going through the conveyancing process In the meantime you and your sister clubbed together to raise a mortgage enabling your mum to move into a bungalow She is happy with this settlement but frustrated it took our involvement to get the AA to see the light We welcome letters but cannot answer individually Email us at consumerchampionstheguardiancom or write to Consumer Champions Money the Guardian 90 York Way London N1 9GU Please include a daytime phone number Submission and publication of all letters is subject to our terms and conditions
https://www.theguardian.com/politics/2023/apr/04/how-1980s-chancellor-turned-postwar-economic-consensus-on-its-head,How 1980s chancellor turned postwar economic consensus on its head,Nigel Lawson fundamentally changed the UK economy during his sixyear stint at the Treasury and not much has changed since thenulliNigel Lawson former Conservative chancellor dies aged 91liulEnoch Powell famously said all political careers end in,Enoch Powell famously said all political careers end in failure and that was certainly true of Nigel Lawson whose death at 91 was announced on Monday His sixyear spell at the Treasury ended with t 3502 chars,Enoch Powell famously said all political careers end in failure and that was certainly true of Nigel Lawson whose death at 91 was announced on Monday His sixyear spell at the Treasury ended with the economy stricken by a classic British boombust cycle which left unemployment at more than 3 million and record number of home repossessions That said only a handful of chancellors have a lasting legacy when they leave office and Lawson was one of them Like Gordon Brown  another of the rare breed of politicians who made a difference  he had a clear idea of what he thought needed to be done to make the economy work more effectively and pursued his goals in a singleminded fashion Lawson set out his beliefs in his Mais lecture of 1984 In a speech that turned the postwar economic consensus on its head Margaret Thatchers second chancellor said that traditionally macroeconomic policy the big picture stuff involving interest rates and tax had been designed to deliver growth and full employment while microeconomic policy the nittygritty stuff such as regulation and price controls had been used to keep inflation in check He argued the reverse should be the case the job of macroeconomic policy was to keep inflation in check while microeconomic policy should be used to boost growth and employment The raft of supplyside measures he was prepared to use included the privatisation of nationalised industries the big bang reforms of the City of London and a relentless focus on cutting tax His aim in each budget was not just to cut tax rates but to abolish them altogether And for a while all went well Inflation  helped by a collapse in the oil price  came down to little more than 2 by 1986 and strong growth made it possible to cut income tax by two percentage points ahead of the 1987 general election In a sense Lawsons arrival at the Treasury symbolised the end of the long 1970s Shortly afterwards the tide turned Defying the political convention that governments take unpopular decisions following election victories Lawson used his spring 1988 budget to announce a massive giveaway reducing the top rate of income tax from 60 to 40 and cutting the basic rate from 27 to 25 He also announced that couples would no longer be able to claim double mortgage tax relief after the summer The upshot was a colossal spending spree a housing bubble as couples sought to beat the mortgage deadline a record trade deficit and rising inflation Matters were not helped by Lawsons decision to shadow the deutschmark a policy that required interest rates to be raised or cut in order to keep the pound stable against the German currency Interest rates were cut in the spring of 1988 at a time when the economy was overheating to 75 By the time Lawson resigned in October 1989 after a clash with Thatcher and her economic adviser Alan Walters over the chancellors exchange rate strategy they had doubled to 15 and a deep recession was baked in In a sense Lawsons arrival at the Treasury symbolised the end of the long 1970s  the period stretching from Labours aborted reform of the trade unions in 1969 to the yearlong miners strike that began in 1984  and the start of the 1980s proper In the late 60s the UK was a country based around manufacturing nationalised industries full employment and strong trade unions A measure of Lawsons influence is not just that under his economic stewardship Britain became a country dominated by the financial sector where large parts of the state were sold off organised labour was weakened and the gap between rich and poor widened It is that fundamentally not much has changed since
https://www.theguardian.com/sport/2023/apr/05/richard-whitehead-worries-disabled-athletes-known-more-for-reality-tv-than-sport,Whitehead worries disabled athletes are known more for reality TV than sport,ulliDouble Paralympic champion wants sporting success to be focusliliWhitehead fronts newly launched Disability Sports AllianceliulParalympic champion Richard Whitehead says too many disabled athletes are known for their time on reality TV show,Paralympic champion Richard Whitehead says too many disabled athletes are known for their time on reality TV shows rather than their exploits in sport Whitehead a double gold medallist and world r 3474 chars,The Paralympic champion Richard Whitehead says too many disabled athletes are known for their time on reality TV shows rather than their exploits in sport Whitehead a double gold medallist and world recordholder is one of a number of highprofile Paralympians to have appeared on a celebrity show He appeared on Celebrity Hunted while Ellie Simmonds was on Strictly Come Dancing and Kadeena Cox has been on Im a Celebrity  Get Me Out of Here However Whitehead says their sporting achievements are being forgotten and has called for change in the exposure successful disabled athletes are getting The 46yearold surged into the public consciousness after his mesmerising sprint from the back of the field to win the T42 200m title at London 2012 which he defended in Rio four years later He is now fronting the new Disability Sports Alliance  a digital platform designed to drive awareness of disability sport  after research found 67 of UK adults were unable to name a competitive or retired disabled athlete Its astounding that people associate the athletes with other media opportunities and not their own speciality he said You want to be remembered as an athlete you want to represent professionalism you want to represent more than just the sport but also you want to be identified through the successes that youve had and then transcend to other areas as well Its about celebrating those successes and understanding that Paralympic athletes have so many barriers and obstacles to overcome where were just getting on the field of play and then being successful To have all these barriers and obstacles after youve been successful is really frustrating Kadeena Cox who was on Im a Celebrity  Get Me Out of Here in 2021 is a fourtime Paralympic gold medallist in two sports Photograph ITVShutterstock While the exposure is there for the highestprofile athletes in the entertainment genre Whitehead has called out the lack of disability sport being shown on TV and the personal stories that are being missed out on because of that The channels are just gobbled up by these mainstream ablebodied sports whether its cricket whether its football and disability sports take a backseat he said The storytelling is really part of that When you look at the Olympic athletes that you associate with success theres always a really great story Jess Ennis Mo Farah they have really great stories and we want to start to give those elite Paralympic athletes elite disabled athletes those opportunities to have the story out there Im sure it resonates with a lot of the publics obstacles and challenges theyre having to overcome skip past newsletter promotion Sign up to The Recap Free weekly newsletter The best of our sports journalism from the past seven days and a headsup on the weekends action Privacy Notice Newsletters may contain info about charities online ads and content funded by outside parties For more information see our Newsletters may contain info about charities online ads and content funded by outside parties For more information see our Privacy Policy  We use Google reCaptcha to protect our website and the Google Privacy Policy and Terms of Service apply after newsletter promotion My message is that we deserve this opportunity through the success weve had Theres been so many things that have been lost within success but now its time for social change Now its time to hold people accountable When organisations and the media say they have an inclusive strategy around disability sport its time to hold people to account to that
