URL,Title,Description,Content,full_content
https://www.theguardian.com/music/2023/apr/04/seymour-stein-obituary,Seymour Stein obituary,Music executive and cofounder of Sire Records who launched the careers of Madonna Talking Heads and the RamonesThe only thing an AR man needs Seymour Stein once said was a good pair of ears Stein who has died aged 80 might have added indefatigable ent,The only thing an AampR man needs Seymour Stein once said was a good pair of ears Stein who has died aged 80 might have added indefatigable enthusiasm a streak of opportunism and a shrewd bus 6060 chars,The only thing an AR man needs Seymour Stein once said was a good pair of ears Stein who has died aged 80 might have added indefatigable enthusiasm a streak of opportunism and a shrewd business brain all of which he deployed in a career that saw him sign the deals that launched the careers of Madonna the Ramones Talking Heads kd lang and many others Those artists enjoyed their first hits on Sire Records the label Stein cofounded in 1966 and with which he remained synonymous even after his company had been absorbed by the Warner Music group By the time he stood down in 2018 unhappy with corporate politicking Steins achievements had long since earned him a place among the finest record men  as they were known  of his generation I have no easily definable skills or talents Im a hit man a record business entrepreneur he wrote in the introduction to his autobiography Siren Song in 2018 He played no instrument and had no technical knowledge for which he was ultimately grateful believing it might have got in the way of an appreciation of artists who could not be judged by conventional musical standards Seymour Stein centre with Madonna and the Talking Heads frontman David Byrne at the 1996 Rock and Roll Hall of Fame induction dinner in New York Photograph KMazurWireImage The story of how Stein acquired the US rights to the thenunknown British band Depeche Mode for his label typified his modus operandi based on instinct and energy One day in 1980 he picked up the latest issue of a British music paper in his New York office and read about a new group signed by a UK contact Daniel Miller to his Mute Records label On a hunch he grabbed his passport booked a ticket to London on Concorde and went straight from the airport to meet the group in Basildon Essex their home town an hours drive east of London I signed them on the spot he remembered Their subsequent success made them one of a string of British bands whose records he released in the US When his rivals called him an anglophile it was not always he recalled meant as a compliment But it was British musicians from the Climax Blues Band to the Smiths who provided a bedrock for his business To sign Madonna Ciccone in 1982 he summoned the singer to his bedside at the hospital where he had undergone heart surgery Having listened to her demo tape he offered the 24yearold 45000 for three singles with the option to release an album Going on to sell more than 60m albums in the US alone while helping to reshape feminism for a new generation of young women she was his greatest success Seymour Stein with Michael Jackson in 2003 Photograph Sipa PressRexShutterstock He was born in Brooklyn New York to Dora nee Weisberg and David Steinbigle Orthodox Jews whose own parents had emigrated from Galicia the region of eastern Europe straddling Poland and Ukraine His father was employed in Manhattans garment industry while his mother worked at her familys market in Coney Island A heart murmur in infancy kept him away from sports at Lafayette high school where he discovered that he preferred applying his prodigious memory to Billboard magazines charts of current bestselling pop records than to his lessons The love of music was kindled by listening to the records brought home by his older sister During a summer holiday he talked his way into an internship at Billboards offices on 47th Street and Broadway It was there that he met Syd Nathan the myopic asthmatic choleric boss of King Records the label of James Brown based in Cincinnati In 1961 Nathan suggested that he shorten his surname and offered him a job asking Do you want to be a spectator or do you want to be in the game It was at King that Stein learned from the ground up how the record business really worked His knowledge would be expanded while working for George Goldner another oldtime record man at the Red Bird label where the ShangriLas and the Dixie Cups were the hit acts There he met the songwriter and producer Richard Gottehrer with whom he founded Sire each putting in 10000 The Climax Blues Band Barclay James Harvest Matthews Southern Comfort  all from the UK  were among early successes along with an album by the Dutch band Focus before the pair began releasing their own selfrecorded albums from 1970 Seymour Stein fourth from right next to his wife Linda with Iggy Pop and the Ramones at the New York club CBGB in 1976 Photograph Roberta BayleyRedferns After Gottehrer had left the label in the mid1970s Stein and his wife Linda could be seen patrolling the New York clubs scouting a new generation of local bands They were quick to pounce on the Ramones with their twominute blasts of brattish attitude and the cooler artschool rock of Talking Heads From the UK came Echo and the Bunnymen Soft Cell and the Pretenders whose American singer Chrissie Hynde was impressed by Steins extraordinary recall of lyrics old and new As well as continuing to sign emerging acts  many of them from the UK such as My Bloody Valentine Aphex Twin and Everything But the Girl  Stein also played a significant role in the later careers of established stars Brian Wilsons eponymous first solo LP was released on Sire in 1988 the following year Lou Reeds artistic momentum was revived by the first of a series of Sire albums titled New York While on a constant search for new music Stein used his fortune to eat well and to collect art and antiques including The Siren by the preRaphaelite painter John William Waterhouse which he sold at Sothebys in London in 2018 for a reported 5m In 1983 he helped found the Rock and Roll Hall of Fame into which he was inducted in 2005 He and Linda Adler were married in 1971 shortly after she had recovered from the shock of his announcement that he was gay Their formidable and often turbulent partnership which also produced two daughters was ended by divorce after seven years Samantha their elder daughter died of cancer in 2013 Stein is survived by their younger daughter Mandy and by his sister Ann
https://www.theguardian.com/artanddesign/2023/apr/02/ophelia-resurfaces-pre-raphaelite-muse-is-recognised-as-a-skilled-artist,Ophelia resurfaces preRaphaelite muse is recognised as a skilled artist,Elizabeth Siddal immortalised in the painting by John Everett Millais is finally being judged for her art at a new Tate exhibitionShe is immortalised as the drowning Ophelia in John Everett Millaiss celebrated 1850s painting and as the auburnhaired model ,She is immortalised as the drowning Ophelia in John Everett Millaiss celebrated 1850s painting and as the auburnhaired model for several preRaphaelite artists in the mid19th century After dying p 4629 chars,She is immortalised as the drowning Ophelia in John Everett Millaiss celebrated 1850s painting and as the auburnhaired model for several preRaphaelite artists in the mid19th century After dying prematurely aged 32 Elizabeth Siddal was marked down for decades as a depressive and laudanum addict and was portrayed as such in Ken Russells 1967 BBC film Dantes Inferno  named after her husband Dante Gabriel Rossetti More recently she has been mythologised in several TV dramas and novels  even as a vampire victim Only now with The Rossettis exhibition opening on 6 April at Tate Britain will Siddal finally be judged for what she really was and achieved  a considerable artist in her own right Admittedly she had some bouts of poor health and suffered not surprisingly after giving birth to a stillborn daughter in 1861 However this exhibition with several previously unseen works will show Siddal as an independent woman who was not just a talented artist but also had a strong influence on the career of Rossetti Siddal was for so long considered as either just a model or as a derivative artist who simply followed the male preRaphaelites says Carol Jacobi curator of The Rossettis This is so inaccurate Siddal was untrained as an artist as a teenager working in clothes shops in central London where she taught herself to design dresses She was introduced to the preRaphaelites just as the group formed in 1849 before meeting Rossetti and becoming the model in his Rossovestita portrait In 1852 she sat for Millaiss Ophelia and other preRaphaelites such as William Holman Hunt She then began to draw and paint herself encouraged by Rossetti and her patron John Ruskin who gave her an allowance She also wrote poetry And yet during the 1850s as she began a relationship with Rossetti  though one which it is not thought was consummated until their marriage in 1860  her work was dismissed by the preRaphaelites as a pale imitation of Rossetti There were even claims that Rossetti helped paint her watercolours Regarded as an appendage to her husband she remained unknown during her lifetime outside the small and bitchy preRaphaelite circle However The Rossettis featuring 17 of her drawings and watercolours along with Jan Marshs forthcoming biography Elizabeth Siddal Her Story plus new research by Glenda Youde a York University historian highlight her as a skilled artist Dante Gabriel Rossettis portrait of Elizabeth Siddal Photograph ArchivartAlamy They also prove that she had a real influence on Rossetti by comparing and contrasting the work of the two artists in the exhibition They were together after all in the same studio says Youde You can see her effect on the style in paintings which Rossetti did himself either during her lifetime or especially afterwards This view is supported by Marsh In many cases it was Rossetti who was adopting and responding to her ideas and execution she says skip past newsletter promotion Sign up to Art Weekly Free weekly newsletter Your weekly art world roundup sketching out all the biggest stories scandals and exhibitions Privacy Notice Newsletters may contain info about charities online ads and content funded by outside parties For more information see our Newsletters may contain info about charities online ads and content funded by outside parties For more information see our Privacy Policy  We use Google reCaptcha to protect our website and the Google Privacy Policy and Terms of Service apply after newsletter promotion The exhibition also contains a remarkable poem dedicated to her by Rossetti The Portrait which illuminates the power of a portrait to bring back memories of a dead loved one was one of several kept inside a leatherbound book that in 1862 Rossetti buried beside her body in Highgate cemetery in north London Seven years later the book was removed after the tomb was controversially opened Owned for many years by the University of Delaware in the US a loose sheet of paper with Rossettis original crossingsout and changes for The Portrait will be seen for the first time at the Tate Alongside will be Rossettis most famous portrait of Siddal  Beata Beatrix After her death Rossetti asked a friend to photograph about 60 of her drawings as another memory of her Displayed at the Tate will be three pages of this album plus some glass negatives again not shown before There is however one unsolved mystery Siddal is known to have completed one selfportrait  a rendering showing her red locks and stern expression Siddal painted it in 1853 but it has not been seen publicly for more than a century although it was photographed about 50 years ago This photograph is in the exhibitions catalogue Both Marsh and Youde are convinced that someone in the Rossetti family either in the UK or Italy has it Maybe this exhibition will inspire the owner to let it be seen publicly again
https://www.theguardian.com/artanddesign/2023/apr/01/painting-a-new-pantheon-portrait-series-honours-black-radicals,Painting a new pantheon portrait series honours Black radicals,Artists and writers pay tribute to figures who resisted slavery and racism as part of Guardian project exploring the papers links to enslavementAn entrepreneurial PanAfricanist a boxerturnedcampaigner and a pair of African American abolitionists are amo,An entrepreneurial PanAfricanist a boxerturnedcampaigner and a pair of African American abolitionists are among a group of radical Black figures who are featured in new portraits commissioned by  4758 chars,An entrepreneurial PanAfricanist a boxerturnedcampaigner and a pair of African American abolitionists are among a group of radical Black figures who are featured in new portraits commissioned by the Guardian as part of its Cotton Capital project The Radicals series includes eight exclusive portraits painted by prominent Black artists including Joy Labinjo Tam Joseph and Claudette Johnson Joy Labinjo at her studio in London Photograph David LeveneThe Guardian The figures pictured all embody Manchesters radical selfimage they are not all from the city but their lives and work are deeply connected to Manchester and the themes of the Guardians Cotton Capital series  how transatlantic slavery and colonialism shaped the world we live in today Alongside the portraits writers have contributed poems and stories to bring their struggles to life Frederick Douglass and Sarah Parker Remond were African Americans who visited 19thcentury Manchester to make the case for abolition T Ras Makonnen was a Guyanese entrepreneur who played a vital role during the citys landmark PanAfrican Congress of 1945 the groundbreaking historian Eric Williams wrote about the citys cotton traders painting them both as key pioneers in modern capitalism and powerful players who fuelled the slavery economy Black Mancunian activists also feature such as Kath Locke who grew up in the citys PanAfrican milieu before going on to cofound the Black feminist group the Abasindi Cooperative Elouise Edwards who was also an Abasindi member set up the Roots oral history project and festival which sought to instil pride in Black Mancunians while also capturing the origin stories of one of Europes oldest Black communities Len Johnson a communist boxer and activist won 96 bouts in the ring but was prevented from fighting for the British championship on account of his race Outside of the ring he fought the colour bar in Manchester successfully overturning racist practices in the citys pubs The final figure selected is Henry Baker who was enslaved in Barbados among a community of people who had been traded in exchange for Manchester textiles His story is a rare find for historians who were able to trace his journey to the northwest of England where he later worked as a butler Tam Joseph at his studio in Walthamstow London Photograph David LeveneThe Guardian The Trinidadborn artist John Lyons depicted the economist author and politician Eric Williams Tam Joseph created a defiant portrait of Len Johnson while Kimathi Donkor captured the radical spirit of T Ras Makonnen Joseph said he was thunderstruck when he heard the story of Johnson and the racist policy that stopped him from having a title shot in Britain He looks like a very very toughlooking fellow but theres a sadness about him  hes up against this thing that he cannot do anything about it said Joseph He included a reference to the Order of Saint Michael and Saint George an honour that was criticised in 2020 because it includes the image of Saint Michael standing on the neck of a chained Black man portrayed as a devil In Josephs portrait Saint Michael is replaced by Muhammad Ali in the famous pose he made when he knocked out Sonny Liston in their second fight in May 1965 while the devil is replaced by Saint Michael He said Johnson wouldnt have fought any Black people  he would have been knocking out white man so I thought it was appropriate The emerging Black British artist Labinjo composed a vivid blackandwhite portrait of Elouise Edwards in her signature angular style Three artists who were members of the influential Blk Art Group  Claudette Johnson Marlene Smith and Keith Piper  also took part Piper created a digital image of Frederick Douglass while Smith and Johnson constructed sensitive portraits of Kath Locke and Sarah Parker Remond respectively Marlene Smith Photograph David LeveneThe Guardian The Tanzanian artist Everlyn Nicodemus was given the task of tackling Henry Baker I wanted to portray him as a young man dashing beautiful handsome but nonthreatening said the artist Nicodemus ultimately made two portraits of him one to represent the publicfacing servant and the other a shadow vision of the man who lived the final part of his life in Cheshire On Tuesday the Guardians owner issued an apology for the role the newspapers 19thcentury founders had in transatlantic slavery and announced a decadelong programme of restorative justice The Scott Trust said it expected to invest more than 10m US123m A184m with millions dedicated specifically to descendant communities The Guardian has launched an editorial series called Cotton Capital which used academic research into its history as a starting point from which to expand and explore the themes it touched on
https://www.theguardian.com/artanddesign/2023/apr/04/rossettis-review-tate-dante-gabriel-christina,The Rossettis review  lurid lusciouslipped beauties drown out the familys real talent,Tate Britain LondonDante Gabriels paintings are overshadowed by his sister Christinas poetry in this baffling overblown exhibition about the decidedly nonrevolutionary preRaphaelitesIts obvious from the very first room of Tate Britains overblown baf,Its obvious from the very first room of Tate Britains overblown baffling celebration of the radical and revolutionary preRaphaelites who was the real talent in the Rossetti family the poet Chris 5627 chars,Its obvious from the very first room of Tate Britains overblown baffling celebration of the radical and revolutionary preRaphaelites who was the real talent in the Rossetti family the poet Christina Rossetti You can hear readings of her poems here including Colour which praises colours in almost childlike spiritually clear images What is yellow pears are yellow  Rich and ripe and mellow Unfortunately as you listen you are obliged to look at her brother Dante Gabriel Rossettis 184950 painting The Annunciation displayed like the icon it isnt in the middle of the space Where Christinas images have a crystalline exactitude that makes them pretty much timeless this work is strictly for buffs of Victoriana It is like some sort of taxidermy exhibit a leaden quotation of medieval art thats neither properly medieval nor bitingly modern Although this exhibition strives to set her verse alongside his art theres only so far you can go with bringing literature into the gallery via poems printed on walls Her steady quiet voice is drowned out by his lurid paintings of lusciouslipped beauties It looks as if DG never tried to draw anyone or anything freshly from life ever His pseudoRenaissance paintings are heavily worked up concoctions of symbolist erotica  and it turns out his drawings are like that too When he sketches his models who are his lovers he never sticks with what he sees but transfigures them in abstracted simplified lines Not that hes an abstract artist Just an emptily idealising one Surely the reason why he never completed Found is that he knew it was an awful painting The PreRaphaelite Brotherhood were a bunch of soso male artists who got together in 1848 to dress up their art in the borrowed robes of 15thcentury religious fervour and promote themselves as social saviours But the wall text will have us believe they were revolutionaries who wanted to express themselves authentically with art and poetry based on lived experience and nature that they were a group of young men and women in spite of stressing Brotherhood in their name Thus were told that John Everett Millaiss 1850 watercolour A Baron Numbering his Vassals actually depicts the class conflicts of 1840s Britain Really It looks like a placid portrayal of medieval folk to me The show pushes its exaggerated political claims for the preRaphaelites to absurdity in an extended exploration of Rossettis unfinished painting Found in which a woman of the streets who has collapsed against a wall is saved from death by a rustic In a series of halfpainted halfbaked canvases Rossetti dwells on the sensual face of his model Fanny Cornforth in a way that ludicrously undermines the supposed social message of the work The exhibition takes it all with leaden literalism as a radical revolutionary indictment of Victorian capitalism In reality its a collision between Rossettis erotic narcissism and his attempt to create a conscientious painting Surely the reason he never completed Found is because he knew it was awful Dante Gabriel Rossettis Proserpine Photograph Matt Greenwood Tate If there was a preRaphaelite painter who fitted this shows vision of a socialistfeminist critique of the Victorian social order that artist was William Morris not Rossetti Morris actually was a socialist But while he was trying to design Utopia Rossetti was having an affair with and painting his wife Jane And while the morally fervent John Ruskin was praising and buying not only his art but that of his lover and eventual wife Elizabeth Siddal Rossetti was betraying Siddal with Cornforth In its desperation to see the Rossettis as highminded and progressive this exhibition makes a startling factual error A wall text explaining Rossettis 1859 painting Bocca Baciata tells us it illustrates The Decameron a sensual medieval Italian poem by Giovanni Boccaccio The same claim is in the catalogue But there is no medieval poem called The Decameron It is the founding masterpiece of Italian prose a collection of ribald stories thats an ancestor of the modern novel Rossetti in fact is illustrating the seventh tale on the second day of The Decameron in which an eastern princess on her way to marry the Prince of Algarve is shipwrecked before being pursued and in effect raped by a series of men So this painting is very far from the romantic radicalism this exhibition claims for him In portraying his lover Fanny Cornforth as Boccaccios princess he seems rather to be making a dirty joke or sexual boast What a laugh DG Rossetti was no radical pinup but at least he supported Siddal to become an artist Her paintings like his depict Arthurian romances with brightly hued passion But their combination of selftaught naive drawing with preRaphaelite fantasy is often clumsy and inert Then again thats also true of the more technically refined works of the male preRaphaelites skip past newsletter promotion Sign up to Art Weekly Free weekly newsletter Your weekly art world roundup sketching out all the biggest stories scandals and exhibitions Privacy Notice Newsletters may contain info about charities online ads and content funded by outside parties For more information see our Newsletters may contain info about charities online ads and content funded by outside parties For more information see our Privacy Policy  We use Google reCaptcha to protect our website and the Google Privacy Policy and Terms of Service apply after newsletter promotion The exhibition excludes Millaiss Ophelia in which Siddal floats in macabre ecstasy even though its owned by Tate probably because it wants to get away from the myth of Siddal She was a real person  but she quickly became a fantasy figure for Rossetti who cherished a lock of her hair  exhibited here  and later got his friends to open her grave in Highgate Cemetery London Christina had her brothers number Her poem In an Artists Studio printed on a wall here evokes a mysterious model whose face looks out from all his canvases This omnipresent nameless girl haunts the artists work He feeds upon her face by day and night Its the preRaphaelite muse a myth this show signally fails to bust Christina Rossetti sees the role women will always have in her brothers art to be fed on
