URL,Title,Description,Content
https://lifehacker.com/how-to-tell-when-an-artificial-intelligence-is-hallucin-1850280001,How to Tell When an Artificial Intelligence Is Hallucinating,I asked the artificial intelligence chatbot ChatGPT to generate an entertaining introductory paragraph for a blog post about AI hallucinations and heres what it wroteRead more,I asked the artificial intelligence chatbot ChatGPT to generate an entertaining introductory paragraph for a blog post about AI hallucinations and heres what it wrote Picture this an AI system is 5446 chars
https://lifehacker.com/take-easter-eggs-to-the-fiery-depths-of-hell-with-chili-1850313422,Take Easter Eggs to the Fiery Depths of Hell With Chili and Garlic,PostEaster festivities might have you swimming in a sea of colorful eggs In case your boiled egg bounty is getting monotonous Ive got a surefire way for you to spice things up Drag you sanctimonious eggs to hell with hot chiligarlic oilRead more,PostEaster festivities might have you swimming in a sea of colorful eggs In case your boiled egg bounty is getting monotonous Ive got a surefire way for you to spice things up Drag you sanctimoni 2927 chars
https://lifehacker.com/the-out-of-touch-adults-guide-to-kid-culture-is-the-ma-1850309148,The OutofTouch Adults Guide to Kid Culture Is the Mario Movie ActuallyGood,This weeks OutofTouch Adults Guide explores two of the main forces shaping young peoples lives in 2023 America Corporatecreated culture like The Super Mario Bros Movie and Barbie and grassroots expressions of shared humanity like TikToks mouse mome,This weeks OutofTouch Adults Guide explores two of the main forces shaping young peoples lives in 2023 America Corporatecreated culture like The Super Mario Bros Movie and Barbie and grassroots 5527 chars
https://lifehacker.com/how-to-pose-for-the-perfect-mugshot-1850290334,How to Pose for the Perfect Mugshot,Whether youre a legendarily vain plutocrat surrendering to authorities after being charged with multiple financial felonies youve stolen the Mona Lisa from the Louvre or you got popped in Rochester with a bag of weed you should always try to to look your,Whether youre a legendarily vain plutocrat surrendering to authorities after being charged with multiple financial felonies youve stolen the Mona Lisa from the Louvre or you got popped in Rochester 5024 chars
https://www.engadget.com/museum-creates-giant-donkey-kong-cabinet-with-a-little-help-from-nintendo-180205910.html,Museum creates giant Donkey Kong cabinet with a little help from Nintendo,The Strong National Museum of Play in New York unveiled an absolutely massive Donkey Kong arcade cabinet thats nearly 20 feet tall Donkey Kong is costarring in the biggest movie in the world right now so it is only fitting that he also gets an equally g,The Strong National Museum of Play in New York unveiled an absolutely massive Donkey Kong arcade cabinet thats nearly 20 feet tall Donkey Kong is costarring in the biggest movie in the world rig 1264 chars
https://www.engadget.com/cash-app-creator-bob-lee-reportedly-killed-in-san-francisco-stabbing-140418685.html,Cash App creator Bob Lee reportedly killed in San Francisco stabbing,Bob Lee the creator of Cash App and a former Square executive was stabbed to death in San Francisco early Tuesday according to reports  The San Francisco Police Department said a 43yearold sustained apparent stab wounds and died after being tak,Bob Lee the creator of Cash App and a former Square executive was stabbed to death in San Francisco early Tuesday according to reports  The San Francisco Police Department said a 43yearo 1001 chars
https://www.engadget.com/amazon-lays-off-more-than-100-employees-across-its-gaming-divisions-190634108.html,Amazon lays off more than 100 employees across its gaming divisions,Amazons ongoing layoffs now include those more directly involved in game production The company has provided an internal memo from gaming VP Christoph Hartmann originally shared by Bloomberg announcing layoffs of just over 100 employees across gaming di,Amazons ongoing layoffs now include those more directly involved in game production The company has provided an internal memo from gaming VP Christoph Hartmann originally shared by Bloomberg anno 1636 chars
https://www.engadget.com/researchers-built-sonar-glasses-that-track-facial-movements-for-silent-communication-171508573.html,Researchers built sonar glasses that track facial movements for silent communication,A Cornell University researcher has developed sonar glasses that hear you without speaking The eyeglass attachment uses tiny microphones and speakers to read the words you mouth as you silently command it to pause or skip a music track enter a passcode wi,A Cornell University researcher has developed sonar glasses that hear you without speaking The eyeglass attachment uses tiny microphones and speakers to read the words you mouth as you silently comm 2520 chars
https://www.engadget.com/lord-of-the-rings-heroes-of-middle-earth-arrives-may-10th-160018567.html,Lord of the Rings Heroes of Middleearth arrives May 10th,EA will release the mobile freetoplay Lord of the Rings Heroes of Middleearth on May 10th marking its first LOTR game since 2009s The Lord of the Rings Conquest It also unveiled the first real trailer showing gameplay menus and more Its one of fiv,EA will release the mobile freetoplay Lord of the Rings Heroes of Middleearth on May 10th marking its first LOTR game since 2009s The Lord of the Rings Conquest It also unveiled the first rea 1214 chars
https://www.engadget.com/disney-is-bringing-star-wars-return-of-the-jedi-back-to-theaters-on-april-28th-204108642.html,Disney is bringing Star Wars Return of the Jedi back to theaters on April 28th,Star Wars Episode VI  Return of the Jedi is heading back to theaters At its Star Wars Celebrations event in London Disney announced today it would rerelease the classic film in cinemas in the US UK and other parts of the world on April 28th The theatr,Star Wars Episode VI Return of the Jedi is heading back to theaters At its Star Wars Celebrations event in London Disney announced today it would rerelease the classic film in cinemas in the US 1153 chars
https://www.engadget.com/amazon-launches-an-accelerator-to-boost-generative-ai-startups-134746016.html,Amazon launches an accelerator to boost generative AI startups,Amazon may not be known for making generative AI but its eager to help others get their technology up and running Amazon Web Services AWS is launching a generative AI accelerator that will help the most promising startups flourish The 10week program ,Amazon may not be known for making generative AI but its eager to help others get their technology up and running Amazon Web Services AWS is launching a generative AI accelerator that will help  1726 chars
https://www.engadget.com/oneplus-launches-60-nord-buds-2-with-anc-134531414.html,OnePlus launches 60 Nord Buds 2 with ANC,OnePlus launched a second generation of its budget earbuds today The Nord Buds 2 cost 50 percent more than last years original but they offer several upgrades in returnThe Nord Buds 2 still have 124mm titanium drivers but they add active noise cancelati,OnePlus launched a second generation of its budget earbuds today The Nord Buds 2 cost 50 percent more than last years original but they offer several upgrades in return The Nord Buds 2 still have 1571 chars
https://www.engadget.com/sony-investment-will-put-ai-chips-inside-raspberry-pi-boards-083503462.html,Sony investment will put AI chips inside Raspberry Pi boards,Sonys semiconductor division has announced that its making a strategic investment in Raspberry Pi as a way to bring its AI tech to a wider market The idea is to give Raspberry Pi users around the world a development platform for its Aitrios edge computin,Sonys semiconductor division has announced that its making a strategic investment in Raspberry Pi as a way to bring its AI tech to a wider market The idea is to give Raspberry Pi users around th 1543 chars
https://www.engadget.com/apples-third-gen-airpods-are-back-on-sale-for-150-131553863.html,Apples thirdgen AirPods are back on sale for 150,Now that spring is making outdoor walks more of a pleasure you might want some wireless earbuds  and thankfully Amazon is making them more affordable The retailer is again selling Apples thirdgeneration AirPods for 150 or 20 off Thats a recordlow ,All products recommended by Engadget are selected by our editorial team independent of our parent company Some of our stories include affiliate links If you buy something through one of these link 1489 chars
https://www.engadget.com/nvidias-geforce-rtx-4070-comes-with-12gb-of-ram-for-599-130002404.html,NVIDIAs GeForce RTX 4070 comes with 12GB of RAM for 599,True to the leaks NVIDIA has unveiled the standard GeForce RTX 4070  and it might hit the sweet spot provided youre willing to accept the price hikes that have defined the RTX 40 lineup The 599 desktop GPU is considered a successor to the RTX 3070 Ti an,True to the leaks NVIDIA has unveiled the standard GeForce RTX 4070 and it might hit the sweet spot provided youre willing to accept the price hikes that have defined the RTX 40 lineup The 599 d 1670 chars
https://www.engadget.com/e3-2023-has-been-canceled-211201976.html,E3 2023 has been canceled,Microsoft Nintendo Ubisoft and other major players in the game industry have all confirmed that they would have no presence on the E3 2023 show floor Now the event itself wont happen at allAccording to IGN the Entertainment Software Association has begu,Microsoft Nintendo Ubisoft and other major players in the game industry have all confirmed that they would have no presence on the E3 2023 show floor Now the event itself wont happen at all Acc 2291 chars
https://www.engadget.com/apple-tetris-movie-review-123020220.html,Apples Tetris movie trades reallife drama for spy fantasies,No the origins of Tetris didnt involve a highspeed car chase but the true story behind the game still reads like a spy novel Theres corporate intrigue nefarious government agencies and an envious amount of globetrotting But the reality wasnt enough ,The very important role of Tetris of that time was that it started to break down the barrier between people and computers Pajitnov told me in an interview Early on he said people were embarrassed  1962 chars
https://www.engadget.com/google-bard-is-switching-to-a-more-capable-language-model-ceo-confirms-133028933.html,Google Bard is switching to a more capable language model CEO confirms,People havent exactly been impressed in the short time since Google released its experimental conversational AI service Bard Coming up against OpenAIs ChatGPT and Microsofts Bing Chat also powered by OpenAIs GPT4 users have found its responses to no,People havent exactly been impressed in the short time since Google released its experimental conversational AI service Bard Coming up against OpenAIs ChatGPT and Microsofts Bing Chat also pow 2649 chars
https://www.engadget.com/hitting-the-books-flight-paths-rebecca-heisman-harper-publishing-143053788.html,Hitting the Books Sputniks radio tech launched a revolution in bird migration research,Birds fly South for the winter and North for the summer has historically proven to be only slightly less reliable a maxim than the sun always rising in the East and setting in the West Humanity has been fascinated by the comings and goings of our avian ne,Birds fly South for the winter and North for the summer has historically proven to be only slightly less reliable a maxim than the sun always rising in the East and setting in the West Humanity h 16943 chars
https://www.engadget.com/star-wars-jedi-survivor-preview-cal-were-home-150301468.html,Star Wars Jedi Survivor preview Cal were home,About an hour into my time with Star Wars Jedi Survivor Cal Kestis the games protagonist reunites with Greez Dritus the cranky pilot from Star Wars Jedi Fallen Order The two embrace after five years apart one of Greezs four arms now replaced by a ro,About an hour into my time with Star Wars Jedi Survivor Cal Kestis the games protagonist reunites with Greez Dritus the cranky pilot from Star Wars Jedi Fallen Order The two embrace after five 5738 chars
https://www.engadget.com/hitting-the-books-more-than-a-glitch-meredith-broussard-mit-press-143009017.html,Hitting the Books Tech cant fix whats broken in American policing,Its never been about safety as much as it has control serving and protecting only to the benefit of the status quo Clearview AI PredPol Shotspotter theyre all Carolyn Bryant Donhams testimony behind a veneer of technological validity  a shiny black b,Its never been about safety as much as it has control serving and protecting only to the benefit of the status quo Clearview AI PredPol Shotspotter theyre all Carolyn Bryant Donhams testimony 13483 chars
https://www.engadget.com/amazon-kindle-paperwhite-falls-back-to-100-best-tech-deals-this-week-150031378.html,Amazons Kindle Paperwhite falls back to 100 plus the rest of the weeks best tech deals,Its Friday which means its time for another roundup of good tech deals Todays highlights include Amazons Kindle Paperwhite back down to 100 which is within 5 of the popular ereaders alltime low Apples AirPods Pro are 50 off their list price at ,All products recommended by Engadget are selected by our editorial team independent of our parent company Some of our stories include affiliate links If you buy something through one of these link 12546 chars
https://www.wired.com/story/large-language-model-phishing-scams/,Brace Yourself for a Tidal Wave of ChatGPT Email Scams,Thanks to large language models a single scammer can run hundreds or thousands of cons in parallel night and day in every language under the sun,Heres an experiment being run by undergraduate computer science students everywhere Ask ChatGPT to generate phishing emails and test whether these are better at persuading victims to respond or cli 6180 chars
https://www.wired.com/story/porn-age-checks-id-laws/,Porn ID Laws Your State or Country May Soon Require Age Verification,An increasing number of states are passing ageverification laws Its not clear how theyll work,For the past three months anyone who lives in Louisiana and opens up Pornhub has been met with a new prompt The states laws it says require people who want to watch pornography to prove they are  3285 chars
https://www.wired.com/story/the-call-to-halt-dangerous-ai-research-ignores-a-simple-truth/,Why Halt AI Research When We Already Know How To Make It Safer,The Open Letter proposing a pause on giant AI experiments exaggerates hypothetical future harms while ignoring steps that can be taken immediately to mitigate them,Last week the Future of Life Institute published an open letter proposing a sixmonth moratorium on the dangerous AI race It has since been signed by over 3000 people including some influential m 4728 chars
https://www.wired.com/story/pinduoduo-malware-security-roundup/,Pinduoduo a Top Chinese Shopping App Is Laced With Malware,Plus 119 arrested during a sting on the Genesis darkweb market the IRS aims to buy an online mass surveillance tool and more,A United States Immigration and Customs Enforcement database WIRED obtained through a Freedom of Information Act request shows that the agency has been leaning on a certain type of administrative sub 5546 chars
https://www.wired.com/story/super-mario-bros-movie-new-generation-video-games/,This Super Mario Bros Movie Is Destined to Sell Tons of Games,The animated adaptation of Nintendos iconic franchise is practically guaranteed to lure in a new generation of gamers Thats the point,The Monitor is aweekly columndevoted to everything happening in the WIRED world of culture from movies to memes TV to Twitter The Super Mario Bros Movie introduces its namesake duo with a commer 3992 chars
https://www.wired.com/story/internet-archive-copyright-library/,The Internet Archives Literary Civil War,The beloved online athenaeum just lost a big court case Librarians fear itll make ebooks less accessible So why are some writers cheering,A lesson I learned early in life never piss off a librarian Apparently District Court Judge John G Koetl skipped out on a formative traumaticshushing experience because his recent ruling against 3804 chars
https://www.wired.com/story/pope-coat-artificial-intelligence-internet-trust/,The Popes Coat Is Here to Ruin Your Faith,In the internet Ruin your faith in the internet,The Monitor is aweekly columndevoted to everything happening in the WIRED world of culture from movies to memes TV to Twitter Future generations will acknowledge the vibe shift It happened last  3398 chars
https://www.wired.com/story/platforms-design-ux-affordances/,Theres No Such Thing as a OneSizeFitsAll Web,Need a cure for widespread platform malaise For inspiration look to the trusty spreadsheet,Of course creativity often flourishes in digital platforms very specific formats Vines sixsecond videos are perhaps the most famous example of innovation under extreme creative limits In recent y 3581 chars
https://www.wired.com/review/nix-hydration-biosensor/,Nix Hydration Biosensor Review Unlocking the Science of Sweat,Nixs wearable sensor promises to give cyclists and runners realtime hydration advice by analyzing their fluid loss while they work out,In a world where unmanned spacecraft have landed on Mars and artificial intelligence can read your mind one would think someone would have figured out a precise way to measure how much athletes shou 3793 chars
https://www.wired.com/story/goopcore-body-horror-age-of-instagram-face/,Body Horror in the Age of Instagram Face,Two new novels Ling Ling Huangs Natural Beauty and Allie Rowbottoms Aesthetica fuse gore with the world of beauty and wellness Call it Goopcore,Annas relationship with her mother is vexed and tender as is a friendship she renews with a childhood pal their disappointment in the lifestyle shes pursuing underlines how much potential others se 4637 chars
https://www.wired.com/story/space-archeology-international-space-station/,How Do People Live in Orbit Ask the Space Archeologists,An innovative research project delivers new evidence about the challenging life of astronauts on the International Space Station,Archaeologists have probed the cultures of people all over the Earthso why not study a unique community thats out of this world One team is creating a firstofitskind archaeological record of life 3643 chars
https://www.wired.com/story/paris-escooter-ban/,Paris Fell in Love With Escooters Now It Might Ban Them,Weaving through traffic and protests in the French capital shows that the real problem isnt scootersits cars,Atop my escooter I am a human in a city of apes With my back straight I tower above my fellow roadusers who are hunched over car steering wheels and bike handles This newfound poise however la 2715 chars
https://gizmodo.com/tron-merch-walt-disney-world-tron-legacy-disney-parks-1850301695,Tron Merch at Walt Disney World Offers SciFi Fits Retro Toys and Custom Figures,Walt Disney Worlds new Tron merchandise capitalizes on Flynns arcade and the Grid with futuristic gear programinspired toys and throwback fashion Read more,Walt Disney Worlds new Tronmerchandise capitalizes on Flynns arcade and the Grid with futuristic gear programinspired toys and throwback fashion io9 attended a preview of new attraction Tron L 284 chars
https://gizmodo.com/amazon-studios-joe-quesada-marvel-comic-book-tv-movies-1850284817,Amazon Studios Beefs Up Its Comic Book Bona Fides With Former Marvel EditorinChief,Amazon Studios has signaled its intention to be an even bigger player in the world of comic book series and films by signing Joe Quesada former Marvel editorinchief to an exclusive firstlook dealRead more,Amazon Studios has signaled its intention to be an even bigger player in the world of comic book series and films by signing Joe Quesada former Marvel editorinchief to an exclusive firstlook dea 1828 chars
https://gizmodo.com/google-flight-price-guarantee-announcement-travel-1850294447,Google Could Be Setting Itself Up for Failure With New Flight Price Guarantees,Google is taking a bold step in the world of online travel planning The tech giant is piloting a price guarantee for airline bookings Now certain flights departing US airports will come with a moneyback promise If a Googleguaranteed ticket price gets ,Google is taking a bold step in the world of online travel planning The tech giant is piloting a price guarantee for airline bookings Now certain flights departing US airports will come with a m 5085 chars
https://gizmodo.com/mario-bros-movie-social-media-impressions-1850292276,First Mario Bros Movie Reactions Say It Brings Fan Service But Not Much Else,There was never going to be a world where Illuminations Super Mario Bros movie wasnt going to be a big deal But after that initial reveal where Chris Pratt got announced to play Mario alongside Charlie Days Luigi and Jack Blacks Bowser the energy aroun,There was never going to be a world where Illuminations Super Mario Bros movie wasnt going to be a big deal But after that initial reveal where Chris Pratt got announced to play Mario alongside Cha 1772 chars
https://gizmodo.com/rich-people-s-swimming-pools-are-making-water-scarce-1850329294,Rich Peoples Swimming Pools Are Making Water Scarce,As the world gets warmer and droughts grip cities from Madrid to Shanghai it can seem like were headed for a Mad Maxstyle future where water is a scarce resource Were already starting to see a version of this as regular Californians make water cuts while,As the world gets warmer and droughts grip cities from Madrid to Shanghai it can seem like were headed for a Mad Maxstyle future where water is a scarce resource Were already starting to see a ver 3711 chars
https://gizmodo.com/loewe-minecraft-pixel-fashion-clothes-hoodie-paris-week-1850323505,Now You Can Pay Thousands of Dollars to Look Like Minecraft Steve,Your favorite retro games will never look as good as you remember unless you play them on an old tube TV whose analog technology helped to smooth out the pixelated graphics of the 8 and 16bit gaming eras Or you can just embrace the pixelation which is wha,Your favorite retro games will never look as good as you remember unless you play them on an old tube TV whose analog technology helped to smooth out the pixelated graphics of the 8 and 16bit gaming 1074 chars
https://gizmodo.com/best-e3-moments-funny-sega-nintendo-sony-microsoft-xbox-1850288856,Remembering E3s Most Ridiculous and Heartwarming Moments,Pour one out for what was once the biggest video game showcase on the planet On Thursday The Entertainment Software Association the organization that manages the Electronic Entertainment Expo formally announced it was canceling both E3s digital and physi,Pour one out for what was once the biggest video game showcase on the planet On Thursday The Entertainment Software Association the organization that manages the Electronic Entertainment Expo for 1291 chars
https://gizmodo.com/dwayne-johnson-moana-disney-live-action-the-rock-1850294680,Disney and Dwayne Johnson Announce Moana LiveAction Movie,In a surprising turn of events Dwayne Johnson and Walt Disney Pictures are fasttracking a liveaction adaption of their Disney Princess tale Moana Johnson will reprise his role as MauiRead more,In a surprising turn of events Dwayne Johnson and Walt Disney Pictures are fasttracking a liveaction adaption of their Disney Princess taleMoana Johnson will reprise his role as Maui The origin 2487 chars
https://gizmodo.com/why-cant-we-desalinate-ocean-water-drinking-1849556882,The Promisesand Perilsof Ocean Desalination,Sean Bothwell can understand why people think desalination is a silver bullet When he was a kid living in Californias Orange County the ocean was always close by It didnt make sense to him that all the water near him wasnt usableRead more,Sean Bothwell can understand why people think desalination is a silver bullet When he was a kid living in Californias Orange County the ocean was always close by It didnt make sense to him that al 13521 chars
https://gizmodo.com/hoverboard-recall-jetson-electric-bikes-1850284842,The Hoverboards Are Still Exploding,The infamous twowheeled motorized scooters colloquially known as hoverboards are still proving dangerous almost a decade after their peak The United States Consumer Product Safety Commission has issued a recall of a hoverboard from Jetson Electric Bikes a,The infamous twowheeled motorized scooters colloquially known as hoverboards are still proving dangerous almost a decade after their peak The United States Consumer Product Safety Commission has is 1696 chars
https://gizmodo.com/anya-taylor-joy-furiosa-mad-max-captain-america-set-bts-1850285442,Anya TaylorJoy Promises Her Furiosa Prequel Is Epic,David Cronenberg is set to start filming what will likely be another horror masterpiece in April and Im looking forward to The Shroud more than Im looking forward to my next birthday From the Spiderverse Thomas Hayden Church who played the Sandman in v,David Cronenberg is set to start filming what will likely be another horror masterpiece in April and Im looking forward to The Shroud more than Im looking forward to my next birthday From the Spide 7113 chars
https://gizmodo.com/chatgpt-dall-e-free-ai-art-should-watermark-results-1850289435,ChatGPT and DallE Should Watermark Their Results,Shortly after rumors leaked of former President Donald Trumps impending indictment images purporting to show his arrest appeared online These images looked like news photos but they were fake They were created by a generative artificial intelligence syst,Shortly after rumors leaked of former President Donald Trumps impending indictment images purporting to show his arrest appeared online These images looked like news photos but they were fake The 7951 chars
