URL,Title,Description,Content,full_content
https://www.theguardian.com/society/2023/apr/05/the-war-against-wild-toileting-stop-weeing-street-urinating,The war against wild toileting is there any way to stop people weeing  and worse  in the street,Public peeing has become commonplace with some men even urinating through letterboxes Why has it become so popular and can splashback paint put a stop to itWhen Paul came down the communal stairs at his block of flats in Soho central London he was faced ,When Paul came down the communal stairs at his block of flats in Soho central London he was faced with the sight of a young man outside urinating against the glass front door The man was too drunk 12582 chars,When Paul came down the communal stairs at his block of flats in Soho central London he was faced with the sight of a young man outside urinating against the glass front door The man was too drunk to notice Paul standing there so Paul had to wait in the lobby until the man had finished Living in an area surrounded by pubs and bars means dealing with public urination  and worse  is something he has grown used to It becomes normalised he says But that doesnt mean its right His family are from Soho and he says a lot of visitors arent aware there is a community who live there When people realise and are apologetic he doesnt mind so much  it feels thoughtless rather than disrespectful Its far worse he says when you get people who are just belligerent or rude Public toileting  or wild toileting as it has been called like an antisocial version of wild swimming  has been a growing concern particularly since Covid closed public loos many never to reopen That comes on top of a longerterm decline in public facilities  Raymond Martin managing director of the British Toilet Association estimates we have lost 50 of public toilets in the past 10 years Meanwhile cashstrapped councils streetcleaning budgets have been under pressure as costs of cleaning particularly during the pandemic have risen And according to a report by the Association for Public Service Excellence public satisfaction at cleaning is at its lowest in five years Martin had a meeting last year he says with the London assembly part of the Greater London Authority to try to get more public loos built or reopened Street urination is everywhere now he says because toilets were closed so people were being forced to go wherever they needed to go  alleyways street corners whatever Now youve got this smell and staining on the streets Thats just urination never mind the defecation side of things Its a major problem In recent years many politicians have called for a renewed focus on public toilets with limited success This year Labour London assembly members rejected an amendment tabled by the Green party that proposed spending 20m on new toilets at underground stations An increasingly rare sight  a functioning public toilet Photograph George ClerkGetty ImagesiStockphoto Perhaps we grew more accustomed to wild toileting during the pandemic  sales of Shewees for instance the device that allows women to stand while peeing and therefore pee where men pee have boomed 700 since the first lockdown  and it has taken us a while to return to normal standards It has always been a problem when large numbers of people descend on a place such as the visitors to Cheltenham races last month For 51 weeks of the year in Cheltenham no one would urinate against a wall in public at 1030 in the morning says Max Wilkinson a Cheltenham borough councillor During race week it seems to be something that happens and local people shouldnt be expected to turn a blind eye to it or accept it Its totally disgusting and it shows a lack of respect for our town Residents complain of men urinating in their front gardens and businesses report streams of urine in doorways and down walls It is a very small minority who do this but the impact on the local area is quite profound says Wilkinson People who are going for a wee in what they think is a quiet spot will get a bit of splashback on to their trousers and shoes This year Wilkinson declared as he calls it the War on Wee Public urination has always happened in the town during the races but he says its become more noticeable in recent years and thats despite the fact that more temporary loos have been put in One measure the council tried this year was hydrophobic waterrepellent paint on walls so when people go for a wee in what they think is a quiet spot or up against a wall somewhere in the town centre they will get a bit of splashback on to their trousers and shoes We did a social media campaign and there were posters all around town letting people know that its not acceptable Wilkinson says no fines were handed out in 2022 even though there were numerous complaints from residents and photographs posted on social media of men urinating on streets and in parks Making a dash for it  a race on Gold Cup day at Cheltenham last month Photograph Sam MellishGetty Images He has witnessed it himself I saw a group of blokes walking past the postal sorting office which isnt a long way from the town centre There were cars in stationary traffic less than 20 yards away they took one look at each other and decided to go for a wee against the wall This was in the morning Its disgusting and its got to stop Police said they were cautiously optimistic that antisocial behaviour had reduced in Cheltenham this year including complaints about public urination In Soho in central London residents have reported people peeing through their letterboxes says Tim Lord chair of the Soho Society On one of the worstaffected streets residents of one block reported that in the summer in particular people were urinating all along into the doorways of those flats on the ground floor Their kids saw mens genitals it was appalling The whole of Soho in the summer smells of urine and has done for three or four years Business rates of 200m are raised in the area he says much of that is from pubs and bars If youve got an area which is incredibly economically productive some of the money that generates should be spent to mitigate the problems its likely to cause  it always used to be and now isnt That seems to be fundamentally wrong Lord has lived in the area for more than 30 years For many years we had two quite large underground public toilets he says He lived near one of them It always used to be open from 10am till 2am and was quite well run quite clean About 10 or 15 years ago I noticed that they werent looking after it and it was closing earlier I thought that doesnt make sense Soho has a lot of alcohol licences about 400 in a quarter of a square mile Good public toilets he says are really an important part of Sohos ability to function Its not just the drinkers  many of whom will be tourists bringing money to the area  using them but market traders and homeless people Its another humiliation for the homeless people that theres nowhere they can go Both public toilets closed during the pandemic and didnt reopen though there are plans to refurbish one of them We now have very ugly temporary toilets which cost 15000 every weekend from Thursday says Lord The council have also introduced hydrophobic paint along with posters pleading with people not to urinate on the street There is an acknowledgement that theres a problem says Lord but then theyre still closing one of the large underground public toilets There appears to be no medium to longterm sensible plan The temporary toilets have decreased the level of public toileting he says but theyre pretty ugly We ask the council is that the plan for ever And theres no answer to that question Lord is sceptical about what he describes as the pee paint  would drunk people notice or care about their urine being splashed back on to them he wonders You could be fined under the Public Order Act if you are caught urinating in public or even punished for indecent exposure Other towns and cities have tried different measures Public openair GreenPee urinals that double as planters have been installed in Amsterdam and in Belgian cities In the GreenPee urinalcumplanter urine is absorbed by hemp  a single urinal can cope with up to 300 toilet visits It is taken away for composting and can later be used to fertilise public parks Paris home of the pissoir now has the Uritrottoir an eco urinal installed in areas of high public urination which also harvests urine for compost Lyon has considered women and trialled composting sitdown urinals not only did they save water compared with flushing toilets but the deputy mayor said that in the trial of 16 units 35000 litres of urine had been collected to use as fertiliser in less than three months And last year officials in Boston in the US decided to trial sensors in lifts on the transport system that would alert cleaning crews to the presence of urine In England and Wales the law is technically on the side of the War on Wee You could be fined under the Public Order Act if you are caught urinating in public or even punished for indecent exposure under the Sexual Offences Act of 2003 should you be found guilty of exposing your genitals and intending to cause alarm or distress In Scotland where public urination comes under the Civic Government Act police recorded 1222 urination offences in 2021 Nowhere to go  derelict public toilets in north London Photograph Gary Colet PhotographyGetty Images But unless a police officer happens to be passing the vast majority of public urination instances are not reported Max Wilkinson points out that he reviews social media for complaints from local residents because thats now a popular way for people to report it Social media users have even shared video doorbell footage of people urinating in front gardens in a bid to publicly shame individuals Some have complained to parcel or food delivery companies that their employees have been caught urinating on their property though this is more likely because of a lack of proper breaks and access to facilities rather than disrespect or lax hygiene Apart from being unpleasant wild toileting comes with more serious implications As Wilkinson says witnessing someone relieving themselves in public can feel threatening to a lot of women and to men too Urine can erode buildings and create pollution While the ecological impact of public toileting in towns and cities remains understudied its reasonable to believe it may have a detrimental effect on nearby waterways Dr Christian Dunn senior lecturer in natural sciences at Bangor University led a study to measure the presence of drugs in the nearby river during and after Glastonbury festival and found cocaine levels high enough to potentially harm wildlife downstream  contamination caused by public toileting The problem with chemicals in urine entering our rivers is that they help create a cocktail of drugs in our waters  and we have very little knowledge of what the effects of this everchanging mix are on aquatic wildlife ecosystems and ultimately our own health Dunn says We can research the effects of one particular chemical such as cocaine on one species like eels but the situation in our rivers is much more complex  there are many chemicals and compounds reacting with entire ecosystems with short and potentially longterm effects Wetlands he says can help mitigate these risks Existing between rivers and land they act as ecological kidneys says Dunn and could help filter out harmful chemicals but these have been decimated over the centuries as weve strived to use every bit of land in the UK for building or farming We should be looking to reestablish these wetlands along all our rivers  in the countryside and even our cities And then there are hygiene issues The pandemic reminded us of the importance of cleanliness says Martin of the British Toilet Association but we are not creating the infrastructure to support it Weve got to get our hygiene levels back up to not only where they were but way beyond that That means things like flushing toilets rather than urinating in the street and people being able to wash their hands Epidemics fuelled the rise of public toilets in the first place says Lee Jackson historian and author of Dirty Old London The Victorian Fight Against Filth The Victorians were the first people to try to deal with public urination They did that off the back of the cholera epidemics of 1832 and 1848 where anything that seemed insanitary had the worry that it brought contagious disease he says Measures such as commit no nuisance signs builtin deflectors on temptingly discreet walls of buildings and castiron urinals  many incredibly ornate  started to appear on streets few of the urinals survive in London but Jackson says Birmingham is a good place to spot them Public toilets for women didnt really come in until the late 1880s says Jackson Conveniences were part of that late Victorian thing of municipal socialism  public libraries baths and toilets  this idea that we have these things built for regular people he says Sadly and maddeningly for anyone caught short that lovely idea now feels as quaint and fanciful as an ornate urinal
https://www.theguardian.com/money/2023/apr/03/how-to-save-money-on-having-your-hair-done,How to save money on having your hair done,Like any other service there are deals to be done  from colouring to cutting The cost of looking after your hair can add up to hundreds of pounds a year with prices for women averaging about 50 for a cut 35 for a blowdry and more than 80 for highlights,Switch hairdresser The cost of looking after your hair can add up to hundreds of pounds a year with prices for women averaging about 50 for a cut 35 for a blowdry and more than 80 for highligh 5850 chars,Switch hairdresser The cost of looking after your hair can add up to hundreds of pounds a year with prices for women averaging about 50 for a cut 35 for a blowdry and more than 80 for highlights according to recent figures from the Hair and Beauty Industry Authority Habia But like any service you can shop around for the best deal There are thousands of hairdressers to choose from and a small local salon may offer a much cheaper rate than a chain Compare prices and ask for cheaper recommendations in your neighbourhood on sites such as Nextdoor and your local Facebook and WhatsApp groups Many hairdressers also offer new customers money off their first cut  perhaps 25  so you can try out different salons and get a discount Meanwhile during the current cost of living crisis some hairdressers have been offering pay what you can afford and even free haircuts to struggling customers Downgrade your stylist Ask for a junior as they are usually a much cheaper option than a senior stylist with years of experience The difference in price can be hundreds of pounds depending on what you have done These stylists are fully trained and usually eager to do a good job and more experienced hairdressers will typically check that they dont make any big mistakes Joan Scott chief executive of Habia says Look at the treatment and service menu and see if theres a more affordable option If youre not sure ask your salon what options are available within your budget Be flexible If you are able to get your hair done on weekday for example or on a particular evening you may save a small fortune Hairdressers often run discount days or offer cheaper prices during quieter times such as midmorning When you are making an appointment ask when their cheaper times are and what they suggest for the best deal If you are really flexible leave it to the last minute and a hairdresser may be able to offer a hefty discount for a vacant appointment Discounts and cashback Search Groupon for salons offering discounts Go to the website enter your area and search for the service you are after There are usually lots of deals on offer This week when we looked a deal on Groupon offered balayage a hair colouring technique with a wash cut and blowdry for 39 instead of 125 at a central London salon You could also try Wowcher which works in a similar way and was this week offering deals such as savings of up to 79 on a keratin hair treatment Cashback sites such as TopCashback are a goto when it comes to hair products offering money back on wellknown brands such as Sephora Boots and Superdrug As with any product compare prices in discount stores supermarkets and pharmacies to make sure you get the lowest price Be a model Search for salons that need models for their trainee hairdressers An experienced stylist will be present for the process to avoid any disastrous mistakes For example Toni  Guy often wants volunteers at its London and Manchester salons to get a cheap cut from its supervised academy students You could get your hair cut from as little as 10 in a top salon this way You can sign up to be a cut and colour model at the Vidal Sassoon teaching academy in London but be aware that you are asked to leave a minimum of three hours for the appointment When we looked the London Hairdressing Academy was offering a range of discounted services such as a wash cut and finish for 11 or 35 for a full head of highlights if you are booking with one of its students However perhaps not surprisingly in the current cost of living crisis the model slots often get booked up quickly You may also find that your area has a local beauty college that offers cheap cuts Loyalty schemes Some salons such as Headmasters run loyalty schemes and plenty are offering discounts to help customers during the cost of living crisis You can sign up online and get a Headmasters card offering 25 off all services from Monday to Friday 9am4pm and 10 at other times It also has a referafriend scheme offering 40 off a cut and style for you and your friend If you are already a regular at a particular salon check you are signed up to any loyalty scheme it offers There may be other discounts too such as complimentary blowdry appointments to try the service before you book Do it yourself You may have already tried cutting or colouring your hair at home during the pandemic lockdowns when hairdressers shut up shop If you did you will probably have discovered its not as easy as it looks However if you want to give it a go there are plenty of videos online such as this one that guide you through the haircutting process You can order professional hairdressing scissors online which are specially angled for a sharper cut Also if you spend a lot on hair products or pay for conditioning treatments at the salon get creative and make your own You can make an effective hair mask out of egg avocado and olive oil Search online for inspiration A mobile hairdresser Plenty of selfemployed hairdressers have set up a mobile service or work in their own homes for a fraction of salon prices As they dont have to pay salon overheads they are usually substantially cheaper They can also be useful if you struggle to find time to go the hairdresser and want a more convenient and relaxing experience Many offer appointments outside salon hours too such as on Sundays or after 6pm Search for your local mobile hairdresser at Your Local Hairdresser Watch out for extras Hairdressers often try to sell you styling products or special conditioning treatments when you are at the salon But these typically add a lot to your bill so make sure to opt out if you are asked and doublecheck that you are not being charged for extras at the till You could also ditch your regular extras to cut costs If you usually have a blowdry for example go without Go for a damp cut and dry your hair at home
https://www.theguardian.com/business/2023/apr/02/jams-strikes-and-engineering-work-add-up-to-an-easter-holiday-bunfight,Jams strikes and engineering work add up to an Easter holiday bunfight,Transport operators expect cracking takings despite strikes at home and in France plus chaos on road and railWith the approach of the Easter holiday weekend comes the timehonoured question immortalised by the Clash should I stay or should I go To which t,With the approach of the Easter holiday weekend comes the timehonoured question immortalised by the Clash should I stay or should I go To which the answer has long been how about neither Those  4208 chars,With the approach of the Easter holiday weekend comes the timehonoured question immortalised by the Clash should I stay or should I go To which the answer has long been  how about neither Those who choose to holiday in rainy Britain will be grappling with record traffic jams or a semifunctioning railway handily axed at its London roots by seasonal engineering works Trips abroad must be navigated via strikes at Heathrow and whatever French air traffic controllers decide to do hint strike Home or away the cost of travel and accommodation has surged The good news for holidaymakers and businesses that cater for them is that the logistics are looking better than last Easter when there appeared to be no easy way to flee these islands However despite PO Ferries being back and sailing  after the pause in 2022 for it to illegally fire all its crew and employ cheap foreign labour on shortterm contracts  those opting to leave the country via the Port of Dover quickly ran into another traffic jam on Friday with coach traffic facing significant delays POs Pride of Canterbury ferry docked at Dover last Easter as all services were halted Photograph Ben StansallAFPGetty Images Meanwhile airlines and airports believe they have by and large managed to recruit enough people on slightly better pay to get their booked passengers away after the rude awakening of last Easter when staff shortages led to huge queues delays and widespread cancellations  Flight numbers are returning to preCovid levels as the recovery continues for airlines In total about 44000 flights will take off from UK airports over this twoweek school holiday period potentially carrying up to 8 million passengers with Dublin Amsterdam Mlaga Palma and Alicante the most popular destinations Easter weekend will be about 12 busier than last year but still 12 down on 2019 figures according to aviation analytics firm Cirium EasyJet which will operate more than 20 of those flights has said it expects flying to be back at prepandemic levels by the summer months Those who hoped to travel by train between London Birmingham and Manchester will find the west coast mainline closed at Milton Keynes for engineering work So airports are only going to get busier Heathrow has more or less ruled out imposing any kind of capacity cap  as it did last summer with a 100000passengersaday limit But it has invited airlines to stop selling flights for the Easter period as it rides out a strike by security staff and has made British Airways cancel about 5 of its flights from Terminal 5 which is in the eye of the industrial storm Unions say disruption is inevitable if Heathrow doesnt increase its pay offer but as the strike got under way this weekend the airport seemed to be winning Boss John HollandKaye who is soon destined for the exit and recently sported the kind of purple company polo shirt that reminds you why chief executives wear suits told TV cameras that the everyday airport hell behind him was Heathrow running entirely as normal Airlines such as Ryanair and easyJet appear to be more worried about France where air traffic controllers are reportedly ready to walk out daily throughout April with as little as 24 hours notice So home it is According to VisitEngland 65 million Brits are planning an overnight trip in the UK over the Easter weekend with about half that number again still pondering whether to take their chances with weather traffic and trains Next Saturday will be the busiest day with 8 million leisure drivers on the roads according to the AA Rail strikes at least have been paused although those who hoped to travel between London Birmingham and Manchester over Easter will find the west coast mainline closed at Milton Keynes for engineering work That might spare more scrutiny of FirstGroup and its intercity Avanti service which remains under threat of renationalisation for poor performance along with sister operator TransPennine the scale of whose daily sneak cancellations were recently exposed again by the rail regulator Nonetheless be it train boat or plane transport firms profit forecasts are up as they trust in the publics inability to sit quietly in a room with the heating off rather than hit the M6 or book a Ryanair flight As sure as eggs is eggs well sally out again
