URL,Title,Description,Content,full_content,topic
https://www.cnn.com/travel/article/time-world-greatest-places-2023/index.html,The worlds greatest places of 2023 according to TIME,Gather round some hot new travel inspo just dropped TIME magazine has just released its annual list of the Worlds Greatest Places and were here to tell you the where the why and the what behind its picks,Editors Note Sign up for Unlocking the World CNN Travels weekly newsletter Get the latest news in aviation food and drink where to stay and other travel developments Gather round some hot new 5578 chars,Editors Note Sign up for Unlocking the World CNN Travels weekly newsletter Get the latest news in aviation food and drink where to stay and other travel developments CNN  Gather round some hot new travel inspo just dropped TIME magazine has just released its annual list of the Worlds Greatest Places and were here to tell you the where the why and the what behind its picks The nominations came from TIMEs international network of correspondents and contributors which were then vetted by the publications editors who also combed through local news from the Arctic Circle to Brisbane Australia to find the mostbuzzedabout openings Emma Barker Bonomo senior editor at TIME tells CNN Travel The list we selected reflects a couple big trends in travel right now sustainability and authenticity Many locations on this list are finding ways to let tourists visit with a more limited environmental impact And many have responded to travelers desire to have unique local experiences by offering indigenousled tours or curated home stays Heres our pick of their picks  and you can see the full list at the bottom of the story The Americas Ollantaytambo Peru Not just a Machu Picchu pit stop CarmenAdobe Stock Canadas Vancouver is known for outdoor adventure but its the indoor attractions that are catching TIMEs eye this year The city just got its first Michelin Guide the first Canadian city after Toronto to do so and the Chinese Canadian Museum will open in Vancouvers historic Chinatown this summer The little city of Bozeman Montana is turning into a Rocky Mountain hub says TIME following a rush of pandemic relocation Downtown is experiencing a growth spurt with boutique fitness and yoga studios alternative healthcare outposts  and highend beauty stores  setting up shop Washington DC wins praise for its stylish new hotels and booming arts and culture scene while Puerto Ricos Rio Grande offers Americans the chance to visit the rainforest without leaving the country And theres more to Guadalajara Mexico than mariachi and tequila says TIME In November itll become the first Latin American destination to host the Gay Games worldwide sporting event Chiles Torres del Paine National Park is the place to go for a puma safari while the village of Ollantaytambo in Perus Sacred Valley deserves to be a destination in its own right says TIME rather than just a stopover on the way to Machu Picchu Visit it for crowdfree ruins sustainable accommodation options and authentic local restaurants Europe Pantelleria Italys new Mediterranean destination island Giuseppe AnelloAdobe Stock We all know about the mustard but Dijon France has longstanding culinary clout beyond yellow condiments In 2022 it launched its Cit Internationale de la Gastronomie et du Vin a mammoth 16acre site dedicated to the glories of French cuisine Italys newest national park opened in 2016 on Pantelleria kickstarting this quiet islands transformation into a yearround adventure destination Its easier to get to now too there are new summer flights from Rome and Milan Timisoara Romania is a 2023 European Capital of Culture and will be celebrating with an array of concerts exhibits and festivals The Albanian town of Berat was a place of refuge for the countrys Jews during World War II and unusually the countrys Jewish population actually increased during the conflict Exceptional hospitality is still key to the local culture says TIME AsiaPacific South Koreas Jeju Island Not just for locals Shutter DinAdobe Stock Australias Kangaroo Island was devastated by the bushfires of 20192020 with many animals lost but this wildlife haven is now lush with greenery and signs of recovery and hope are everywhere The Tuamotu Archipelago in French Polynesia is a goto destination for worldclass surfing scuba diving and snorkeling says TIME and just an hours flytime from the capital of Papeete The city of Nagoya is near the newly opened Ghibli Park Japans new blockbuster theme park attraction But its also a great place to surround yourself in nature particularly during the April cherry blossom season South Koreas resort island of Jeju has long been a domestic favorite but now the Netflix Kdrama Our Blues has shone an international light on it too Its a good time to head there before everyone else does Family thrills are what TIME is celebrating in Phuket Thailand while Ladakh India has just become home to the countrys first Dark Sky Reserve in Hanle village Middle East and Africa Aqaba is Jordans only coastal city and the regions stunning landscape appeared as the planet Arrakis in Dune the second installment of which will be released this year Musanze Rwanda is the gateway to Volcanoes National Park which has just announced expansion plans and is home to rare mountain gorillas Finally all odds are on Sierra Leone to explode on the adventure travel scene says TIME and the vibey coastal capital of Freetown is sure to be the center of the action All of TIMEs Worlds Greatest Places of 2023 Tampa Florida Willamette Valley Oregon Rio Grande P R Tucson Arizona Yosemite National Park California Bozeman Montana Washington DC Vancouver Churchill Manitoba Dijon France Pantelleria Italy Naples Italy Aarhus Denmark St Moritz Switzerland Barcelona Timisoara Romania Sylt Germany Berat Albania Budapest Vienna Brisbane Australia Kangaroo Island Australia Dominica Mexico City Guadalajara Mexico Torres del Paine National Park Chile Pantanal Brazil Medelln Colombia Ollantaytambo Peru Roatn Honduras Ladakh India Mayurbhanj India Kyoto Nagoya Japan Isan Thailand Phuket Thailand Jeju Island South Korea Luang Prabang Laos Giza and Saqqara Egypt Chyulu Hills Kenya Musanze Rwanda Rabat Morocco Dakar Senegal Loango National Park Gabon Freetown Peninsula Sierra Leone The Red Sea Saudi Arabia Aqaba Jordan Jerusalem Sharjah UAE Tuamotu Archipelago French Polynesia,entertainment
https://www.cnn.com/2023/03/23/entertainment/queen-charlotte-bridgerton-trailer/index.html,Queen Charlotte A Bridgerton Story trailer offers deeper look into her origin story,The Queen of England is ascending the throne in the official trailer for Netflixs Bridgerton prequel series Queen Charlotte A Bridgerton Story,The Queen of England is ascending the throne in the official trailer for Netflixs Bridgerton prequel series Queen Charlotte A Bridgerton Story India Amarteifio stars as a younger version of Golda  1615 chars,CNN  The Queen of England is ascending the throne in the official trailer for Netflixs Bridgerton prequel series Queen Charlotte A Bridgerton Story India Amarteifio stars as a younger version of Golda Rosheuvels sharpwitted Queen Charlotte to whom viewers were first introduced in 2020 when the Regencyera series Bridgerton premiered on the streamer The new trailer released on Thursday opens with Queen Charlotte wondering why King George Corey Mylchreest the King of England and his royal family want her to wed the king in an arranged marriage From left Hugh Sachs and Golda Rosheuvel in Queen Charlotte A Bridgerton Story Liam DanielNetflix It is time we were united as a society Princess Agusta Michelle Fairley says to the young queen in the trailer insisting that she makes as many babies as possible Centering on the young Queen Charlottes rise to prominence and power the series follows her journey as her marriage to King George sparked both a great love story and a societal shift creating the world of the Ton inherited by the characters in Bridgerton according to Netflix Queen Charlotte is later seen trying to escape the royal grounds by climbing over a wall when she comes face to face with King George himself I realize you have no reason to like me he later says But if you give me one evening of your time it might make you hate me a little bit less From left India Amarteifio and Sam Clemmett in Queen Charlotte A Bridgerton Story Liam DanielNetflix Clips of steamy romance scenes choreographed dance numbers in a grand ballroom nefarious courtiers and an opulent royal wedding are teased throughout the trailer as Queen Charlotte is seen trying to navigate her new marriage and her place in history Rosheuvel Adjoa Andoh and Ruth Gemmell will reprise their Bridgerton roles in the series alongside new characters played by Fairley Sam Clemmett and Freddie Dennis Queen Charlotte A Bridgerton Story will be available to stream on Netflix on May 4,entertainment
https://www.cnn.com/travel/article/travel-news-long-haul-secrets/index.html,Longhaul secrets When to eat whether to remove shoes and why you might fart more,In our latest CNN Travel roundup we bring you the airports offering the best customer experience the cruise ship where you can live on board for 30000 a year and why youre more likely to fart when your plane is taking off or landing,Editors Note Sign up for Unlocking the World CNN Travels weekly newsletter Get the latest news in aviation food and drink where to stay and other travel developments In our latest CNN Travel r 4471 chars,Editors Note  Sign up for Unlocking the World CNN Travels weekly newsletter  Get the latest news in aviation food and drink where to stay and other travel developments CNN  In our latest CNN Travel roundup we bring you the airports offering the best customer experience the cruise ship where you can live on board for 30000 a year and why youre more likely to fart when your plane is taking off or landing The aviation experience Flying longhaul can leave you dried up zonked out and unusually prone to flatulence And some of us were that way before we even boarded the plane So keep yourself well hydrated eat slowly avoid fizzy drinks and read this guide to what exactly happens to your body on a long flight along with tips on avoiding the most common problems As for the farting thats because of the change in cabin pressure and the gas in your system reacting accordingly  so be careful as the plane climbs and descends We also have flight attendant Kris Majors insider secrets on how to survive a longhaul flight from when to eat to how to maximize your layover and whether its okay to take off your shoes He also explains why he always hangs his tie on his bunks curtain before he goes to sleep Airports also do their bit to make sure passengers get the optimum experience at ground level whether theyre setting off for their flight or arriving at their destination The Airport Service Quality Awards recognize the aviation hubs doing the finest work including an Italian megaairport and a Southeast Asian wonder with its own indoor waterfall Cruise news A roundtheworld cruise sounds for many like an impossible dream but seeing the sights by boat just got a little more affordable Life at Sea Cruises has opened bookings for its threeyear 130000mile voyage to 135 countries with a ticket price that works out to a notunreasonable 30000 per person per year  Passengers will be able to work remotely from the fullscale business center and make use of the gym pool and 24hour hospital with free medical visits as well as all the usual cruise ship amenities and entertainment Living life at sea as you do back home also means being just as mindful of environmental concerns The cruise industry is known for its carbonspurting vessels and excess waste production but there are plenty of companies out there working hard to make waterbound adventures a lot more sustainable Here are some of them Finally its not just seas you can cruise upon The worlds longest river cruise set out in January on the Ganges launching new 3200kilometer 1990mile trips through waterways in India and neighboring Bangladesh visiting national parks major cities and UNESCO World Heritage sites along the way Misbehavior of the week A man and woman have been sentenced to four years in prison for carrying out a 17 million wine heist at a Michelinstarred restaurant in Spain The couple stole 45 bottles of wine  including an 1806 vintage with a sixfigure price tag Unruly dudes were caught on video throwing punches while boarding a Phoenixbound plane at a Dallas airport In a separate incident a man was caught on video causing disruption before being arrested for allegedly trying to stab a flight attendant with a broken spoon and attempting to open the emergency door It seems there are some passengers who could benefit from traveling inside protective cases with a few chew toys and shiny tassels But for the moment at least that honor is reserved for our furry friends And so we end with a pet PSA Please do not send live cats through the Xray scanner at the airport We dont recommend dead ones either but its once again a fully animate kitty that has turned up at a US airport TSA officers are therefore asking travelers to please please unpack your puss before throwing your bag on the conveyor Family affair l e v a r t A family of five  three of whom are pilots  are traveling around the world in an ittybitty singleengine plane Heres how theyre managing it without too much intrafamilial turbulence In case you missed it An aviation expert reveals which is the safest seat on the plane A writer flew to New York then wrote a poem on Bumble What its like to travel around Afghanistan now Best portable cribs for naps and playtime,business
https://www.cnn.com/2023/03/18/tech/tiktok-ban-explainer/index.html,The US government is once again threatening to ban TikTok What you should know,Nearly twoandahalf years after the Trump administration threatened to ban TikTok in the United States if it didnt divest from its Chinese owners the Biden administration is now doing the same,Nearly twoandahalf years after the Trump administration threatened to ban TikTok in the United States if it didnt divest from its Chinese owners the Biden administration is now doing the same  6205 chars,CNN  Nearly twoandahalf years after the Trump administration threatened to ban TikTok in the United States if it didnt divest from its Chinese owners the Biden administration is now doing the same TikTok acknowledged to CNN this week that federal officials are demanding the apps Chinese owners sell their stake in the social media platform or risk facing a US ban of the app The new directive comes from the multiagency Committee on Foreign Investment in the United States CFIUS following years of negotiations between TikTok and the government body CFIUS is the same group that previously forced a sale of LGBTQ dating app Grindr from Chinese ownership back in 2019 The ultimatum from the US government represents an apparent escalation in pressure from Washington as more lawmakers once again raise national security concerns about the app Suddenly TikToks future in the United States appears more uncertain  but this time it comes after years in which the app has only broadened its reach over American culture Heres what you should know What are the concerns around TikTok Some in Washington have expressed concerns that the app could be infiltrated by the Chinese government to essentially spy on American users or gain access to US user data Others have raised alarms over the possibility that the Chinese government could use the app to spread propaganda to a US audience At the heart of both is an underlying concern that any company doing business in China ultimately falls under Chinese Communist Party laws Other concerns raised are not unique to TikTok but more broadly about the potential for social media platforms to lead younger users down harmful rabbit holes Wait didnt all of this happen before If this latest development is giving you dj vu thats because it echoes the saga TikTok already went through in the United States that kicked off in 2020 when the Trump administration first threatened it with a ban via executive order if it didnt sell itself to a USbased company Oracle and Walmart were suggested as buyers social media creators were in a frenzy and TikTok kicked off a lengthy legal battle against the US government Some critics at the time blasted thenpresident Donald Trumps crusade against the app as political theater rooted in xenophobia calling out Trumps unusual suggestion that the United States should get a cut of any deal if it forced the apps sale to an American firm A logo of ByteDance at its office in Beijing China July 7 2020 Thomas SuenReuters The Biden administration eventually rescinded the Trumpera executive order targeting TikTok but replaced it with a broader directive focused on investigating technology linked to foreign adversaries including China Meanwhile CFIUS continued negotiations to strike a possible deal that would allow the app to continue operating in the United States Then scrutiny began to kick up again in Washington Lawmakers renewed their scrutiny of TikTok for its ties to China through its parent company ByteDance after a report last year suggested US user data had been repeatedly accessed by Chinabased employees TikTok has disputed the report What has TikTok said In rare remarks earlier this month at a Harvard Business Review conference TikTok CEO Shou Chew doubled down on the companys prior commitments to address the lawmakers concerns The Chinese government has actually never asked us for US user data Chew said and weve said this on the record that even if we where asked for that we will not provide that Chew added that all US user data is stored by default in the Oracle Cloud infrastructure and access to that data is completely controlled by US personnel TikTok CEO Shou Zi Chew is interviewed at offices the company uses on Tuesday February 14 2023 in Washington DCPhoto by Matt McClainThe Washington Post via Getty Images Matt McClainThe Washington PostGetty Images As for the concerns that the Chinese government might use the app to spew propaganda to a US audience Chew emphasized that this would be bad for business noting that some 60 of TikToks owners are global investors Misinformation and propaganda has no place on our platform and our users do not expect that he said In response to the CFIUS divestiture request a TikTok spokesperson told CNN this week that a change in ownership wouldnt impact how US user data is accessed If protecting national security is the objective divestment doesnt solve the problem TikTok spokesperson Maureen Shanahan said in a statement A change in ownership would not impose any new restrictions on data flows or access The best way to address concerns about national security is with the transparent USbased protection of US user data and systems with robust thirdparty monitoring vetting and verification which we are already implementing Is TikTok really a threat to national security TikTok is really only a national security risk insofar as the Chinese government may have leverage over TikTok or its parent company China has national security laws that require companies under its jurisdiction to cooperate with a broad range of security activities The main issue is that the public has few ways of verifying whether or how that leverage has been exercised TikTok doesnt operate in China but ByteDance does Privacy and security researchers who have looked under the hood at TikToks app say that as far as they can tell TikTok isnt much different from other social networks in terms of the data it collects or how it communicates with company servers Thats still a lot of personally revealing information but it doesnt imply that TikToks app itself is inherently malicious or a kind of spyware Thats why the concern really focuses on TikTok and ByteDances relationship to the Chinese government and why the Biden administration is pushing for TikToks Chinese owners to sell their shares Where else has it been banned India banned TikTok in the summer of 2020 following a violent border clash between the country and China in a move that abruptly disconnected the more than 200 million users the app had amassed there While stopping short of banning the app on personal devices a number of other countries including the United States Canada and United Kingdom have recently enacted bans of TikTok on official government devices Late last year President Joe Biden signed legislation prohibiting TikTok on federal government devices and more than half of US states have enacted a similar mandate at the state level A TikTok spokesperson previously blasted this ban as little more than political theater The ban of TikTok on federal devices passed in December without any deliberation and unfortunately that approach has served as a blueprint for other world governments the spokesperson added,business
https://www.bbc.co.uk/news/world-asia-64753169,Is IndiaChina infrastructure race damaging Himalayas,Scientists say the pace with which infrastructure is being built threatens the Himalayan ecosystem,With fresh cracks appearing on the ground the Himalayan town of Joshimath in northern India continues to make headlines Why the town is sinking remains a subject of debate But scientists say there 7329 chars,But these are also the states that have been identified by the Central Water Commission of India as the ones that have seen significant expansion of glacial lakes and water bodies between 2009 and 2020 mainly because of melting glaciers,science
https://www.bbc.co.uk/news/world-asia-india-65108865,Ambani Adani Should India break up its big conglomerates,A former deputy governor of Indias central bank says five big firms are hindering competition in the market,India should dismantle its large conglomerates to increase competition and reduce their ability to charge higher prices former Reserve Bank of India deputy governor Viral Acharya has argued in a new 5437 chars,According to Mr Acharya who is now a professor of economics at NYU Stern industrial concentration  which refers to the extent to which a smaller number of firms account for total production in a country  fell sharply in India after 1991 when the country opened up its economy and stateowned monopolies began giving away their market share to private enterprises But after 2015 it began rising again,business
https://www.bbc.co.uk/news/world-asia-india-64948054,SpiceJet India pilots grounded for coffee cup in cockpit,Two pilots have been taken off duty for having coffee and snacks inside the cockpit of a SpiceJet flight,A private Indian airline has grounded two of its pilots for allegedly having coffee and sweets inside the cockpit of a flight midjourney The incident came to light after a purported photo of an o 2201 chars,It is not clear from the post when was the photograph taken whether it is recent or old the sector being operated or the crew or even the aircraft in question We are trying to ascertain these details the airline said,business
https://www.bbc.co.uk/news/world-asia-india-64889122,Shark Tank India How a startup in Kashmir is inspiring thousands,FastBeetles success on Shark Tank India is motivating youngsters in the region to dream big,A startup from Indianadministered Kashmir has raised funding on reality show Shark Tank India boosting hopes for other budding entrepreneurs from the region Auqib Javeed met the men behind the co 6475 chars,He said that this would help create jobs and boost the regions economy The policy was already there but we couldnt implement it due to some issues and then the pandemic Now we are amending it with the help of experts and a new policy will be in public in coming weeks,entertainment
https://www.bbc.co.uk/news/world-asia-india-64936667,Maharashtra The Indian onion crisis making farmers cry,Farmers in Maharashtra are protesting after onion prices suddenly crashed over the past few weeks,Farmers in the western Indian state of Maharashtra have set out on a 200km 124mile march to Mumbai demanding higher prices for onions The protests have prompted the authorities to announce some  4248 chars,Last year there was heavy rainfall in the months of JulyAugust so farmers delayed their cultivation This has led to a huge surplus of the onion crop in March which would otherwise have hit the market in DecemberJanuary Mr Kuwalekar says adding that things will get worse when the winter harvest also reaches the market in a few weeks,business
https://www.bbc.co.uk/news/world-asia-india-65063615,Rahul Gandhi Congress holds countrywide protests over disqualification,Mr Gandhi was removed as an MP last week after he was sentenced to two years in prison in a defamation case,Leaders of Indias main opposition party Congress are holding nationwide protests against the disqualification of their leader Rahul Gandhi from parliament Mr Gandhi was removed as an MP last week  3250 chars,My family has nurtured the democracy of this country with their blood Those who think they can threaten us by insulting us or use central agencies against us are wrong We are not going to be threatened she said,entertainment
