URL,Title,Description,Content,full_content,topic
https://consent.google.com/ml?continue=https://news.google.com/rss/articles/CBMibWh0dHBzOi8vd3d3LnJldXRlcnMuY29tL3dvcmxkL2luZGlhL2luZGlhLXJlbW92ZXMtbG9uZy10ZXJtLXRheC1iZW5lZml0cy1kZWJ0LW11dHVhbC1mdW5kcy1zb3VyY2UtMjAyMy0wMy0yNC_SAQA?oc%3D5&gl=FR&hl=en-US&cm=2&pc=n&src=1,India removes longterm tax benefits for debt mutual funds  source  Reuters India,India removes longterm tax benefits for debt mutual funds  source Reuters India,We use cookies and data toulliDeliver and maintain Google servicesliliTrack outages and protect against spam fraud and abuseliliMeasure audience engagement and site statistics to unde 1131 chars,March 24 Reuters  India will tax investments in debt mutual funds as shortterm capital gains according to amendments to the Finance Bill passed on Friday a move that could strip investors of the longterm tax benefits that made such investments popular COMMENTARY NAGESH CHAUHAN HEAD OF DEBT CAPITAL MARKET AT TIPSONS GROUP MUMBAI Indexation benefit from debt mutual funds has been removed and this could reduce inflows in debt mutual funds and benefit bank deposits and direct bond investments from high networth individuals HNI and family offices We might see short term bonds which are in the rating range of A to AA to attract fresh inflows Since these papers were not getting allocation from MF as per their risk averse investment policy and HNI investors were restricting allocation since taxation was not at par with Debt MFs Risk adjusted returns in the category of A to AA were not much rewarding to attract HNI investors earlier with this move taxation parity they would be keen to explore high yielding space SRIKANTH SUBRAMANIAN CEO KOTAK CHERRY MUMBAI The amendment in the finance bill will have significant structural changes to the way we invest For mutual fund to get investor interest itll now have to purely be on their ability to add extra risk adjusted returns and not because of any tax arbitrage The tax arbitrage that was available at an instrument level seems to be getting evened out across the board be debt MF or MLD marketlinked debentures However this will benefit the corporate bond market where there will be renewed interest from retail investors and this will also add depth to the liquidity which again will mean better pricing for the end customer NARENDRA DIXIT HEAD  RETAIL BANKING CSB BANK MUMBAI As of now debt mutual funds are treated as longterm investments if held for more than three years and taxed at the rate of 20 along with indexation benefits or 10 without indexation For those with a holding period of less than three years they are taxed according to their tax slab So for investors having more than threeyear horizon debt schemes were better visavis FD fixed deposit in higher tax brackets While FD always has the element of return being known upfront as rate of interest is fixed debt funds had the taxation edge due to the above rule Now with proposed change in tax rules FD and Debt MF are at par with each other in taxation FD carries an additional advantage of being free of interest rate risk Customers have the comfort of knowing the final return upfront at the time of booking The tax arbitrage of debt fund is now gone Also debt fund returns carry the interest rate risk We feel that a lot of long term investors will gradually shift to Bank FDs now  especially in high tax brackets MANISH P HINGAR FOUNDER FINTOO MUMBAI This move may have a negative impact on all debt funds particularly in the retail category as ultrahigh networth and high networth individuals may choose to invest in safe havens like bank fixed deposits We may see a shift from longterm debt funds to equity funds and money may be directed towards sovereign gold bonds bank fixed deposits and nonconvertible debentures in the debt category This is good news for banks as they can attract customers with higher interest rates and increase their borrowing and saving book sizes It is apparent that the government intends to remove tax arbitrage by creating a consistent tax policy across all debt instruments VISHAL GOENKA COFOUNDER INDIABONDSCOM MUMBAI Taxation rules across bond investments should be uniform as this simplifies the choice for investors who should focus on analysing the investment itself rather than the taxation disparity We welcome the proposed changes via the amendments to the Finance Bill as this creates a uniform level playing field between debt mutual fund and direct bond investment We always encourage investors to have fixed income in their portfolio for adequate diversification and the proposed changes will make direct bond investments by individuals more attractive AJAY BODKE INDEPENDENT MARKET ANALYST MUMBAI A long overdue step by the government to end favouritism by granting tax exemptions or deductions towards one sector MFs insurers at the cost of others Bank FDs PFs Post Office Savings etc which was leading to artificial propping up of demand for the former at the cost of the latter With governments stated intent to nudge tax payers towards progressive New IT regime such harmonization and elimination of deductionsexemptions should be lauded AMIT KUMAR GUPTA FOUNDER AND CIO FINTREKK CAPITAL DELHI Basically they have proposed to remove tax arbitrage Debt mutual funds were getting favourable tax treatment for indexation and longterm capital gains That has been removed now with this bill As an asset class debt mutual funds will get less attractive FDs may become more popular Banks are facing an issue of deposits also That can increase after the announcement Governments view has always been that uniform capital gains tax should be there across all asset classes But the decision does not affect the existing investor all the existing investments will be grandfathered CLSA ANALYSTS This is negative for MFs  Debt ex liquid contributes 19 of AUMs and 1114 of revenues For life insurers there seems to be no change to the taxation proposed in the budget and status quo remains with life savings taxed at marginal tax rate but tax arbitrage in favour of competing products such as MFs is gone now which at these valuations is a small positive for life insurers NBFCs get a material part of their funding from MFs  funding proportion from banks will go up Marginally positive for bank creditdeposits Reporting by Siddhi Nayak Bharath Rajeswaran Chris Thomas Bhakti Tambe and Swati Bhat editing by Eileen Soreng and Dhanya Ann Thoppil Our Standards The Thomson Reuters Trust Principles,business
https://consent.google.com/ml?continue=https://news.google.com/rss/articles/CBMic2h0dHBzOi8vd3d3LnJldXRlcnMuY29tL3dvcmxkL2luZGlhL2luZGlhLXJ1cGVlLXJ1cGVlLWluY2hlcy1sb3dlci1kb2xsYXItaW5mbG93cy1leHBlY3RlZC1jYXAtZG93bnNpZGUtMjAyMy0wMy0yOS_SAQA?oc%3D5&gl=FR&hl=en-US&cm=2&pc=n&src=1,INDIA RUPEE Rupee inches lower dollar inflows expected to cap   Reuters India,INDIA RUPEE Rupee inches lower dollar inflows expected to cap  Reuters India,We use cookies and data toulliDeliver and maintain Google servicesliliTrack outages and protect against spam fraud and abuseliliMeasure audience engagement and site statistics to unde 1131 chars,MUMBAI March 29 Reuters  The Indian rupee after adjusting for the fiscal year carry cost was lower versus the US dollar on Wednesday amid higher US yields and dollar inflow expectations The rupee was at 8226 to the dollar at 1020 am IST compared with 821875 in the previous session The spot date for USDINR changed from March 31 to April 3 the next fiscal year There is a higher carry return for holding short dollar positions for the shift and the rupees decline at open has adjusted for that a trader said The higher opening should not have much legs with speculators wary of possible dollar inflows related to the Asian currencies were mixed on the day amid a rise in US yields The abating worries around the US banking sector have prompted traders to relook at their expectations on the Federal Reserves rate path The expectations on the extent of rate cuts have mellowed At the height of the turmoil traders had priced in rate cuts worth more than 200 basis points from the peak by December 2024 That has now fallen to 164 bps according to DBS Research Further the odds of whether the Fed will opt for a rate hike or hold fire at its meeting in May is now almost a coin toss The 2year US yield is now well off last weeks lows yet the dollar has not rallied against its major peers The tepid dollar index despite the rise in US yields suggests that the undercurrent of safe haven demand is missing said Amit Pabari managing director at CR Forex Reporting by Nimesh Vora Editing by Savio DSouza Our Standards The Thomson Reuters Trust Principles,business
https://consent.google.com/ml?continue=https://news.google.com/rss/articles/CBMiaGh0dHBzOi8vd3d3LnJldXRlcnMuY29tL3dvcmxkL2luZGlhL2luZGlhLWZpbmFuY2UtbWluaXN0ZXItYXNrcy1zdGF0ZS1ydW4tYmFua3MtYXNzZXNzLXJpc2tzLTIwMjMtMDMtMjUv0gEA?oc%3D5&gl=FR&hl=en-US&cm=2&pc=n&src=1,India finance minister asks state run banks to assess risks  Reuters India,India finance minister asks state run banks to assess risks Reuters India,We use cookies and data toulliDeliver and maintain Google servicesliliTrack outages and protect against spam fraud and abuseliliMeasure audience engagement and site statistics to unde 1131 chars,NEW DELHI March 25 Reuters  India finance minister has asked staterun banks to assess various financial health parameters amid turbulence across the global banking sector After a meeting with chiefs of staterun banks in New Delhi on Saturday the finance ministry said in a statement that lenders have been asked to identify stress points including concentration risks and adverse exposures Ahead of the meeting the government had sought details of the bond portfolios of these banks Reuters reported Banks should safeguard themselves from any potential financial shock the finance minister told bankers according to the statement All the major financial parameters indicate stable and resilient public sector banks the statement added Indian lenders are capable of enduring any potential contagion effects emanating from the US banking turmoil SP Global Ratings said this week Strong funding profiles a high savings rate and government support are among the factors that bolster the financial institutions we rate the rating agency said Reporting by Nikunj Ohri writing by Ira Dugal editing by Jason Neely Our Standards The Thomson Reuters Trust Principles,business
https://consent.google.com/ml?continue=https://news.google.com/rss/articles/CBMiZmh0dHBzOi8vd3d3LnJldXRlcnMuY29tL3dvcmxkL2luZGlhL2luZGlhLWV4ZW1wdHMtaW1wb3J0LXRheC1wcmljZXktcmFyZS1kaXNlYXNlLW1lZGljaW5lcy0yMDIzLTAzLTMwL9IBAA?oc%3D5&gl=FR&hl=en-US&cm=2&pc=n&src=1,India exempts import tax on pricey rare disease medicines  Reuters India,India exempts import tax on pricey rare disease medicines Reuters India,We use cookies and data toulliDeliver and maintain Google servicesliliTrack outages and protect against spam fraud and abuseliliMeasure audience engagement and site statistics to unde 1131 chars,BENGALURU March 30 Reuters  The Indian government said on Thursday it was providing a full exemption from basic customs duty for rare disease therapies and Merck  Co Incs MRKN cancer therapy Keytruda when such medicines were imported for personal use The government said in a statement that while some drugs such as treatments for spinal muscular atrophy or Duchenne muscular dystrophy are already exempted from customs duty it had received many requests for relief from import tax for other rare disease drugs For a child weighing 10 kilograms the annual cost of treatment for rare diseases may vary from 1 million rupees 12172 to 10 million rupees per year according to the Ministry of Finance statement This exemption will result in substantial cost savings and provide much needed relief to the patients the ministry added Some of the rare diseases mentioned in the National Policy For Rare Diseases 2021 list include Wilsons disease cystic fibrosis and Pompe disease The governments move on exemption comes amid reports that several Indian families have had to raise money through online fundraising campaigns to receive pricey medicines such as Novartis NOVNS 21 million gene therapy Zolgensma for treating spinal muscular atrophy 1  821580 Indian rupees Reporting by Navamya Ganesh Acharya in Bengaluru Editing by Shailesh Kuber Our Standards The Thomson Reuters Trust Principles,health
https://consent.google.com/ml?continue=https://news.google.com/rss/articles/CBMibGh0dHBzOi8vd3d3LnJldXRlcnMuY29tL3dvcmxkL2luZGlhL2luZGlhLWdvdmVybm1lbnQtcGxhbnMtYm9ycm93LTg4LXRyaWxsaW9uLXJ1cGVlcy1oMS1vZmZpY2lhbC0yMDIzLTAzLTI5L9IBAA?oc%3D5&gl=FR&hl=en-US&cm=2&pc=n&src=1,India government plans to borrow 88 trillion rupees in H1  official  Reuters India,India government plans to borrow 88 trillion rupees in H1  official Reuters India,We use cookies and data toulliDeliver and maintain Google servicesliliTrack outages and protect against spam fraud and abuseliliMeasure audience engagement and site statistics to unde 1131 chars,Summary Govts H1 borrowing at over 57 of 202324 budget plan Government to borrow 310390 billion rupees weekly Govt to carry out switch operations to smooth redemptions Sovereign Green Bonds may be announced in H2 202324 March 29 Reuters  This March 29 story has been corrected to say 888 trillion rupees instead of 88 trillion rupees in paragraph 1 Indias federal government plans to borrow 888 trillion rupees 10808 billion  slightly above expectations  via bonds from the market in the first six months of the fiscal year starting April 1 The planned AprilSeptember borrowing constitutes about 576 of the total 1543 trillion rupees planned for the current fiscal year the government said in a statement on Wednesday Borrowing in the first six months is slightly above market expectations of about 55 of this years target The government said the borrowing will be done through bonds of three five seven 10 14 30 and 40 years tenure It plans to borrow between 310 billion and 390 billion rupees a week in the first half of the fiscal year Borrowing has more than doubled from levels in 2019  when Prime Minister Narendra Modi stormed to a landslide reelection  as the governments social spending on free food and subsidies rose to record highs largely due to the pandemic The government plans net borrowing of 142 trillion rupees in the quarter ending June 30 compared with 240 trillion rupees in the same period last year The Reserve Bank of India has fixed the Ways and Mean Advances which are temporary advances given by the central bank to governments to tide over any financing gaps for the AprilSeptember period at 150 trillion rupees the government said The government will continue to carry out switch operations to smooth the redemption profile it said There will be no fresh issue of government green bonds in the first half of the financial year though these may be issued in the second half it said 1  821580 Indian rupees Reporting by Nikunj Ohri in New Delhi Editing by William Maclean Jonathan Oatis and Mark Heinrich Our Standards The Thomson Reuters Trust Principles,business
https://consent.google.com/ml?continue=https://news.google.com/rss/articles/CBMiaGh0dHBzOi8vd3d3LnJldXRlcnMuY29tL2xpZmVzdHlsZS9zcG9ydHMvemFtcGEtYm93bHMtYXVzdHJhbGlhLW9kaS1zZXJpZXMtdmljdG9yeS1vdmVyLWluZGlhLTIwMjMtMDMtMjIv0gEA?oc%3D5&gl=FR&hl=en-US&cm=2&pc=n&src=1,Zampa bowls Australia to ODI series victory over India  Reuters,Zampa bowls Australia to ODI series victory over India Reuters,We use cookies and data toulliDeliver and maintain Google servicesliliTrack outages and protect against spam fraud and abuseliliMeasure audience engagement and site statistics to unde 1131 chars,CHENNAI India March 22 Reuters  Legspinner Adam Zampa took four wickets as Australia beat India by 21 runs to clinch the threematch oneday international series 21 on Wednesday Electing to bat Australia could not capitalise on a strong start and were bowled out for 269 in 49 overs on a slow track at the MA Chidambaram Stadium Their bowlers led by Zampa did an excellent job defending the total and bowled out India for 248 in 491 overs as Australia exacted a modicum of revenge after losing the fourtest series 21 Its been an enjoyable tour said Steve Smith leading Australia in the absence of Pat Cummins who stayed in Sydney to be with his mother who died this month The spinners bowled beautifully really good performance Zampa was adjudged playerofthematch but fellow spinner Ashton Agar turned the game on its head by removing Virat Kohli whose 54 was the highest score by a batsman from either side and Suryakumar Yadav in successive deliveries For the hosts Hardik Pandya claimed bowling figures of 344 and made a runaball 40 but it was not enough to avoid Indias first series loss on home soil since Aaron Finchs Australia beat them in 2019 Australia recalled fitagain David Warner but the inform Mitchell Marsh combined with Travis Head at the top of their batting order to give the touring side another blazing start Australia raced to 68 for no loss and Head who made 33 got a reprieve after Shubman Gill dropped him at deep square leg Pandya removed Head Smith and Marsh 47 to peg back Australia Batting at number four Warner made 23 before Kuldeep Yadav wrecked Australias middle order The leftarm unorthodox spinner dismissed Warner Marnus Labuschagne and Alex Carey 38 but Australias lower order provided crucial runs even though they could not last their full quota of 50 overs India also began briskly with Rohit Sharma 30 and Gill 37 playing a few attractive shots Kohli tried to forge partnerships with KL Rahul 32 and with Pandya but he looked tired by the end Zampa effectively decided the match by removing Pandya India held back Suryakumar who came in at number seven promoting Axar Patel as the pinchhitter but neither ploy worked Patel was run out for two and Suryakumar fell for a firstball duck for the third time in a row Rohit rued the lack of big partnerships in the Indian innings You are born and brought up on these wickets Sometimes you need to apply yourself and give yourself a chance the opener said Marsh won the playeroftheseries award for his 194 runs from three innings Reporting by Amlan Chakraborty in New Delhi editing by Ed Osmond Our Standards The Thomson Reuters Trust Principles,business
https://consent.google.com/ml?continue=https://news.google.com/rss/articles/CBMiemh0dHBzOi8vd3d3LnJldXRlcnMuY29tL3dvcmxkL2luZGlhL3Bvd2VyZnVsLWluZGlhbi1oaW5kdS1ncm91cC1iYWNrcy1nb3Zlcm5tZW50cy1vcHBvc2l0aW9uLXNhbWUtc2V4LW1hcnJpYWdlLTIwMjMtMDMtMTQv0gEA?oc%3D5&gl=FR&hl=en-US&cm=2&pc=n&src=1,Powerful Indian Hindu group backs governments opposition to   Reuters India,Powerful Indian Hindu group backs governments opposition to  Reuters India,We use cookies and data toulliDeliver and maintain Google servicesliliTrack outages and protect against spam fraud and abuseliliMeasure audience engagement and site statistics to unde 1131 chars,NEW DELHI March 14 Reuters  The ideological parent of Indias ruling Hindu nationalist Bharatiya Janata Party BJP has backed the government position against recognising samesex marriage months after raising hopes with supportive comments on gay rights Prime Minister Narendra Modis BJP government has opposed recognising samesex marriage and urged the Supreme Court to reject challenges to the current legal framework lodged by LGBT couples Final arguments in the case are due to be heard by a fivejudge bench starting April 18 Marriage can only take place between persons of opposite genders we agree with the governments stance on samesex marriage the Press Trust of India news agency quoted Dattatreya Hosabale a top official of the Rashtriya Swayamsevak Sangh RSS as saying Hosabales office confirmed his comments to Reuters RSS chief Mohan Bhagwat had said in January that the lesbian gay bisexual and transgender LGBT community should have their own private and social space as they are humans and have the right to live as others Although Bhagwat had not referred specifically to samesex marriage his comments could force the government to reassess its opposition a junior minister in the federal government and a senior BJP leader had said at the time The RSS established in 1925 is a powerful Hindu group estimated to have millions of active members across India and overseas The organisation played a major role in Modis rise to power India decriminalised homosexuality when it scrapped a colonialera ban on gay sex in 2018 but it remains a taboo topic in this socially conservative country of 14 billion The Modi government has argued that any change to the legal structure of marriage should be the domain of the elected parliament not the court The Supreme Court started hearing petitions to recognise samesex marriages after four gay couples stated that without legal recognition they could not have access to rights such as those linked to medical consent pensions adoption or even club memberships Reporting by Rupam Jain Editing by YP Rajesh and Alex Richardson Our Standards The Thomson Reuters Trust Principles,business
https://consent.google.com/ml?continue=https://news.google.com/rss/articles/CBMiYWh0dHBzOi8vd3d3LnJldXRlcnMuY29tL2xpZmVzdHlsZS9zcG9ydHMvYXVzdHJhbGlhLTQ4MC1hbGwtb3V0LXYtaW5kaWEtYWhtZWRhYmFkLXRlc3QtMjAyMy0wMy0xMC_SAQA?oc%3D5&gl=FR&hl=en-US&cm=2&pc=n&src=1,Australia 480 all out v India in Ahmedabad test  Reuters,Australia 480 all out v India in Ahmedabad test Reuters,We use cookies and data toulliDeliver and maintain Google servicesliliTrack outages and protect against spam fraud and abuseliliMeasure audience engagement and site statistics to unde 1131 chars,AHMEDABAD India March 10 Reuters  Australia were all out for 480 in their first innings on day two of the fourth and final test against India on Friday Usman Khawaja topscored for the tourists with a majestic 180 while Cameron Green 114 registered his maiden test hundred Ravichandran Ashwin 691 was the pick of the bowlers for India who lead the series 21 Reporting by Amlan Chakraborty in New Delhi editing by Toby Davis Our Standards The Thomson Reuters Trust Principles,business
https://consent.google.com/ml?continue=https://news.google.com/rss/articles/CBMib2h0dHBzOi8vd3d3LnJldXRlcnMuY29tL3dvcmxkL2luZGlhL3ZpZXctaW5kaWFzLXJhaHVsLWdhbmRoaS1kaXNxdWFsaWZpZWQtbGF3bWFrZXItYWZ0ZXItY29udmljdGlvbi0yMDIzLTAzLTI0L9IBAA?oc%3D5&gl=FR&hl=en-US&cm=2&pc=n&src=1,Reactions to Rahul Gandhis disqualification as lawmaker  Reuters India,Reactions to Rahul Gandhis disqualification as lawmaker Reuters India,We use cookies and data toulliDeliver and maintain Google servicesliliTrack outages and protect against spam fraud and abuseliliMeasure audience engagement and site statistics to unde 1131 chars,NEW DELHI March 24 Reuters  Indias parliament disqualified opposition Congress party leader Rahul Gandhi as a lawmaker on Friday a day after he was found guilty of defamation by a lower court Following are some reactions from lawmakers and politicians KANIMOZHI eds one name MEMBER OF PARLIAMENT DRAVIDA MUNNETRA KAZHAGAM PARTY Disqualification of Mr RahulGandhi from the Lok Sabha is a vengeful action with which they want to silence the opposition Our voices will only become louder and our bond against forces that disrespect the tenets of democracy will only become stronger We stand with him SAURABH BHARADWAJ CHIEF NATIONAL SPOKESPERSON AAM AADMI PARTY The federal government and BJP are misusing the law in an attempt to quash the voice of the opposition If the federal government suppresses the voice of the opposition then who will raise the voice of the public MEHBOOBA MUFTI PRESIDENT JAMMU AND KASHMIR PEOPLES DEMOCRATIC PARTY GOI Govt of India is clearly rattled by RG Rahul Gandhi for emerging as a powerful challenger pre 2024 elections Since BJP cant fight him politically they are now subverting institutions because he refuses to do a Savarkar The apprehensions he voiced in London are tragically being proven right MAMATA BANERJEE CHIEF MINISTER WEST BENGAL In PM Modis New India opposition leaders have become the prime target of BJP While BJP leaders with criminal antecedents are inducted into the cabinet opposition leaders are disqualified for their speeches Today we have witnessed a new low for our constitutional democracy PRIYANKA CHATURVEDI MEMBER OF PARLIAMENT SHIV SENAUBT Vindictive and shameful action against Rahul Gandhi This disqualification yet again proves that we are living in the times of caged democracy SHASHI THAROOR MEMBER OF PARLIAMENT CONGRESS Im stunned by this action and by its rapidity within 24 hours of the court verdict and while an appeal was known to be in process This is politics with the gloves off and it bodes ill for our democracy JAIRAM RAMESH MEMBER OF PARLIAMENT CONGRESS We will fight this battle both legally and politically We will not be intimidated or silenced KIREN RIJIJU MEMBER OF PARLIAMENT AND MINISTER BHARATIYA JANATA PARTY Rahul Gandhi made very derogatory remark and disgraced an entire OBC other backward class Community Shockingly some Congress leaders are trying to defend it Compiled by Shivam Patel Tanvi Mehta and Sakshi Dayal in New Delhi Editing by Barbara Lewis Muralikumar Anantharaman and Angus MacSwan Our Standards The Thomson Reuters Trust Principles,business
