URL,Title,Description,Content,full-content,topic,one line summary
https://finance.yahoo.com/news/report-frozen-vegetables-market-experiences-124100272.html,Report Frozen Vegetables Market Experiences Steady Growth with a Projected CAGR of 52 from 2023 to 2030 Driven by HealthConscious Consumers and Technological Advancements,NEW YORK April 02 2023 GLOBE NEWSWIRE  IndexBox a leading global research firm has published a new comprehensive report on the global frozen,NEW YORK April 02 2023 GLOBE NEWSWIRE  IndexBox a leading global research firm has published a new comprehensive report on the global frozen vegetable market providing detailed analysis for 5420 chars,IndexBox Inc NEW YORK April 02 2023 GLOBE NEWSWIRE  IndexBox a leading global research firm has published a new comprehensive report on the global frozen vegetable market providing detailed analysis forecasts size trends and insights The full report is accessible through the following link httpswwwindexboxiostoreworldfrozenvegetablemarketanalysisforecastsizetrendsandinsights In addition IndexBox is offering trial access to market data available on their platform According to the report the global frozen vegetable market is expected to witness significant growth from 2023 to 2030 Key factors driving this growth include increased consumer awareness about the health benefits of frozen vegetables advancements in freezing technology and the growing demand for convenience in food preparation However the market also faces several challenges such as fluctuating raw material prices strict regulations on food safety and the environmental impact of packaging materials The report provides an indepth analysis of these factors as well as their implications on market dynamics Demand for frozen vegetables is primarily driven by the food processing industry specifically readytoeat meals  soups and snacks The frozen vegetable market is also influenced by the retail sector where supermarkets and hypermarkets are the primary sales channels Moreover the growing foodservice industry including restaurants catering services and institutional food providers is expected to contribute to the markets expansion The global frozen vegetable market can be segmented into several categories based on the type of vegetables such as leafy greens cruciferous legumes roots and tubers  among others Leafy greens include spinach  kale and collard greens while cruciferous vegetables consist of broccoli and cauliflower  and Brussels sprouts Legumes comprise peas  beans  and lentils  whereas roots and tubers include carrots  beets and potatoes  Story continues EndUser The frozen vegetable market caters to various enduser segments including food processing retail and foodservice industries Food Processing The food processing industry utilizes frozen vegetables in the production of readytoeat meals soups snacks and other processed food products This segment accounts for a significant share of the overall market demand Retail Supermarkets hypermarkets and specialty stores constitute the retail sector for frozen vegetables The growing preference for convenient and healthy food options among consumers has driven the demand for frozen vegetables in this segment Foodservice Restaurants catering services and institutional food providers such as schools hospitals and offices are part of the foodservice industry The expansion of the foodservice sector coupled with increasing consumer awareness of the nutritional benefits of frozen vegetables contributes to the markets growth Region The global frozen vegetable market can be analyzed across various regions including North America Europe AsiaPacific Latin America and the Middle East and Africa North America  The North American market led by the United States and Canada exhibits steady growth due to the high demand for convenience foods and increased consumer awareness about the health benefits of frozen vegetables Europe  Europe with countries such as Germany France the United Kingdom and Italy is another significant market for frozen vegetables The regions growth is driven by changing consumer preferences advancements in freezing technology and the expanding food processing industry AsiaPacific  As the largest market for frozen vegetables the AsiaPacific region comprises countries such as China India Japan and Australia The regions growth prospects are attributed to the rising urban population increased disposable income and rapid expansion of the food processing industry Latin America  Latin America including Brazil Mexico and Argentina is an emerging market for frozen vegetables The growth in this region is driven by the increasing demand for convenient food options growing urbanization and expanding retail and foodservice sectors Middle East and Africa  The Middle East and Africa market is expected to witness moderate growth driven by the growing demand for healthy and convenient food options as well as the expansion of the food processing and foodservice industries in the region The report provides key statistics on the frozen vegetable market including market size growth rates and consumption patterns It also offers a detailed breakdown of market segments by product type application and region These companies have a significant market presence and contribute to the overall growth of the industry Conagra Brands Inc Greenyard NV Bonduelle Group Pinnacle Foods Inc acquired by Conagra Brands BG Foods Inc General Mills Inc McCain Foods Limited Nestl SA JR Simplot Company The Kraft Heinz Company Unilever Ajinomoto Co Inc Findus Group owned by Nomad Foods Ardo Group Europenne des Desserts CRF Frozen Foods joint venture between Harbin Gaotai and Rujia Group Uren Food Group Ltd Gelagri Bretagne SA Cargill Incorporated Charalambides Christis Ltd For more information about the report or to request trial access to the IndexBox platform please visit httpswwwindexboxio Keywords Frozen Vegetables Market Analysis Market Forecast Food Processing Food Industry Market Growth CONTACT Contact Mekhrona Dzhuraeva Editor Email mediaindexboxio,business,The global frozen vegetable market is expected to witness significant growth from 2023 to 2030 Key factors driving this growth include increased consumer awareness about the health benefits of frozen vegetables advancements in freezing technology and the growing demand for convenience in food preparation
https://www.moneycontrol.com/news/business/ipo/avalon-technologies-ipo-10-key-things-to-know-before-subscribing-to-the-issue-10350501.html,Avalon Technologies IPO  10 key things to know before subscribing to the issue,Among the risks any increase in the cost of raw materials or components or any delay shortage or interruption in the supply of raw materials and major production inputs may adversely affect the business,Avalon Technologies the first initial public offering IPO of the new financial year 202324 is set to open for subscription next week Here are 10 key things to know about the public offer 1  7283 chars,Avalon Technologies has 12 manufacturing units across the United States and India live bse live nse live Volume Todays LH More  Avalon Technologies the first initial public offering IPO of the financial year 202324 is set to open for subscription next week Here are 10 key things to know about the public offer 1 IPO Dates The first day of bidding for this maiden public issue would be April 3 and the offer will close on April 6 2 Price band The price band has been fixed at Rs 415436 per share with a face value of Rs 2 each 3 Public Issue size Avalon intends to raise Rs 865 crore through its IPO that comprises a fresh issuance of shares worth Rs 320 crore and an offer for sale OFS of equity shares worth Rs 545 crore by promoters and other shareholders The OFS includes equity shares worth Rs 131 crore being sold by Kunhamed Bicha shares worth Rs 172 crore being sold by Bhaskar Srinivasan Rs 16 crore by T P Imbichammad Rs 10 crore by Mariyam Bicha Rs 65 crore by Sareday Seshu Kumar Also Anand Kumar and Luquman Veedu Ediyanam will each sell shares worth Rs 755 crore in the OFS The public issue has been reduced from Rs 1025 crore to Rs 865 crore after the company mopped up Rs 160 crore via preIPO placement The company has already raised Rs 38925 crore from anchor investors on March 31 hence Rs 47575 crore worth of shares will be up for sale during April 36 Click Here To Read All IPO Related News 4 Objectives of the issue The electronic manufacturing services EMS company is going to utilise the fresh issue proceeds for repaying debts Rs 145 crore and working capital requirements Rs 90 crore besides general corporate purposes The funds raised via the OFS will go to the selling shareholders not the company 5 Lot size and investors reserved portion Investors can bid for a minimum of 34 equity shares and in multiples of 34 shares thereafter With this the minimum application size for retail investors would be Rs 14824 per lot 34 shares and the maximum would be Rs 192712 for 13 lots 442 shares The company has reserved 75 percent of the offer for qualified institutional buyers QIB 15 percent for high networth individuals HNI and the remaining 10 percent for retail investors 6 Company profile Incorporated in 1999 at Chennai Avalon Technologies is a fullyintegrated EMS company with endtoend operations in delivering box build solutions with a focus on highvalue precisionengineered products It provides a fullstack product and solution suite right from printed circuit board PCB design and assembly to the manufacture of complete electronic systems box build Its customers include global original equipment manufacturers OEMs including OEMs located in the United States China Netherlands and Japan Also read Samhi Hotels backed by Goldman Sachs Equity International files draft IPO papers again The company caters to a mix of established and longproductlifecycle industries such as industrial mobility and medical devices and highgrowth sunrise industries such as solar power electric vehicles and hydrogen fuel in the clean energy sector and digital infrastructure in the communications sector With 12 manufacturing units across the United States and India Avalon has increased its customer base from 54 in FY1920 to 89 as of November 2022 and grown its order book from Rs 50467 crore in FY1920 to Rs 119025 crore in that time Per a Frost  Sullivan report the EMS sector is expected to grow at a significant pace While the EMS market in India was valued at Rs 146 lakh crore 20 billion in FY2122 and is expected to grow at a CAGR of 323 percent to hit Rs 45 lakh crore 60 billion in FY2526 the US EMS market was valued at approximately 140 billion in 2021 and is expected to grow at a CAGR of 61 percent to 188 billion by 2026 The company compares itself with Dixon Technologies Amber Enterprises Syrma SGS Technology and Kaynes Technology 7 Financials At Rs 342 crore Avalon has recorded a 192 percent yearonyear YoY decline in profit after tax PAT for the eightmonth period ended November FY2223 on a high base due to exceptional income in the yearago period The profit margin dropped to 584 percent from 781 percent in the same period Consolidated revenue from operations increased 8 percent YoY to Rs 585 crore for the eightmonth period of FY2223 with the clean energy segment contributing 23 percent mobility and transportation 22 percent industrials 28 percent communication 9 percent and 17 percent by medical and other segments On the operating front EBITDA earnings before interest tax depreciation and amortisation grew 168 percent YoY to Rs 68 crore while the margin expanded by 87 basis points bps to 1163 percent in the same period For the financial year 202122 the company has clocked a 195 percent growth in PAT at Rs 682 crore and a 22 percent rise in revenue at Rs 841 crore compared to the previous year Net profit margin jumped 476 bps to 81 percent in the same period EBITDA increased 475 percent to Rs 975 crore with the margin expanding 202 bps to 116 percent  The companys total borrowings will be reduced to around Rs 150 crore post the IPO from about Rs 300 crore now R M Subramanian CFO Avalon Enterprises said 8 Promoters Kunhamed Bicha Chairman and Managing Director and Bhaskar Srinivasan NonExecutive Director are the founders and promoters of Avalon who collectively hold 5338 percent of the companys shares The total promoter and promoter group holding is 7075 percent and the remaining 2925 percent is held by public shareholders including UNIFI Financial Ashoka India Equity Investment Trust Plc and India Acorn Fund R M Subramanian is the Chief Financial Officer of the company while Dr Rajesh V is the Company Secretary Compliance Officer and Legal Head of the firm 9 Risks and concerns Here are the key risks and concerns highlighted by brokerages Swastika Investmart Canara Bank Securities Reliance Securities a The company has had negative cash flow in the past b Dependence on a limited number of customers for a major portion of its revenues c Disruption in the operation of its manufacturing facilities d The company may be subject to financial and reputational risk due to product quality and liability issues e Any increase in the cost of raw materials or components or any delay shortage or interruption in the supply of raw materials and major production inputs may adversely affect the operations cash flow and financials of the business f Failure to maintain optimal inventory levels could lead to increase in inventory holding costs g Foreign exchange fluctuations 10 Allotment and Listing Dates Avalon will finalise the IPO share allotment by April 12 and the refunds will be credited to the bank accounts of unsuccessful investors by April 13 Eligible investors will get shares in their demat accounts by April 17 Finally its stock will be listed on the BSE and NSE on April 18 JM Financial DAM Capital Advisors IIFL Securities and Nomura Financial Advisory and Securities India are the merchant bankers to the issue while the registrar to the offer is Link Intime India Disclaimer The views and investment tips expressed by investment experts on Moneycontrolcom are their own and not those of the website or its management Moneycontrolcom advises users to check with certified experts before taking any investment decisions,business,Avalon Technologies has 12 manufacturing units across the United States and India live bse live nse live Volume Todays LH More Avalon Technologies the first initial public offering IPO of the financial year 202324 is set to open for subscription next week Here are 10 key things to know about the public offer
https://www.moneycontrol.com/news/business/markets/trade-setup-for-monday-top-15-things-to-know-before-the-opening-bell-37-10348171.html,Trade setup for Monday Top 15 things to know before the opening bell,The RBI holds its first policy review of FY24 during the week which will be closely tracked by investors who will also be watching global cues for the latest on the banking sector For the Nifty key support is at 17248 and initial resistance at 17383 say,The market on March 31 closed with the highest singleday gains in more than four months making a strong start to the April series The benchmark indices rose for the second consecutive session on t 9419 chars,The market on March 31 closed with the highest singleday gains in more than four months making a strong start to the April series The benchmark indices rose for the second consecutive session on the hope that the global interest rate hike cycle was nearing its end and the banking crisis was in control The rally was broadbased The 30pack Sensex gained 1031 points or 18 percent to 58992 while the Nifty was up 279 points or 16 percent at 17360 and formed a long bullish candle on the daily charts After the formation of a series of lower bottoms over the last few months the Nifty has moved up sharply after the formation of a doublebottom type pattern around 16900 levels recently This is a positive indication Nagaraj Shetti Technical Research Analyst HDFC Securities said For the Nifty the shortterm trend had turned up sharply Having moved above the hurdle and the overall positive chart pattern indicates the next upside for the Nifty around 17800 levels in the next couple of weeks Immediate support is at 17250 levels Nagaraj said On the broader markets front the Nifty midcap 100 and smallcap 100 indices gained 087 percent and 16 percent on strong breadth We have collated 15 data points to help you spot profitable trades Note The open interest OI and volume data of stocks in this article are the aggregates of threemonth data and not just the current month Key support and resistance levels on Nifty The pivot charts indicate that the Nifty may get support at 17248 followed by 17206 and 17138 If the index advances 17383 is the initial key resistance level to watch out for followed by 17425 and 17492 Nifty Bank The Bank Nifty too closed above the crucial resistance of 40000 rising 698 points or 175 percent to 40609 The index also formed a bullish candlestick on the daily charts and made a higher top and a higher bottom for the second straight session The overall bullish chart pattern in Bank Nifty signals an upside target of around 41650 in the next onetwo weeks Immediate support is at 40200 levels Shetti said Bank Nifty as per pivot charts may take support at 40298 followed by 40178 and 39983 Key resistance levels are expected to be 40688 then 40808 and 41003 Call options data The maximum Call open interest OI was at 17700 strike with 6428 lakh contracts which is expected to be a crucial level for the Nifty in the coming sessions This was followed by 17500 strike comprising 565 lakh contracts and 17600 strike with more than 5178 lakh contracts Call writing was seen at 17600 strike which added 3374 lakh contracts followed by 17700 strike which accumulated 2838 lakh contracts and 17500 strike with 2548 lakh contracts Call unwinding was at 17000 strike which shed 2955 lakh contracts followed by 17800 strike which shed 2401 lakh contracts and then 17100 strike which shed 107 lakh contracts Put option data The maximum put open interest was at 17000 strike with 8113 lakh contracts which is expected to act as support in the coming session This was followed by the 17300 strike comprising 6508 lakh contracts and the 17200 strike where we have 6238 lakh contracts Put writing was seen at 17300 strike which added 5918 lakh contracts followed by 17200 strike which added 5391 lakh contracts and 16500 strike which added 3207 lakh contracts We have seen put unwinding at 17900 strike which shed 4150 contracts followed by 18500 strike which shed 1500 contracts Stocks with a high delivery percentage A high delivery percentage suggests that investors are showing interest in the stock The highest delivery was seen in Vedanta Marico Bharti Airtel BPCL and Hindustan Unilever among others 102 stocks see a long buildup An increase in open interest OI and in price typically indicates a buildup of long positions Based on the OI percentage we have seen 102 stocks in the list of long buildups including Glenmark Pharma Nestle India Hindustan Aeronautics Dixon Technologies and Ramco Cements 7 stocks see long unwinding A decline in OI and price generally indicates a long unwinding Based on the OI percentage seven stocks including Indraprastha Gas IDFC and Siemens witnessed a long unwinding 27 stocks see a short buildup An increase in OI along with a decrease in price indicates a buildup of short positions Based on the OI percentage 27 stocks including Apollo Hospitals Laurus Labs Gujarat Gas Lupin and Bajaj Auto saw a short buildup 56 stocks see shortcovering A decrease in OI along with a price increase is an indication of shortcovering Based on the OI percentage 56 stocks were on the shortcovering list These included Infosys Federal Bank Bank of Baroda ICICI Prudential Life Insurance and TCS Bulk deals PSP Projects Francebased financial services company Societe Generale bought 62 lakh shares in the construction company via open market transactions at an average price of Rs 66435 a share amounting to Rs 412 crore Promoter Shilpaben Prahaladbhai Patel was the seller offloading shares at the same price Shriram Properties Navi Mumbaibased Aurum Real Estate Developers bought 242 crore equity shares or 1427 percent stake in the property developer through open market transactions at an average price of Rs 5505 a share PE firm WSI WSQI V XXXII Mauritius Investors exited the Shriram Group company by selling the entire holding of 242 crore shares at the same price Phoenix Mills The government of Singapore sold 5149 lakh equity shares or 288 percent stake in the retail mall developer and operator via open market transactions at an average price of Rs 130015 a share The government of Singapore held a 428 percent shareholding in the company as of December 2022 For more bulk deals click here Investors meetings on April 3 Mrs Bectors Food Specialities Officials of the company will interact with institutional investors and analysts Tata Motors The companys officials will interact with several analysts and investors PVR Senior management of the company will participate in institutional investor meetings in Singapore Welspun Corp A conference call with the management to discuss the acquisition of SintexBAPL Stocks in the news Udayshivakumar Infra The road construction company will make its debut on the bourses on April 3 The final issue price has been fixed at Rs 35 a share Rail Vikas Nigam The stateowned railway company bagged several orders including a Rs 72067 crore project for building a sixlane elevated Kona expressway in West Bengal The second project is a joint venture with the railways ministry for manufacturing and maintaining Vande Bharat trainsets It also includes an upgrade of the government manufacturing units and trainset depots As many as 120 trainsets are to be built at a cost of Rs 120 crore a set Orient Electric The CK Birla Group company has appointed Rajan Gupta as the managing director and CEO for five years effective April 4 following the resignation of Rakesh Khanna which comes into effect from April 3 Piramal Pharma The US Food and Drug Administration conducted a Good Manufacturing Practices GMP inspection of Piramal Pharmas Digwal facility during March 2731 The inspection was completed successfully with zero Form 483 observations GR Infraprojects The company has been awarded a Rs 84787 crore fourlane accesscontrolled greenfield highway project in the Mahabubabed district of Telangana The company also bagged a project worth Rs 124837 crore to build a sixlane greenfield VaranasiRanchiKolkata Highway stretch in Bihar on hybrid annuity mode Campus Activewear Raman Chawla has resigned as the chief financial officer CFO He leaves his June 10 2023 and the company is in the process of appointing a new CFO Eicher Motors The companys commercial vehicle sales volume in March increased by 352 percent to 11906 units from the yearago month driven by domestic business but exports dropped 365 percent YoY to 414 units Royal Enfield announced its sales for March 2023 at 72235 motorcycles up 7 percent YoY PNC Infratech The company has received letters of award for three projects worth Rs 326443 crore from the National Highways Authority of India NHAI All these projects are parts of the sixlane greenfield Varanasi RanchiKolkata highway stretch to be built in Bihar in hybrid annuity mode Maruti Suzuki The countrys largest car maker sold 17 lakh units in March 2023 down 02 percent over the same month last year with domestic sales contributed 82 percent to total sales falling 27 percent and exports rising 137 percent to 30119 units Cigniti Technologies The digital engineering services company has appointed Srinivas Kandula as the executive director on the board Kandula is a former chairman and CEO of Capgemini India Fund Flow FII and DII data Foreign institutional investors FII bought shares worth Rs 35786 crore while domestic institutional investors DII purchased shares worth Rs 247996 crore on March 31 National Stock Exchanges provisional data showed Stocks under FO ban on NSE The National Stock Exchange has not added any stock to its FO ban list for April 3 Disclaimer The views and investment tips expressed by experts on Moneycontrol are their own and not those of the website or its management Moneycontrol advises users to check with certified experts before taking any investment decisions,business,Key technical levels to watch out for in the Indian markets in the coming weeks
