URL,Title,Description,Content,full-content,topic,one line summary
https://www.corriere.it/sette/esteri/23_aprile_02/sciopero-madri-corea-sud-tigre-asiatica-rischia-l-estinzione-04bc705a-cd71-11ed-ab8e-1e4a885c119f.shtml,Sciopero delle madri in Corea del Sud la tigre asiatica rischia lestinzione,Il tasso di fecondit  il pi basso del mondo e gi nel 2025 sar il popolo pi anziano dopo il Qatar con unet media di 465 anni e con il 20 di over 60 Il 65 delle donne in et fertile dichiara non volere figli e il femminismo radicale peggiora la sit,di Michela Mantovan Il tasso di fecondit  il pi basso del mondo e gi nel 2025 sar il popolo pi anziano dopo il Qatar con unet media di 465 anni e con il 20 di over 60 Il 65 delle donne i 10730 chars,di Michela Mantovan Il tasso di fecondit  il pi basso del mondo e gi nel 2025 sar il popolo pi anziano dopo il Qatar con unet media di 465 anni e con il 20 di over 60 Il 65 delle donne in et fertile dichiara non volere figli e il femminismo radicale peggiora la situazione Due ragazze sudcoreane con i bigodini in testa in coreano gyeonggija Portarli in pubblico  un segno di ribellione soft a regole sociali punitive nei confronti delle donne I giovani spariranno nel 2060 quando lavorer solo il 497 della popolazione Non nascono pi bambini in Sud Corea e la piccola ma potente tigre asiatica  in piena apocalisse demografica gi nel 2025 cio tra due anni i coreani saranno il secondo popolo pi anziano del mondo dopo il Qatar con unet media di 465 anni e con il 20 di over 60 Gli asili vengono trasformati in case di cura e di riabilitazione cos come i grandi saloni per le feste di nozze Di chi  la colpa Delle donne dicono qui i coreani a partire dal presidente Gi Il tasso di natalit  il pi basso del mondo cio 081 in un sondaggio del 2022 il 65 delle donne in et fertile dichiarava di non aver alcuna intenzione di fare figli Ma qual  la trama di questa storia che sembra distopica e invece  pura realt e nella quale in fondo si pu rispecchiare anche una parte del nostro mondo quello al di qua dellOceano Pacifico Bigodini contro manichini Non  raro passeggiando per le grandi strade di Seul osservare due cose da una parte molte ragazze e signore ben vestite e ben truccate ma con i bigodini in testa Dallaltra i manichini degli innumerevoli centri commerciali un Lui e una Lei che si tengono per mano vestiti uguali in Corea si chiama couple look look di coppia Due modelli travestiti da manichini in un centro commerciale di Seul  comune vedere un Lui e una Lei che si tengono per mano e sono vestiti nello stesso modo Si chiama couple look cio look di coppia Bigodini simbolo di ribellione estetica e di emancipazione contro manichini incarnazione di plastica della bellezza di essere in coppia questa  la sostanza di un clima di conflitto sociale che mette uomini contro donne donne contro patriarcato e famiglie giovani uomini contro femministe radicali Un popolo contro s stesso Kim JiYoung born in 1982  scritto da Cho NamJoo nel 2016  diventato un caso editoriale in Corea dove ha venduto pi di un milione di copie poi  stato tradotto in pi di dieci lingue ed  arrivato nel resto del mondo Questo libro  una specie di autopsia della maternit la protagonista sente di essere una mammascarafaggio  mamchoong  testualmente raccapricciante mentre osserva e ricorda la catena di piccole e grandi sopraffazioni delle quali  costellata la vita di una bambina e di una donna Si ribella a modo suo rifugiandosi nella psicosi Uno dei punti pi inquietanti  che il marito che potremmo definire una brava persona  il primo a non saper lottare contro un mondo disegnato da secoli proprio da altri uomini Uscire dalla gabbia La domanda  come  possibile lasciarsi davvero alle spalle il retaggio culturale del confucianesimo che istitu la regola dei 7 mali identificava le cause di divorzio in sterilit insubordinazione ai suoceri adulterio gelosia malattia cronica furto o loquacit se nessuno ha le chiavi per aprire la gabbia o avendole non le sa usare Il libro  diventato un riferimento del femminismo sudcoreano in tante si sono sentite comprese e raccontate Ma ovviamente questo non basta per fermare il suicidio di un popolo Manifestanti in sostegno al movimento MeToo al corteo per celebrare la Giornata internazionale della donna a Seul Corea del Sud 8 marzo 2018 Getty Images Le 4 B In Corea il MeToo ha messo radici pi che in ogni altro Paese asiatico e poi  nato il movimento 4B il femminismo radicale Significa 4NO niente appuntamenti niente sesso niente matrimonio e niente educazione dei figli parole che in coreano incominciano con la lettera B Ma forse non  il ritiro sociale la risposta alle discriminazioni sul lavoro alla violenza di genere alla disparit a tutti i livelli sui quali possono misurarsi gli essersi umani Tra laltro a volte le situazioni sono grottesche quasi comiche in un caso molto citato lazienda principale che produce latte in polvere  stata accusata di aver cercato di convincere le dipendenti a dimettersi dopo la gravidanza Le donne in Corea sono in sciopero contro il fatto di essere macchine per fare bambini  questo  il titolo di un saggio pubblicato a fine gennaio dal New York Times  della scrittrice Hawon Yung che riflette su un punto cruciale Le donne sono stufe delle aspettative impossibili di questa societ tradizionalista nei confronti delle madri Un cartello portato in piazza dalle donne sudcoreane che manifestano a Seul contro gli abusi sessuali che nel Paese restano impuniti Getty Images Colpe e minaccia Il presidente Yoon Sukyeol ha suggerito che la colpa  del femminismo per aver bloccato le relazioni sane tra uomini e donne Ma ha capito al contrario luguaglianza di genere  la soluzione al calo dei tassi di natalit Rendere la vita pi giusta e pi sicura per le donne farebbe miracoli per ridurre la minaccia esistenziale del Paese Una serie coreana firmata Netflix di grande successo si intitola Avvocata Woo e racconta linserimento nella societ e nel mondo del lavoro di una geniale avvocata autistica assunta da un importante studio legale di Seul Lepisodio numero 12 racconta con un alto tasso di sincerit il ricatto diffuso delle aziende alle donne sempre spinte a dimettersi quando c una fusione aziendale o una crisi Una fotografia realistica che per dice anche come la crescente consapevolezza della discriminazione stia generando la voglia di rompere un tetto che non  di cristallo ma di roccia Il risentimento Nellultima campagna elettorale che appunto ha portato al potere i conservatori di Yoon Sukyeol ha vinto per lo 073 si  litigato moltissimo sulla questione dei diritti il People Power Party ha annunciato lintenzione in caso di vittoria di cancellare il ministero per la parit di genere che era stato istituito da un governo liberale nel 2001 Una mossa per intercettare la rabbia dei coreani maschi pi giovani che infatti sorprendentemente lhanno votato descritti come animati da risentimento nei confronti del femminismo Sono nati movimenti contro la misandria come Man of Solidarity guidato da Bae InKyu 31 anni Non odiamo le donne e non ci opponiamo al fatto che i loro diritti siano innalzati Ma le femministe sono un male sociale La giudice costituzionale Lee Jungmi al suo arrivo a una seduta della Corte costituzionale con i bigodini nei capelli era il 2017 La partita dei giovani Eppure i giovani sono stati il pilastro della fioritura che ha portato il Paese dalla dittatura dei generali alla democrazia dal blocco culturale alla Korean Wave londa coreana Che Andrew Jackson docente di Korean Studies alla Monash University di Melbourne cos spiega a 7 Durante i quasi 30 anni di dittatura i sudcoreani non potevano viaggiare allestero a meno che non avessero pi di 50 anni appartenessero a una buona famiglia oppure avessero motivi di lavoro o di studio Per avere il visto bisognava pagare un sacco di soldi Uno dei messaggi che i dittatori usavano era cultural blockade  un embargo della cultura Tutto questo fino al 1987 Lanno in cui fu introdotta la democrazia nel 1988 la Corea avrebbe ospitato le Olimpiadi Il professore Jackson racconta che prima di allora la produzione di film uno dei veicoli principali di emancipazione e di crescita era inesistente dallestero ne arrivavano pochissimi da Hollywood da Hong Kong in ogni caso tutti politicamente innocui Ma cerano dei buchi nel muro del regime e qualche film italiano o la nouvelle vague francese arrivava illegalmente Le video cassette venivano duplicate e diffuse ognuno cos creava il proprio cinema un cinema underground La diffusione dei film avveniva nei campus universitari poi i giovani andavano a vederseli nei club o in sale private La copertina di Kim Jiyoung nata nel 1982 di Cho NamJoo La moglie coreana di Min Jin Lee dal quale  stata tratta anche una serie televisiva molto seguita Limportazione della cultura port a un passaggio cruciale cio alla voglia di produrla Tanto che le persone che ora sono ai vertici dellindustria culturale sono le stesse che si autoeducarono in quello spirito di resistenza alla dittatura spiega Jackson Durante il regime ci fu un boom economico e cos nei primi anni 90 persone giovani si ritrovarono con tanti soldi da spendere parte dei quali finirono in dischi stereo Cultura Pi o meno nello stesso momento il governo realizz il fatto che siamo indietro rispetto al resto del mondo I nostri film sono terribili nessuno vuole vederli Molte universit nacquero proprio allora grazie a enormi investimenti Il merito va soprattutto alla visione di Kim Youngsam primo presidente democraticamente eletto nel 1992 ndr  un coraggioso ex dissidente che divenne un vero e proprio padre della patria La Sud Corea ha lottato fortemente per imporsi sulla scena economica mondiale e anche su quella culturale lapice  stato raggiunto nel 2019 con il film Parasite  che ha vinto ben 4 premi Oscar E ha raccontato una parte abbastanza estrema della societ Il professor Jackson che  inglese  arrivato nel Paese nel 1993 S ho insegnato nelle case di persone ricche e ho anche vissuto invece in case molto povere come nel film La societ sudcoreana  profondamente classista Non sono un esperto di questioni gender per certo le donne sono state sempre considerate cittadini di seconda classe E il conflitto sociale  indubbiamente forte Uccidere lamore Uno dei proverbi pi antichi e popolari suona cos Sposarsi non  solo andare in portantina Lallusione  alla sfarzosa cerimonia durante la quale la sposa faceva il viaggio ufficiale verso la casa della famiglia dello sposo Il che significava lasciarsi alle spalle ogni cosa a partire dal nome S le donne avevano solo soprannomi o pi facilmente erano riconosciute come la moglie di Ora le quattro Blackpink  una delle band pi importanti del KPop scrivono canzoni come Kill this loveo Lovesik girls  Didnt wanna be a princess Im pricelessA prince not even on my list Love is a drug that I quit Non volevo essere una principessa non ho prezzo un principe non  nemmeno sulla mia lista Lamore  una droga che non uso pi  IDENTIKIT DEL PAESE La tigre asiatica In Sud Corea vivono 515 milioni di persone met uomini e met donne Let media  di 465 anni E una delle economie pi forti dellAsia  al quarto posto dopo Cina Giappone e India Nellarea della capitale Seul vivono circa 20 milioni di persone Dopo la dominazione giapponese e i 26 anni di dittatura militare nel 1987  stata introdotta la democrazia anche se il primo vero presidente eletto democraticamente  stato lex dissidente Kim Youngsam salito al potere nel 1992 Fu lui ad avviare in concreto la democratizzazione della Corea con una serie di riforme politiche e sociali Lo scorso anno dopo una campagna elettorale allultimo voto  stato eletto Yoon Sukyeol leader del Power People Party il partito conservatore Yoon Sukyeol leader del Power People Party il partito conservatore Lo scontro tra i sessi In Sud Corea il tasso di natalit  il pi basso del mondo 081 figli per donna e il Paese corre il rischio di estinzione demografica Tra i motivi la mancanza di parit dei diritti e una profonda disuguaglianza tra uomini e donne anche sul fronte delloccupazione Un ruolo importante  stato giocato dal confucianesimo che per secoli ha contribuito impedire la parit  RIPRODUZIONE RISERVATA,business,Il mondo dopo il Qatar con unet media di 465 anni e con il 20 di over 60 Il 65 delle donne in et fertile dichiara non volere figli e il femminismo radicale peggiora la situazione Due ragazze sudcore
https://www.theguardian.com/business/2023/apr/03/uk-efforts-to-tackle-modern-slavery-are-waning-analysis-finds,UK efforts to tackle modern slavery are waning analysis finds,Number of firms disclosing antislavery measures within supply chains has nearly halved says CipsEfforts to tackle modern day slavery are stalling with nearly half the number of companies disclosing antislavery measures within their supply chains according,Efforts to tackle modern day slavery are stalling with nearly half the number of companies disclosing antislavery measures within their supply chains according to the international procurement body 3575 chars,Efforts to tackle modern day slavery are stalling with nearly half the number of companies disclosing antislavery measures within their supply chains according to the international procurement body Only 29 of organisations required to produce a modern slavery statement have submitted it to the UK government registry for 2022 an analysis by the Chartered Institute of Procurement and Supply Cips found It called on ministers to better enforce critical transparency rules that it said were being ignored Companies with a turnover of more than 36m a year are required to publish an annual statement outlining the steps they are making to address slavery in supply chains according to the UKs Modern Slavery Act 2015 They are also strongly encouraged to submit statements to the Home Offices modern slavery statement registry although it is not mandatory However the registry recorded just 8074 statements submitted in 2022 a sharp 46 drop from the 15019 submitted the previous year the Cips found It is despite more than onethird of organisations saying they think modern slavery abuses are most likely to occur in the UK as part of their supply chain followed by 18 who said China and fewer than a 10th who said India according to registry data The Cips noted that companies have a grace period of six months to produce 2022s statement but said efforts to submit statements could be waning without more government pressure David Taylor its chief operating officer said It is an open secret that vulnerable adults and children are exploited every day to produce the goods and services we consume Organisations are facing enormous pressures across their supply chains and in these circumstances it might be tempting to turn a blind eye to modern slavery and prioritise other challenges But it is precisely during times of economic hardship that we must be vigilant and keep up our efforts to tackle this issue He said the data was a vital resource to help tackle modern slavery but is now being ignored Furthermore almost a quarter of the statements submitted last year lacked basic information about the steps being taken such as including measurable goals The government is expected to introduce a new modern slavery bill to parliament this year that would make submissions mandatory for qualifying businesses skip past newsletter promotion Sign up to Business Today Free daily newsletter Get set for the working day  well point you to all the business news and analysis you need every morning Privacy Notice Newsletters may contain info about charities online ads and content funded by outside parties For more information see our Newsletters may contain info about charities online ads and content funded by outside parties For more information see our Privacy Policy  We use Google reCaptcha to protect our website and the Google Privacy Policy and Terms of Service apply after newsletter promotion But the body pointed out that the government has not appointed someone to fill the post of independent antislavery commissioner since April last year a role required to scrutinise legislation and hold companies to account The analysis comes after Rishi Sunak received criticism last week over his flagship immigration measures which could make it harder for modern slavery and trafficking victims to come forward amid the risk of deportation The former prime minister Theresa May appealed for such victims to be excluded from changes within the illegal migration bill which seeks to remove protections for people who are judged to have entered the UK illegally May said the bill would drive a coach and horses through the Modern Slavery Act denying support to those who have been exploited and enslaved The Home Office minister Robert Jenrick replying for the government said it had seen mounting evidence of abuse of the modern slavery system,business,Efforts to tackle modern day slavery are stalling with nearly half the number of companies disclosing antislavery measures within their supply chains according to the international procurement body
https://www.forbes.com/sites/davidblackmon/2023/04/02/a-spate-of-recent-deals-raises-chatter-of-a-fading-petrodollar/,A Spate Of Recent Deals Raises Chatter Of A Fading Petrodollar,As trade relationships and geopolitics surrounding international oil trading continue to evolve a spate of recent transactions and agreements have crated chatter that the petrodollar may be losing its longtime global dominance,The US dollar has been the dominant currency for international oil trades for decades A spate of   recent deals and bilateral agreements involving key oil sellers and buyers has created chat 6158 chars,The US dollar has been the dominant currency for international oil trades for decades A spate of   recent deals and bilateral agreements involving key oil sellers and buyers has created chatter that the petrodollars dominance could be fading getty Following up on last weeks assessment of the rapidly evolving complexion of the world order in crude oil trading a spate of recent oilrelated international deals raises questions about whether the dominance of the petrodollar is evolving as well While no one has been surprised by Russias responding to western sanctions by pressuring its oil buyers to conduct transactions in roubles recent deals made among other nations to conduct trades in crude and petroleum products using other currencies have raised more eyebrows Examples Of Recent Deals So what is all the chatter about Here are a few examples of recent international deals and new alliances that are raising questions about the future of the petrodollar On March 28 Brazil and China two members in the increasingly influential BRICS Alliance announced an agreement to conduct all future trade transactions using their own currencies China ranks as Brazils biggest trading partner On March 8 Reuters reported that Indian customers have paid for most Russian oil in nondollar currencies including the United Arab Emirates dirham and more recently the Russian rouble multiple oil trading and banking sources said On March 29 Saudi Arabia announced it has agreed to become a dialogue partner in the Shanghai Cooperation Organization a Chinaled political economic and security organization designed to compete with similar Western organizations This latest indication of strengthening ties between Saudi Arabia and China came just just weeks after the Kingdom and Iran announced an agreement to reestablish diplomatic relations that had been brokered by China weeks after the Kingdom and Iran announced an agreement to reestablish diplomatic relations that had been brokered by China Also on March 28 French oil giant Total Energies announced it had completed its first purchase of liquefied natural gas LNG from Chinese oil company CNOOC using the Chinese Yuan as the currency These and other agreements conducted in recent months have led to speculation that as oil markets continue to evolve the petrodollar could be losing its influence Some Background While a high percentage of international crude oil trades had long been conducted in US currency the petrodollar was more formally established as the global currency of mark for such trades in 1973 in the wake of the first Arab oil embargo Then the Richard Nixon administration executed an agreement with Saudi Arabian Prince Fand Ibn Abdel Aziz in which the Saudi Kingdom agreed to conduct its oil trades in US dollars in exchange for US military support and hardware The establishment of this arrangement between what at the time were the largest buyer of crude oil the United States and the biggest exporter of the product Saudi Arabia created a paradigm that other importing and exporting nations quickly began to follow Since that time a strong majority of international oil trades have traditionally been conducted in US currency ie the petrodollar Today even amid global tensions shifting international trade arrangements and a spate of new deals to conduct transactions in competing currencies like the Russian rouble and the Chinese Yuan a recent analysis by PhD economist Anas Alhajji managing partner of Energy Outlook Advisors points out that fully 60 of official foreign exchange reserves conducted in Q1 2022 were transacted using US dollars according to IMF data Alhajji adds Yes with the rise of the euro Japans yen and Chinas yuan the US dollar lost some ground but here is the shocker based on the most recent data from the International Monetary Fund IMF the US dollars share is where it was in 1995 What The Future Could Hold Though Russia and a few other oil producing countries have pressured buyers to conduct trades in nondollar currencies for years there is no question that the divisive nature of Vladimir Putins war on Ukraine has caused such pressures to rise In our interview in February SP Global Vice Chairman Daniel Yergin pointed out that just 37 of the worlds 195 countries are enforcing western sanctions applied to Russia exacerbating alreadyextant international divisions Such divisions and pressures to trade outside the petrodollar seem likely to only continue to increase as Russias war lingers on without resolution The ongoing rise of China as a geopolitical power and competitor to US international dominance and the postWWII liberal world order also seems certain to increase pressure on the current petrodollar system The heightening influence of the BRICS Alliance and its plans for expansion seems likely to also result in stronger competition to the US dollar in international trades BRICS members Brazil Russia India China and South Africa voted last year to consider admitting new members and Russian Foreign Minister Sergei Lavrov claimed recently that more than a dozen nations have since expressed an interest in joining the group Saudi Arabia has been frequently mentioned as a likely possibility to make that move Other countries rumored to have expressed an interest include Egypt Indonesia Turkey Thailand and the United Arab Emirates All of these factors could lead to declining influence of the US and its currency in international dealings Still while recognizing all of these factors Alhajji emphatically states that the US dollar is losing ground but it is not losing dominance Bottom Line There can be little doubt that the United States is in the process of gradually pulling back from the role it adopted at the end of WWII to become the worlds global policeman Despite their major rhetorical differences this gradual pulling back has been a prevailing feature of the presidencies of Barack Obama Donald Trump and Joe Biden It is not an accident that the influence of the petrodollar has declined apace with this US pullback For now though diminished the petrodollar remains the dominant currency for trades in oil and petroleum products But that status will continue to evolve along with the ongoing realignment of global trade and geopolitical alliances,business,The US dollar has been the dominant currency for international oil trades for decades
