URL,Title,Description,Content,full-content,one line summary,topic
https://www.theguardian.com/world/live/2023/apr/02/russia-ukraine-war-live-absurd-and-destructive-for-russia-to-chair-security-council-says-zelenskiy,RussiaUkraine war live Absurd and destructive for Russia to chair security council says Zelenskiy,President furiously criticises international system for letting Russia hold key role while it wages war on Ukraine where top official calls it a symbolic blowFollow our Ukraine coverageWelcome back to our continuing coverage of the war in Ukraine Well be,Welcome back to our continuing coverage of the war in Ukraine Well be bringing you the latest developments as they happenRussia assumed charge of the UN security council on Saturday causing fury in 4157 chars,From 18h ago 1731 BST Russian prowar blogger killed in blast  reports A wellknown Russian military blogger Vladlen Tatarsky was killed in an explosion in a cafe in Russias second largest city of St Petersburg on Sunday the RIA news agency has reported At least 16 people were injured in the incident It is unclear whether the blast was directly linked to the conflict with Ukraine Updated at 1743 BST 17h ago 1848 BST A summary of todays developments A prominent prowar Russian military blogger has been killed in a blast in a cafe in central St Petersburg Russias interior ministry has said Vladlen Tatarsky whose real name was Maxim Fomin had more than 560000 followers on Telegram and was one of the countrys most influential military bloggers The interior ministry said 19 people were injured in the blast on Sunday Tatarsky was among the attendees at a Kremlin ceremony last September where Vladimir Putin proclaimed Russias annexation of four partly occupied regions of Ukraine a move widely condemned by the international community It is unclear whether the blast was directly linked to the conflict with Ukraine Russian forces have seen an extremely high number of incidents  including deaths  attributed to drunkenness during the war the UKs Ministry of Defence has said in its daily briefing While Russia has suffered up to 200000 casualties since its fullscale invasion of Ukraine a significant minority of these have been due to noncombat causes On 27 March 2023 a Russian Telegram news channel reported there have been extremely high numbers of incidents crimes and deaths linked to alcohol consumption amongst the deployed Russian forces At least three civilians have been killed and six wounded in Russian shelling of Kostiantynivka in eastern Ukraine on Sunday morning Reuters quotes a senior Ukrainian official as saying The European Union will stand against any abuse during Russias leadership of the United Nations security council over the next month its top diplomat Josep Borrell has said Borrell told Agence FrancePresse Despite being a permanent member of the security council Russia continuously violates the very essence of the UN legal framework The EU will stand against any abuse by the Russian presidency The Russian foreign minister Sergei Lavrov held a phone call with the US secretary of state Antony Blinken Reuters reports Lavrov reportedly claimed that Washington was trying to politicise the case of the Wall Street Journal reporter Evan Gershkovich who has been accused of spying in Russia calling this unacceptable The Russian foreign ministry said Lavrov told Blinken that Gershkovichs fate would be determined by a court Ukrenergo Ukraines electricity transmission operator said it has fully restored power to the country after a massive missile attack on 9 March The company said there were no restrictions on energy consumption after it finished its work in the central region Sky News reported Updated at 1851 BST 17h ago 1839 BST Russian investigators and police officers at the site of the blast in St Petersburg Photograph AP Updated at 1848 BST 17h ago 1836 BST Emergency services outside the cafe where the prowar blogger Vladlen Tatarsky was killed and at least 16 people were injured in the explosion Photograph AP Updated at 1847 BST 17h ago 1833 BST Russian police officers at the site of the explosion in St Petersburg Photograph AP Updated at 1834 BST 17h ago 1830 BST An investigator speaks on a phone at the site of the explosion at a cafe in St Petersburg Photograph AP Updated at 1833 BST 18h ago 1818 BST The British former air vicemarshal Sean Bell told Sky News there was not enough detail to suggest a perpetrator behind the blast in St Petersburg but he thought it was unlikely the Ukrainian government was involved He said It could have been the resistance movement much more likely As rising Russian casualties from the war in Ukraine theres increasing domestic unrest back at home If Tatarsky was deliberately targeted it would be the second assassination on Russian soil of a highprofile figure associated with the war in Ukraine Russias federal security service FSB accused Ukraines secret services last August of killing Darya Dugina the daughter of an ultranationalist in a car bomb attack near Moscow that Vladimir Putin called evil Ukraine denied involvement Updated at 1828 BST 18h ago 1803 BST Saudi Arabia and other Opec members have announced voluntary cuts to their oil production of about 115m barrels a day in a surprise move they said was aimed at supporting market stability The group of oilproducing countries had been largely expected to stick to its already agreed cuts of 2 million barrels a day when its ministerial panel which includes Saudi Arabia and Russia meets virtually on Monday The US has argued that the world needs lower prices to support economic growth and prevent Vladimir Putin from earning more revenue to fund Russias invasion of Ukraine Opec announces surprise cuts in oil production Read more Updated at 1807 BST 18h ago 1754 BST The military blogger Vladlen Tatarsky who was killed in the bomb blast in a cafe in St Petersburg on Sunday had more than 560000 followers on Telegram and was one of the most prominent of the influential military bloggers who have provided an often critical running commentary on Russias war in Ukraine Tatarsky whose real name was Maxim Fomin was among hundreds of attendees at a lavish Kremlin ceremony last September to proclaim Russias annexation of four partly occupied regions of Ukraine a move that most countries at the UN condemned as illegal Reuters reported A St Petersburg website said the explosion took place at a cafe that had at one time belonged to Yevgeny Prigozhin the founder of the Wagner private army that is fighting for Russia in Ukraine There was no indication who was behind the blast Updated at 1757 BST 18h ago 1731 BST Russian prowar blogger killed in blast  reports A wellknown Russian military blogger Vladlen Tatarsky was killed in an explosion in a cafe in Russias second largest city of St Petersburg on Sunday the RIA news agency has reported At least 16 people were injured in the incident It is unclear whether the blast was directly linked to the conflict with Ukraine Updated at 1743 BST 19h ago 1711 BST The European Union will stand against any abuse during Russias leadership of the United Nations security council over the next month its top diplomat Josep Borrell has said Borrell told Agence FrancePresse Despite being a permanent member of the security council Russia continuously violates the very essence of the UN legal framework The EU will stand against any abuse by the Russian presidency Updated at 1720 BST 19h ago 1644 BST Ukrenergo Ukraines electricity transmission operator said it has fully restored power to the country after a massive missile attack on 9 March The company said there were no restrictions on energy consumption after it finished its work in the central region Sky News reported The Zaporizhzhia power station which accounted for 20 of the countrys power generation before the invasion has been offline since September In a post on Telegram Ukrenergo thanked its Lithuanian colleagues for their assistance All restrictions on consumption which were introduced in the Kyiv region Zhytomyr region and Kharkiv region due to equipment damage during a massive enemy missile attack on 9 March have been lifted the statement read In other regions there are also no restrictions in Ukrenergo networks that would lead to the need to limit consumption Updated at 1652 BST 19h ago 1632 BST A person collects scrap metal in the aftermath of shelling of residential buildings in Kostiantynivka Photograph Violeta Santos MouraReuters Updated at 1638 BST 19h ago 1627 BST Lilya 19 inspects her bedroom in the aftermath of Russian shelling of residential buildings in Kostiantynivka in the Donetsk region Photograph Violeta Santos MouraReuters Updated at 1637 BST 20h ago 1601 BST Heres a little more detail on that phone call between Lavrov and Blinken The latter called for Gershkovichs immediate release the US state department has said According to Reuters the principal deputy spokesperson Vedant Patel said Secretary Blinken conveyed the United States grave concern over Russias unacceptable detention of a US citizen journalist The secretary called for his immediate release The news agency reports that Moscow said Lavrov reiterated Russias assertion for which it has not publicly stated any evidence that the journalist was caught redhanded last week It quotes the foreign ministry as saying Blinkens attention was drawn to the need to respect the decisions of the Russian authorities taken in accordance with the law and international obligations of the Russian Federation It was emphasised that it is unacceptable for officials in Washington and the western media to whip up a stir with the clear intention of giving this case a political colouring The conversation was initiated by Blinken the Russian side said Updated at 1611 BST 20h ago 1537 BST The Russian foreign minister Sergei Lavrov held a phone call with the US secretary of state Antony Blinken Reuters reports Lavrov reportedly claimed Washington was trying to politicise the case of the Wall Street Journal reporter Evan Gershkovich who has been accused of spying in Russia calling this unacceptable The Russian foreign ministry said Lavrov told Blinken that Gershkovichs fate would be determined by a court Updated at 1611 BST 21h ago 1505 BST Pictures are emerging of damage in Kostyantynivka where Ukrainian officials say six people were killed and eight wounded in a Russian missile attack Residents walk next to a damaged residential building in the town of Kostyantynivka in the Donetsk region Photograph Genya SavilovAFPGetty Images Russian missiles hit a densely populated area of Kostyantynivka Photograph Genya SavilovAFPGetty Images A crater in front of a damaged house after a massive bombardment of the village near Bakhmut Photograph Genya SavilovAFPGetty Images Updated at 1612 BST 23h ago 1321 BST Russian forces affected by alcohol consumption UK government assessment says Russian forces have seen an extremely high number of incidents  including deaths  attributed to drunkenness during the war the UKs Ministry of Defence has said in its daily briefing While Russia has suffered up to 200000 casualties since its fullscale invasion of Ukraine a significant minority of these have been due to noncombat causes On 27 March 2023 a Russian Telegram news channel reported there have been extremely high numbers of incidents crimes and deaths linked to alcohol consumption amongst the deployed Russian forces Other leading causes of noncombat casualties likely include poor weapon handing drills road traffic accidents and climatic injuries such as hypothermia Russian commanders likely identify pervasive alcohol abuse as particularly detrimental to combat effectiveness However with heavy drinking pervasive across much of Russian society it has long been seen as a tacitly accepted part of military life even on combat operations Updated at 1328 BST,All this and more on the BBC News website.,entertainment
https://www.theguardian.com/world/2023/apr/02/russia-ukraine-war-at-a-glance-what-we-know-on-day-403-of-the-invasion,RussiaUkraine war at a glance what we know on day 403 of the invasion,Absurd and destructive that Russia chairs security council  says Zelenskiy top US general Milley says Ukraine unlikely to expel Russian forces this year Continue reading,liRussia assumed charge of the UN security council on Saturday causing fury inside Ukraine with its presidentVolodymyr Zelenskiy labelling the situation absurd and destructive Its hard to imagine 4132 chars,Russia assumed charge of the UN security council on Saturday  causing fury inside Ukraine with its president Volodymyr Zelenskiy labelling the situation absurd and destructive  Its hard to imagine anything that proves more the total bankruptcy of such institutions In his daily video address Zelenskiy pointed out that Russian shelling had killed a fivemonthold boy on Friday and said it was time for a general overhaul of global institutions A top Ukrainian official has criticised the symbolic blow of Russia assuming the rotating presidency Andriy Yermak the Ukrainian presidents chief of staff wrote Its not just a shame It is another symbolic blow to the rulesbased system of international relations The Kremlin has said it will exercise all its rights in the role Russias foreign minister Sergei Lavrov will chair the meeting when Russia assumes the council presidency As of 1 April theyre taking the level of absurdity to a new level said Sergiy Kyslytsya Kyivs permanent representative Ukraines foreign minister Dmytro Kuleba said it was a stark reminder that something is wrong with the way international security architecture is functioning An intelligence update from the UKs Ministry of Defence MoD says the performance of the Russian chief of the general staff General Valery Gerasimov is pushing the limits of how far Russias political leadership will tolerate failure It adds Gerasimovs tenure has been characterised by an effort to launch a general winter offensive with the aim of extending Russian control over the whole of the Donbas region Eighty days on it is increasingly apparent that this project has failed Russias defence minister Sergei Shoigu has promised to increase the supply of munitions to Russian forces during a visit to the headquarters of Moscows troops fighting in Ukraine according to footage published by the defence ministry The International Monetary Funds executive board has approved a fouryear 156bn loan programme for Ukraine part of a global 115bn package of economic support The decision clears the way for an immediate disbursement of about 27bn to Kyiv and requires Ukraine to carry out ambitious reforms especially in the energy sector the fund has said The top US general Mark Milley has said Ukraine is unlikely to expel all Russian troops from its territory this year the Kyiv Independent reports citing an interview with Defense One Milley said I dont think its likely to be done in the nearterm for this year At least five people including a baby have been killed in Ukraine in the past 24 hours according to the Kyiv Independent Prosecutors have asked a court to put the abbot of the KyivPechersk Lavra monastery Metropolitan Pavel under house arrest He is accused of supporting Russias invasion of Ukraine and inciting religious hatred Pavel denies wrongdoing Volodymyr Zelenskiy wrote online that he had talks with Frances president Emmanuel Macron to discuss defence interaction and further steps to implement PeaceFormula Russia has lost at least six Zoopark1M counterbattery radar and will struggle to regenerate them because of sanctions the UK Ministry of Defence MoD has said The MoD added Regenerating counterbattery radar fleets is likely a key priority for both sides but Russia will likely struggle because the systems rely on supplies of hightech electronics which have been disrupted by sanctions Vladimir Putin has signed off on a new Russian foreign policy strategy aimed at curtailing western dominance and identifying China and India as key partners for the future The document cements the deep cold warstyle rupture between Russia and the west over Moscows war on Ukraine North Koreas Kim Yojong the sister of leader Kim Jongun has accused Ukraine of having nuclear ambitions state media KCNA has reported  basing her assertion on an online petition with fewer than 1000 signatures,"Ukraine's President Petro Poroshenko has called Russia's decision to take charge of the UN's security council ""shameful"".",entertainment
https://consent.google.com/ml?continue=https://news.google.com/rss/articles/CBMiYWh0dHBzOi8vd3d3LmN0dm5ld3MuY2Evd29ybGQvbWVldC10aGUtanVkZ2UtcHJlc2lkaW5nLW92ZXItdHJ1bXAtcy1jcmltaW5hbC1hcnJhaWdubWVudC0xLjYzMzkxMTTSAQA?oc%3D5&gl=FR&hl=en-US&cm=2&pc=n&src=1,Who is the judge handling Trumps criminal arraignment  CTV News,olliWho is the judge handling Trumps criminal arraignment CTV News liliTrumps arrest expected after historic indictment in New York Global News liliTrump facing at least one felony charge in grand jury indictment The Globe and Mail li,We use cookies and data toulliDeliver and maintain Google servicesliliTrack outages and protect against spam fraud and abuseliliMeasure audience engagement and site statistics to unde 1131 chars,When Donald Trump enters a New York courtroom on Tuesday hell face a seasoned judge who is no stranger to the former presidents orbit Acting New York Supreme Court Judge Juan Merchan has sentenced Trumps close confident Allen Weisselberg to prison presided over the Trump Organization tax fraud trial and overseen former adviser Steve Bannons criminal fraud case But Trumps historic arraignment on Tuesday will perhaps be Merchans most highprofile case to date even after a long career atop the statelevel trial court Merchan has been described by observers as a tough judge yet one who is fair no matter who is before him Heres what you need to know A MAN OF HIS WORD Trumps arraignment is likely to be a spectacle with a show of law enforcement and with the former president already fanning the flames on social media with his views on Merchan and his indictment But in the courthouse Merchan does not stand for disruptions or delays attorneys who have appeared before him told CNN and hes known to maintain control of his courtroom even when his cases draw considerable attention Judge Merchan was efficient practical and listened carefully to what I had to say Nicholas Gravante the attorney who represented Weisselberg in his plea said via email He was clear in signaling his judicial inclinations which helped me tremendously in giving Mr Weisselberg informed legal advice Judge Merchan was always wellprepared accessible and  most importantly in the Weisselberg matter  a man of his word He treated me and my colleagues with the utmost respect both in open court and behind closed doors Karen Friedman Agnifilo a private practice attorney who previously worked as the chief assistant district attorney in the Manhattan District Attorneys Office supervising cases Merchan presided over echoed that sentiment Merchan doesnt let the prosecutors or the defendants create any issues in his courtroom He doesnt let a media circus or any other kind of circus happen I dont think Donald Trump attacking him and threatening him is going to bode very well for him in the courtroom Agnifilo said The judge is the kind of judge where he will ignore it and not hold it against Donald Trump Hes not vindictive in any way like that TOUGH BUT COMPASSIONATE Merchan showed some of his tough side when Weisselberg was sentenced telling the former Trump associate that if he had not already promised him a fivemonth sentence he would have handed him a much greater sentence after having listened to evidence at trial When he presided over Bannons criminal fraud case Merchan chastised the former Trump aides new team of attorneys for delaying the case when they asked for more time to review new evidence In addition to the Trump cases Merchan has also presided over other highprofile cases including the soccer mom madam trial in which he set a 2 million bond for suburban mom Anna Gristina who was charged with running a 2000anhour escort service for the wealthy Bloomberg News reported Merchan also handed a 25yearstolife sentence to a Senegalese man who raped and murdered his girlfriend Trump attorney Timothy Parlatore said during an interview Friday on CNN that Merchan was not easy on him when he tried a case before him but echoed that the judge likely will be fair Ive tried a case in front of him before He could be tough I dont think its necessarily going to be something thats going to change his ability to evaluate the facts and the law in this case Parlatore said Merchan however is also credited by his peers for having helped create the Manhattan Mental Health Court which he often presides over and where he has earned a reputation for compassionate rulings that give defendants second chances I watched a colleague of mine try a shooting case where someone got shot so hes able to try those very serious violent crimes and then switch said Brendan Tracy a criminal defense attorney who previously served as an assistant district attorney in the Manhattan District Attorneys Office Maybe someone who was a serial shoplifter and then charged with grand larceny and is in mental health treatment court because they had mental health issues he was able to handle the wide range of cases and do them all fairly Tracy added Still Earl Ward a trial attorney and chair of public defender nonprofit The Bronx Defenders said that having watched Merchan preside over cases in the Mental Health Court the judge often sided with prosecutors Hes fair and his rulings are consistent with the law but if its a close call his reputation is that he lands on the prosecutions side Ward said EARLY CAREER Merchan launched his legal career in 1994 when he started off as an assistant district attorney in the trial division in the Manhattan District Attorneys Office Several years later he moved on to the state attorney generals office where he worked on cases in Long Island In 2006 New York Mayor Michael Bloomberg then a Republican appointed Merchan to Family Court in the Bronx and Democratic Gov David Paterson appointed him to the New York State Court of Claims in 2009 the same year he began serving as an acting New York Supreme Court Judge Born in Bogota Colombia Merchan emigrated to the United States at the age of 6 and grew up in the New York City neighborhood of Jackson Heights Queens according to a New York Times profile of the judge He was the first in his family to go to college Merchan initially studied business at Baruch College in New York before he dropped out of school to go work only to return several years later to finish school so that he could get his law degree the Times reported He eventually received his law degree from Hofstra University,If you continue to use the site you are agreeing to our use of cookies.,entertainment
