URL,Title,Description,Content,full-content,one line summary,topic
https://www.corriere.it/sette/esteri/23_aprile_02/sciopero-madri-corea-sud-tigre-asiatica-rischia-l-estinzione-04bc705a-cd71-11ed-ab8e-1e4a885c119f.shtml,Sciopero delle madri in Corea del Sud la tigre asiatica rischia lestinzione,Il tasso di fecondit  il pi basso del mondo e gi nel 2025 sar il popolo pi anziano dopo il Qatar con unet media di 465 anni e con il 20 di over 60 Il 65 delle donne in et fertile dichiara non volere figli e il femminismo radicale peggiora la sit,di Michela Mantovan Il tasso di fecondit  il pi basso del mondo e gi nel 2025 sar il popolo pi anziano dopo il Qatar con unet media di 465 anni e con il 20 di over 60 Il 65 delle donne i 10730 chars,di Michela Mantovan Il tasso di fecondit  il pi basso del mondo e gi nel 2025 sar il popolo pi anziano dopo il Qatar con unet media di 465 anni e con il 20 di over 60 Il 65 delle donne in et fertile dichiara non volere figli e il femminismo radicale peggiora la situazione Due ragazze sudcoreane con i bigodini in testa in coreano gyeonggija Portarli in pubblico  un segno di ribellione soft a regole sociali punitive nei confronti delle donne I giovani spariranno nel 2060 quando lavorer solo il 497 della popolazione Non nascono pi bambini in Sud Corea e la piccola ma potente tigre asiatica  in piena apocalisse demografica gi nel 2025 cio tra due anni i coreani saranno il secondo popolo pi anziano del mondo dopo il Qatar con unet media di 465 anni e con il 20 di over 60 Gli asili vengono trasformati in case di cura e di riabilitazione cos come i grandi saloni per le feste di nozze Di chi  la colpa Delle donne dicono qui i coreani a partire dal presidente Gi Il tasso di natalit  il pi basso del mondo cio 081 in un sondaggio del 2022 il 65 delle donne in et fertile dichiarava di non aver alcuna intenzione di fare figli Ma qual  la trama di questa storia che sembra distopica e invece  pura realt e nella quale in fondo si pu rispecchiare anche una parte del nostro mondo quello al di qua dellOceano Pacifico Bigodini contro manichini Non  raro passeggiando per le grandi strade di Seul osservare due cose da una parte molte ragazze e signore ben vestite e ben truccate ma con i bigodini in testa Dallaltra i manichini degli innumerevoli centri commerciali un Lui e una Lei che si tengono per mano vestiti uguali in Corea si chiama couple look look di coppia Due modelli travestiti da manichini in un centro commerciale di Seul  comune vedere un Lui e una Lei che si tengono per mano e sono vestiti nello stesso modo Si chiama couple look cio look di coppia Bigodini simbolo di ribellione estetica e di emancipazione contro manichini incarnazione di plastica della bellezza di essere in coppia questa  la sostanza di un clima di conflitto sociale che mette uomini contro donne donne contro patriarcato e famiglie giovani uomini contro femministe radicali Un popolo contro s stesso Kim JiYoung born in 1982  scritto da Cho NamJoo nel 2016  diventato un caso editoriale in Corea dove ha venduto pi di un milione di copie poi  stato tradotto in pi di dieci lingue ed  arrivato nel resto del mondo Questo libro  una specie di autopsia della maternit la protagonista sente di essere una mammascarafaggio  mamchoong  testualmente raccapricciante mentre osserva e ricorda la catena di piccole e grandi sopraffazioni delle quali  costellata la vita di una bambina e di una donna Si ribella a modo suo rifugiandosi nella psicosi Uno dei punti pi inquietanti  che il marito che potremmo definire una brava persona  il primo a non saper lottare contro un mondo disegnato da secoli proprio da altri uomini Uscire dalla gabbia La domanda  come  possibile lasciarsi davvero alle spalle il retaggio culturale del confucianesimo che istitu la regola dei 7 mali identificava le cause di divorzio in sterilit insubordinazione ai suoceri adulterio gelosia malattia cronica furto o loquacit se nessuno ha le chiavi per aprire la gabbia o avendole non le sa usare Il libro  diventato un riferimento del femminismo sudcoreano in tante si sono sentite comprese e raccontate Ma ovviamente questo non basta per fermare il suicidio di un popolo Manifestanti in sostegno al movimento MeToo al corteo per celebrare la Giornata internazionale della donna a Seul Corea del Sud 8 marzo 2018 Getty Images Le 4 B In Corea il MeToo ha messo radici pi che in ogni altro Paese asiatico e poi  nato il movimento 4B il femminismo radicale Significa 4NO niente appuntamenti niente sesso niente matrimonio e niente educazione dei figli parole che in coreano incominciano con la lettera B Ma forse non  il ritiro sociale la risposta alle discriminazioni sul lavoro alla violenza di genere alla disparit a tutti i livelli sui quali possono misurarsi gli essersi umani Tra laltro a volte le situazioni sono grottesche quasi comiche in un caso molto citato lazienda principale che produce latte in polvere  stata accusata di aver cercato di convincere le dipendenti a dimettersi dopo la gravidanza Le donne in Corea sono in sciopero contro il fatto di essere macchine per fare bambini  questo  il titolo di un saggio pubblicato a fine gennaio dal New York Times  della scrittrice Hawon Yung che riflette su un punto cruciale Le donne sono stufe delle aspettative impossibili di questa societ tradizionalista nei confronti delle madri Un cartello portato in piazza dalle donne sudcoreane che manifestano a Seul contro gli abusi sessuali che nel Paese restano impuniti Getty Images Colpe e minaccia Il presidente Yoon Sukyeol ha suggerito che la colpa  del femminismo per aver bloccato le relazioni sane tra uomini e donne Ma ha capito al contrario luguaglianza di genere  la soluzione al calo dei tassi di natalit Rendere la vita pi giusta e pi sicura per le donne farebbe miracoli per ridurre la minaccia esistenziale del Paese Una serie coreana firmata Netflix di grande successo si intitola Avvocata Woo e racconta linserimento nella societ e nel mondo del lavoro di una geniale avvocata autistica assunta da un importante studio legale di Seul Lepisodio numero 12 racconta con un alto tasso di sincerit il ricatto diffuso delle aziende alle donne sempre spinte a dimettersi quando c una fusione aziendale o una crisi Una fotografia realistica che per dice anche come la crescente consapevolezza della discriminazione stia generando la voglia di rompere un tetto che non  di cristallo ma di roccia Il risentimento Nellultima campagna elettorale che appunto ha portato al potere i conservatori di Yoon Sukyeol ha vinto per lo 073 si  litigato moltissimo sulla questione dei diritti il People Power Party ha annunciato lintenzione in caso di vittoria di cancellare il ministero per la parit di genere che era stato istituito da un governo liberale nel 2001 Una mossa per intercettare la rabbia dei coreani maschi pi giovani che infatti sorprendentemente lhanno votato descritti come animati da risentimento nei confronti del femminismo Sono nati movimenti contro la misandria come Man of Solidarity guidato da Bae InKyu 31 anni Non odiamo le donne e non ci opponiamo al fatto che i loro diritti siano innalzati Ma le femministe sono un male sociale La giudice costituzionale Lee Jungmi al suo arrivo a una seduta della Corte costituzionale con i bigodini nei capelli era il 2017 La partita dei giovani Eppure i giovani sono stati il pilastro della fioritura che ha portato il Paese dalla dittatura dei generali alla democrazia dal blocco culturale alla Korean Wave londa coreana Che Andrew Jackson docente di Korean Studies alla Monash University di Melbourne cos spiega a 7 Durante i quasi 30 anni di dittatura i sudcoreani non potevano viaggiare allestero a meno che non avessero pi di 50 anni appartenessero a una buona famiglia oppure avessero motivi di lavoro o di studio Per avere il visto bisognava pagare un sacco di soldi Uno dei messaggi che i dittatori usavano era cultural blockade  un embargo della cultura Tutto questo fino al 1987 Lanno in cui fu introdotta la democrazia nel 1988 la Corea avrebbe ospitato le Olimpiadi Il professore Jackson racconta che prima di allora la produzione di film uno dei veicoli principali di emancipazione e di crescita era inesistente dallestero ne arrivavano pochissimi da Hollywood da Hong Kong in ogni caso tutti politicamente innocui Ma cerano dei buchi nel muro del regime e qualche film italiano o la nouvelle vague francese arrivava illegalmente Le video cassette venivano duplicate e diffuse ognuno cos creava il proprio cinema un cinema underground La diffusione dei film avveniva nei campus universitari poi i giovani andavano a vederseli nei club o in sale private La copertina di Kim Jiyoung nata nel 1982 di Cho NamJoo La moglie coreana di Min Jin Lee dal quale  stata tratta anche una serie televisiva molto seguita Limportazione della cultura port a un passaggio cruciale cio alla voglia di produrla Tanto che le persone che ora sono ai vertici dellindustria culturale sono le stesse che si autoeducarono in quello spirito di resistenza alla dittatura spiega Jackson Durante il regime ci fu un boom economico e cos nei primi anni 90 persone giovani si ritrovarono con tanti soldi da spendere parte dei quali finirono in dischi stereo Cultura Pi o meno nello stesso momento il governo realizz il fatto che siamo indietro rispetto al resto del mondo I nostri film sono terribili nessuno vuole vederli Molte universit nacquero proprio allora grazie a enormi investimenti Il merito va soprattutto alla visione di Kim Youngsam primo presidente democraticamente eletto nel 1992 ndr  un coraggioso ex dissidente che divenne un vero e proprio padre della patria La Sud Corea ha lottato fortemente per imporsi sulla scena economica mondiale e anche su quella culturale lapice  stato raggiunto nel 2019 con il film Parasite  che ha vinto ben 4 premi Oscar E ha raccontato una parte abbastanza estrema della societ Il professor Jackson che  inglese  arrivato nel Paese nel 1993 S ho insegnato nelle case di persone ricche e ho anche vissuto invece in case molto povere come nel film La societ sudcoreana  profondamente classista Non sono un esperto di questioni gender per certo le donne sono state sempre considerate cittadini di seconda classe E il conflitto sociale  indubbiamente forte Uccidere lamore Uno dei proverbi pi antichi e popolari suona cos Sposarsi non  solo andare in portantina Lallusione  alla sfarzosa cerimonia durante la quale la sposa faceva il viaggio ufficiale verso la casa della famiglia dello sposo Il che significava lasciarsi alle spalle ogni cosa a partire dal nome S le donne avevano solo soprannomi o pi facilmente erano riconosciute come la moglie di Ora le quattro Blackpink  una delle band pi importanti del KPop scrivono canzoni come Kill this loveo Lovesik girls  Didnt wanna be a princess Im pricelessA prince not even on my list Love is a drug that I quit Non volevo essere una principessa non ho prezzo un principe non  nemmeno sulla mia lista Lamore  una droga che non uso pi  IDENTIKIT DEL PAESE La tigre asiatica In Sud Corea vivono 515 milioni di persone met uomini e met donne Let media  di 465 anni E una delle economie pi forti dellAsia  al quarto posto dopo Cina Giappone e India Nellarea della capitale Seul vivono circa 20 milioni di persone Dopo la dominazione giapponese e i 26 anni di dittatura militare nel 1987  stata introdotta la democrazia anche se il primo vero presidente eletto democraticamente  stato lex dissidente Kim Youngsam salito al potere nel 1992 Fu lui ad avviare in concreto la democratizzazione della Corea con una serie di riforme politiche e sociali Lo scorso anno dopo una campagna elettorale allultimo voto  stato eletto Yoon Sukyeol leader del Power People Party il partito conservatore Yoon Sukyeol leader del Power People Party il partito conservatore Lo scontro tra i sessi In Sud Corea il tasso di natalit  il pi basso del mondo 081 figli per donna e il Paese corre il rischio di estinzione demografica Tra i motivi la mancanza di parit dei diritti e una profonda disuguaglianza tra uomini e donne anche sul fronte delloccupazione Un ruolo importante  stato giocato dal confucianesimo che per secoli ha contribuito impedire la parit  RIPRODUZIONE RISERVATA,Il tasso di fecondit il pi basso del mondo e gi nel 2025 sar il popolo pi anziano dopo il Qatar con unet media di 465 anni e con il 20 di over 60 Il 65 delle donne i 10730 chars.,entertainment
https://www.forbes.com/sites/swetakaushal/2023/04/02/india-box-office-bholaa-crosses-5-million-worldwide/,India Box Office Bholaa Crosses 5 Million Worldwide,Ajay Devgns latest directorial outing Bholaa made a rough opening collection of 13 million in India,Ajay Devgn on a poster of the Hindi film Bholaa ADFFilmsTSeries Ajay Devgns latest directorial outing Bholaa has made an opening collection roughly amounting to 13 million in India The fil 2943 chars,Ajay Devgn on a poster of the Hindi film Bholaa ADFFilmsTSeries Ajay Devgns latest directorial outing Bholaa has made an opening collection roughly amounting to 13 million in India The film stars Tabu Deepak Dobriyal and Gajraj Rao in important roles alongside Devgn in the lead role It released on on Thursday March 30 and is an official Hindi remake of the 2019 Tamil hit Kaithi written and directed by Lokesh Kanagaraj The new film has earned 38 million in three days in India Bholaa has grossed 54 million worldwide in the past three days and the India gross stood at 45 million Devgn has also produced under his banner Ajay Devgn FFilms Reliance Entertainment TSeries Films and Dream Warrior Pictures have also backed the film Thursday was a holiday in India as the festival of Ramnavmi was celebrated The film has garnered great word of mouth from critics and audiences alike Despite having a holiday only in the northern region the film has pulled in audiences to the theatres from all over India a statement from the producers said The collections took a slight dip on Friday as the holiday day one was followed by a working day Bholaa roughly 973464 in India on the second day of the release It collected 14 million on Saturday the third day of the release Both the original and the new films tell the story of a former prison inmate hoping to meet his young daughter whom he has never seen However he needs to make his wat through a catandmouse race between cops and the drugs mafia The original film was a box office hit and earned 14 million in India It featured Karthi Sivakumar in the lead role Devgns Hindi version takes the basic plotline and adds several interesting aspects to it He even introduces some quirky traits to major characters in the film Both the Tamil and Hindi films have been written by Kanagaraj The setting of Bholaa is largerthanlife and it does not guarantee much rationale The action sequences makes up for that and present a spectacle that actionfilmlovers are cherishing Devgn pulls off some of the most breathtaking bike stunts defying gravity ridiculously  he uses bikes as weapons and at times even breaks them down while walking atop a running truck with the help of mere stick The film sets up the right scenarios and makes you still believe it all A remarkable and praiseworthy addition is Tabus character of a cop fighting all the odds Tabus Diana is menacing powerful and real Jyoti Gaubas has a limited appearance in the role of a doctor but she adds to the emotional impact of the narrative Dobriyals accentric portrayal of a druglord is terrifying and his hystrionics create the aura of fear that helps the narrative flow smoothly,All images are copyrighted.,entertainment
https://www.forbes.com/sites/erikkain/2023/04/01/todays-wordle-652-hints-clues-and-answer-for-sunday-april-2nd/,Todays Wordle 652 Hints Clues And Answer For Sunday April 2nd,Hints clues and tips to help you solve todays Wordle,How to solve todays Wordle NurPhoto via Getty Images April has begun with some wrinkles for your humble Wordle guide narrator While its lovely out and Spring has finally at long last sprung I 4031 chars,How to solve todays Wordle NurPhoto via Getty Images April has begun with some wrinkles for your humble Wordle guide narrator While its lovely out and Spring has finally at long last sprung I woke up April 1st with a massive hangover Not from alcohol mind you just from life A migraine perhaps but certainly all the component pieces of a hangover in the traditional sense nausea splitting headache weakness skincrawling sensations of misery Not fun And not the kind of start to a day or a weekend or a month that leads to productivity or adventure Something about crippling pain that is also quite deleterious for writing Ah well it happens It was the universe playing an April Fools Day prank on me I suppose Perhaps my luck had simply run out after finally guessing a Wordle in just one guess Im still a bit exhausted to be honest so lets dispense with further pleasantries and get right down to it Its Wordle time How To Solve Todays Wordle The Hint Chicken beef even veggie will do But this word has many meanings The Clue There are way more consonants than vowels in this word The Answer    Todays Wordle Credit Erik Kain I feel a bit silly about todays word Spake was a great opener that I wasnt even sure Wordle would accept It did and it narrowed my options down to just 22 From here shock narrowed things further leaving me with just two words And heres where things went a bit offkilter I really couldnt think of what else it could be so I started going letterbyletter and when I came to M I thought Yes this must be it and only realized after the second box turned up grey that STOCK was a much better more likely guess For whatever reason I just forgot about the T altogether Oh well Thats zero points for guessing in four and zero points for tying Wordle Bot who guessed slate  pinot  story  stock for a grand total of zero Zero aint bad Could be worse Todays Wordle Etymology Via ChatGPT The word stock has several meanings and different etymologies depending on the context in which it is used Here are some examples Stock meaning a supply of goods This sense of the word comes from the Old English stoc meaning a tree trunk a post or a stake which was used to refer to a supply of timber or other materials for building or fuel Over time it came to refer more generally to any kind of supply or reserve Stock meaning a share in a company This sense of the word comes from the Middle Dutch stoc meaning a stick or a post which was used to refer to a tally stick or a certificate of ownership in a business The word was borrowed into English in the 16th century and by the 17th century it was being used to refer to shares in the East India Company and other early corporations Stock meaning the trunk or main stem of a plant This sense of the word comes from the Old English stocc meaning a tree trunk or stump which was also used to refer to the main stem of a plant Stock meaning livestock or animals kept for breeding This sense of the word comes from the Old English stocc meaning a trunk or stem which was also used to refer to the main stem or trunk of a family or tribe Over time it came to refer to the animals that were kept as part of a familys or communitys resources In summary the etymology of stock varies depending on its meaning but it generally has roots in Old English and Middle Dutch Play Competitive Wordle Against Me Ive been playing a cutthroat game of PvP Wordle against my nemesis Wordle But Now you should play against me I can be your nemesis And your helpful Wordle guide of course Here are the rules1 point for getting the Wordle in 3 guesses for getting the Wordle in 3 guesses 2 points for getting it in 2 guesses for getting it in 2 guesses 3 points for getting it in 1 guess for getting it in 1 guess 1 point for beating Erik for beating Erik 0 points for getting it in 4 guesses for getting it in 4 guesses 1 point for getting it in 5 guesses for getting it in 5 guesses 2 points for getting it in 6 guesses for getting it in 6 guesses 3 points for losing for losing 1 point for losing to Erik Id love it if you gave me a follow on Twitter or Facebook dearest Wordlers Be well and happy April,All images are copyrighted.,entertainment
