URL,Title,Description,Content,full-content,one line summary,topic
https://mspoweruser.com/april-2-microsoft-latest-news-bing-features-misbehaving-defender-more-layoffs-more/,April 2 Microsoft Latest News Bing features misbehaving Defender layoffs more,Here are the latest news and stories you need to know about Microsoft and its products and services New games for Xbox players This week a new batch of games is expected to arrive on Xbox Series XS Xbox One Windows and Game Pass Here they are Meet You,Here are the latest news and stories you need to know about Microsoft and its products and services New games for Xbox players This week a new batch of games is expected to arrive on Xbox Series  7167 chars,Here are the latest news and stories you need to know about Microsoft and its products and services New games for Xbox players This week a new batch of games is expected to arrive on Xbox Series XS Xbox One Windows and Game Pass Here they are Meet Your Maker  April 4 Optimized for Xbox Series XS  Smart Delivery Curse of the Sea Rats  April 6 Optimized for Xbox Series XS  Smart Delivery Dashing Orange  April 6 Optimized for Xbox Series XS  Smart Delivery Horror Tale 1 Kidnapper  April 6 Xbox One X Enhanced The Library of Babel  April 6 Optimized for Xbox Series XS  Smart Delivery Bumballon  April 7 Optimized for Xbox Series XS  Smart Delivery EA Sports PGA Tour  April 7 Joe Wander and the Enigmatic Adventure  April 7 Optimized for Xbox Series XS New Windows Beta build Microsoft released the Windows 11 Insider Preview Build 226211537 and 226241537 to Insiders in the Beta Channel on Friday As usual the build with a higher number gets most of the features Some of them are those already announced in previous and earlier releases of Microsoft including the File Explorer access keys shortcuts live kernel memory dump creation in Task Manager and availability of Content Adaptive Brightness Control even when the device is charging Bing Chat gets video and image search capability and more In its latest update Bing gets video and image search capability Microsoft refers to it as answer cards which will appear below chat answers The cards are accompanied by the See more option which will bring users to Bing image search when clicked Also Microsoft said it improved local searches eg park a store or a doctors office near the user through the local grounding Alongside these Bing Chat improvements the Redmond company said it also made enhancements to the Bing version in the Edge sidebar Some include faster responses image generation capability conversation reset prevention and context enhancements Microsoft Defender flagging reliable links as malware Recently Microsoft confirmed the problem regarding Defender tagging legit links as malware According to the reports of affected users the issue caused them to receive a bunch of unnecessary alert emails The Redmond company addressed the false positive issue by reverting recent updates to the SafeLinks feature Were reviewing diagnostics such as network telemetry data to verify the root cause and identify a path to resolution Microsoft said in its last update Further detail can be found under DZ534539 in the Microsoft 365 admin center E3 canceled after a lack of support from Microsoft and other big publishers In January the news about big publishers like Microsoft Sony and Nintendo not joining this years Electronic Entertainment Expo E3 event surfaced In March Microsoft confirmed it wouldnt be on the E3 showfloor but said it would costream Xbox Games Showcase as part of E3 Digital Xbox Head Phil Spencer also expressed support for E3 despite this decision Xbox is on the board of the ESA and I think a successful and healthy ESA is critical to what were trying to go do Spencer told IGN So we place our showcase like we always have done at a time where hopefully its convenient for press and even consumers that are going to the E3 event and thats what were trying to do now We will continue to work with ESA in terms of their plans As I said were on the board and we want to make sure that we are doing everything we can to help make the E3 successful However as more publishers like Ubisoft pulled out of the event organizers at ReedPop and ESA decided to cancel E3 This was a difficult decision because of all the effort we and our partners put toward making this event happen but we had to do whats right for the industry and whats right for E3 said Kyle MarsdenKish ReedPop Global VP of Gaming We appreciate and understand that interested companies wouldnt have playable demos ready and that resourcing challenges made being at E3 this summer an obstacle they couldnt overcome For those who did commit to E3 2023 were sorry we cant put on the showcase you deserve and that youve come to expect from ReedPops event experiences Microsoft versus Google in cloud battle Recently the search giant slammed the software company by accusing it of anticompetitive cloud practices and said that its upcoming deals with European cloud vendors are not the absolute solution for licensing term concerns Googles comment came as its response regarding the latest antitrust complaints being scrutinized by the European Union regulators Vice President and Head of Platform for Google Cloud Amit Zavery detailed this in his statement to Reuters Theyre selectively kind of buying out those ones who complain and not make those terms available to everyone So that definitely makes it an unfair advantage to Microsoft and ties the people who complained back to Microsoft anyway Whatever theyre offering there should be terms across for everybody not just for one or two theyve chosen and pick and that shows you that they have so much market power they can kind of go and do those things individually My point to the regulators would be that they should look at this holistically even though one or two vendors might settle doesnt solve the broader problem And thats the problem we need to really resolve not individual vendors problems 2nd Gen Surface Hub 2S Microsoft said a secondgeneration Surface Hub 2S is coming later this year and said it would come with Teams Rooms on Windows a new version of Windows that should replace the existing Windows Teams OS in the current Surface Hub 2S This unlocks toprequested Teams Rooms features for both users and admins such as Front Row persistent chat consistent remote management capabilities and more said Kate Canfield Surface Product Marketing at Microsoft The future of Surface Hub will meet the realities of modern work combining the latest Teams Rooms features with the iconic Surface Hub 2S design and premium hardware  a thin edge and bezel dual active inking and 20point multitouch  and providing users with a natural experience for enhanced collaboration New Xbox Update Preview in Omega Ring Microsoft released a new update in Omega Ring last week and it introduced a new Subscription Management Under this new feature users can change their plan or update the recurring billing status directly from the console It can be accessed by going to Settings  Account  Subscriptions Other issues and known issues were also discussed in the announcement More layoffs Whole GitHub India Team In the latest news about Microsofts global job cuts over 142 people comprising the entire engineering team at GitHub India were laid off According to Firstpost the layoff decision for the group was not based on performance but because the team was requested to resign Thomas Dohmke CEO of GitHub sent an email to the team explaining the move We are announcing a number of difficult decisions including the departure of some Hubbers and the implementation of new budgetary realignments designed to protect our businesss shortterm health while also allowing us to invest in our longterm strategy Dohmke wrote in an email,The BBC News website is your one-stop shop for everything Microsoft.,entertainment
https://www.bbc.co.uk/sport/cricket/65153336,NZs Williamson forced out of IPL by knee injury,New Zealands whiteball skipper Kane Williamson is ruled out of this seasons Indian Premier League by a knee injury sustained in Gujarat Titans opening match,Williamson who became New Zealands highest Test run scorer in February had to be helped off the field after suffering the injury New Zealands whiteball skipper Kane Williamson has been ruled ou 689 chars,Last updated on From the section Cricket Williamson who became New Zealands highest Test run scorer in February had to be helped off the field after suffering the injury New Zealands whiteball skipper Kane Williamson has been ruled out of this seasons Indian Premier League by a knee injury The 32yearold was hurt in defending champions Gujarat Titans opening win against Chennai Super Kings on Friday He leapt to stop a six near the boundary but landed awkwardly and fell to the ground clutching his knee It is not known whether the injury will mean he misses the ICC World Cup in India which starts in October Preparations are now under way for him to return to NZ next week and be seen by relevant medical specialists to establish a treatment plan said New Zealand Cricket Gujarat director of cricket Vikram Solanki said a replacement would be announced in due course It is sad to lose Kane to injury so early in the tournament We wish him a speedy recovery with the hope of seeing him in action very soon he said,New Zealand captain Kane Williamson has been ruled out for the rest of the series against Sri Lanka after suffering a knee injury.,entertainment
https://www.bbc.co.uk/sport/cricket/65123898,Amiss would love to see Bazball in Championship,Warwickshire legend Dennis Amiss would love to see a bit more Bazball played to brighten up the County Championship,Dennis Amiss was renowned as an excellent driver of the ball in his 50Test England career between 1966 and 1977 Warwickshire legend Dennis Amiss says he would love to see more Bazball played in t 3275 chars,Dennis Amiss was renowned as an excellent driver of the ball in his 50Test England career between 1966 and 1977 Warwickshire legend Dennis Amiss says he would love to see more Bazball played in the County Championship The former Bears and England Test opener enjoyed a prolific 27year career before going on to become Warwickshire chief executive Amiss was a stylish batter when he played but is fan of Englands positive brand of cricket under Test captain Ben Stokes and coach Brendon McCullum The Bazball is terrific to watch Amiss told BBC Radio WM I saw it all during the winter and absolutely loved it The game is in great shape  and I really like the way England are playing at the moment England host Australia in the Ashes this summer with the first Test at Edgbaston starting on 16 June Amiss added If were going to carry on playing like that this summer then the Test matches might not go five days If I was a punter Id be booking tickets just for the first four days he joked Theyre playing at such a pace  and its brilliant to see Dennis Amiss hit 137 in Englands first World Cup tie against Farokh Engineer and India at Lords in 1975 Amiss now Warwickshires club president will celebrate his 80th birthday on the second day of the new County Championship season which starts on Thursday 6 April The Bears avoided relegation from Division One on the final day of last season at Edgbaston in dramatic fashion when fast bowler Liam Norwell took a stunning 962 to beat Hampshire and condemn Yorkshire to the drop instead Although that was as exciting a two sessions of cricket as any fan could witness in any form of the game it was played out in front of a small crowd in Birmingham The England and Wales Cricket Board have spent a lot of time debating with the 18 firstclass counties the best longterm strategy for the game  and brought in their brand new Hundred as a further shortform cricket competition on top of the already successful T20 Blast But Amiss who made a century in Englands first oneday international in this country against Dennis Lillee and Australia at Old Trafford in 1972 and also hit a ton in Englands first World Cup match against India in 1975 now recognises the need for Championship cricket to try to become more exciting It was after all in county cricket and also in the Midlands where Bazball got off the launchpad led by England skipper Stokes who smashed 161 off 88 balls for Durham against Worcestershire at New Road last May It featured a Championship record 17 sixes  and that sensational innings served as the prototype for the way England have played their Test cricket since under Stokes and McCullum Ben Stokes began his countdown to Bazball with 15 sixes before lunch for Durham against Worcestershire in May 2022 In the seven home Tests that followed in 2022 followed by the winter series with Pakistan and New Zealand England have won 10 out of 12 matches  and Amiss would love to see some of that magic rub off on the county game Weve got to do something about county cricket he said After what England have done this winter maybe it might now follow on naturally The game has changed dramatically for cricket lovers all over the country Maybe we should also have just 100 overs per innings to help it bounce along and make it even more attractive Dennis Amiss was talking to BBC Radio WMs Kath Stanczyszyn,Former England all-rounder Dennis Amiss says he would love to see more Bazball played in first-class cricket.,entertainment
https://www.gsmarena.com/weekly_deals_the_best_smartphone_deals_from_the_uk_germany_india_and_the_us_-news-58088.php,Weekly deals the best smartphone deals from the UK Germany India and the US,This week we found some major discounts on current flagships plus deals on midrangers and some entrylevel phones Use the links below to jump to your region The UK Germany India USA UK The new Galaxy S23 starts at 900 unless you engage in trade,This week we found some major discounts on current flagships plus deals on midrangers and some entrylevel phones Use the links below to jump to your region UK The new Galaxy S23 starts at 90 9819 chars,Weekly deals the best smartphone deals from the UK Germany India and the US This week we found some major discounts on current flagships plus deals on midrangers and some entrylevel phones Use the links below to jump to your region UK The new Galaxy S23 starts at 900 unless you engage in tradein deals The Galaxy S22 is still a fairly capable phone and it is a good deal cheaper at 540 This was the last generation of Exynospowered Sphones in Europe but the rest of the hardware is similar enough its not like the S23 got a QHD LTPO display or faster than 25W charging Alternatively you can pick up the Galaxy S21 FE 5G that one does have a Snapdragon chip even if it is the 888 The S22 is the better phone but is it 70 better If youre fine with or actually want a larger 64 display the FE could be better suited to you Alternatively the Poco F4 GT will get you the newer Snapdragon 8 Gen 1 chipset and an even larger 667 display not to mention super fast 120W charging no wireless The cameras arent as good as on the Samsungs though If you want a flagshipgrade camera the OnePlus 10 Pro is still around and packs a trio of Hasselblad modules including an 8MP 77mm tele lens It also uses the 8 Gen 1 chipset and offers both 80W wired and 65W wireless charging for its 5000mAh battery It costs more than the three models above however at 600 The Xiaomi 11T Pro is getting up in age its a 2021 model but it has a Snapdragon 888 for 350 120 less than the S21 FE While it doesnt have a tele cam the 108MP main camera does a decent job at zooming in This phone also has 120W fast charging and a 5000mAh battery no wireless though The Pixel 6a is under 300 and while its replacement the 7a is coming Google has not set a reveal date yet its rumored to launch in June Leaks point to a 500 price tag on the mainland so the 6a will probably stick around as the cheaper option By the way you can get the Pixel 6a bundled with the Pixel Buds Aseries Or you can get the TWS headset on its own for just over 60 Going up against the Pixel is the Galaxy A33 The new A34 is available in the UK already but it costs 90 more Compared to the Google Phone the A33 offers a larger 64 90Hz display vs 61 60Hz a microSD slot and a larger 5000mAh battery with 25W charging vs 4410mAh18W Well make a quick detour through Apple land Amazon offers the iPhone 14 for just under 800 a small discount compared to how much it costs on Applecom If thats too much or you want a smaller phone the iPhone 13 mini is 600 for a 128GB unit The Nokia G22 and Galaxy A13 both have mediumsized screens 65 and 66 respectively The Nokia offers a 90Hz IPS panel with HD resolution the Samsung is sharper but slower with an FHD 60Hz display The G22 has more processing power with the Unisoc T606 chipset which features a pair of A75 big cores vs all A55 cores in the Exynos 850 Its 5050mAh battery also does 20W charging vs 5000mAh 15W Both phones have microSD slots and 35mm headphone jacks Both phones have 50MP main cameras but only the Galaxy has an ultra wide lens 5MP sensor HMD partnered with iFixit to provide guides tools and parts for fixing the G22 at home Samsung does this only for its flagships Well wrap things up with a wide range of Galaxy tablets The Galaxy Tab S8 may offer the best priceperformance ratio All three Tab S8 models use the Snapdragon 8 Gen 1 chipset and start with 8128GB memory configuration they all have card slots The Galaxy Tab S8 has a larger 124 Super AMOLED display compared to the 11 LCD on the vanilla model All three slates offer 120Hz refresh rate The Galaxy Tab S8 Ultra is the biggest of the bunch and just plain big with a 146 display Between DeX mode and several keyboard options this can replace a laptop If those are too pricey the Galaxy Tab S6 Lite the 2022 rerelease costs less than half the Tab S8 It has a similarly sized 104 LCD but it is a 60Hz panel Also the Snapdragon 720G is anything but powerful Still with a microSD slot and speakers tuned by AKG this can be a great pick for multimedia and casual browsing Or if you just want something cheap the Galaxy Tab A7 Lite is down to 120 The 87 1340 x 800px display isnt great and the Helio P22T is slower than even the 720G but at that price this could work as tablet for the little one  if they break it oh well Germany Google IO 2023 is scheduled for May 10 and we should get an update on the nextgen Pixels For now there is the Pixel 7 and Pixel 7 Pro which continue to duck under the pricing of Galaxy and iPhone flagships The Xiaomi 13 is normally a 1000 phone Amazon offers it for a bit less It comes with a Snapdragon 8 Gen 2 chipset but lacks the triple 50MP camera setup of the Pro model Speaking of the Xiaomi 13 Pro its 1 camera can be yours for 1300 This also includes a QHD 120Hz LTPO display and faster 120W wired charging up from 67W Its a pricey phone but its camera impressed in our recent shootout Last week we listed the whole iPhone 14 generation which had pretty solid discounts on Amazon Those are still available so this week we wanted to focus on the previous generation Apple is still selling the nonPro duo but you can get a better deal on Amazon The Redmi Note 12 4G went on sale just this week and can be had for 200 Thats 100 less than the 5G version though note that the Note 12 5G has double the storage Other than the chipset the two models are pretty similar For another 100 on top of that you can pick up the Redmi Note 12 Pro with double the RAM and a more respectable Dimensity 1080 chipset instead of the Snapdragon 4 Gen 1 in the vanilla 5G model This one also has faster charging and OIS on its 50MP camera 1156 Alternatively the venerable Samsung Galaxy A52s is still around and can be had for 130 less than the new Galaxy A54 The new model has some advantages though that price gap makes them seem pretty small What the Nokia has going for it is a microSD slot both have 35mm jacks and a stock Android that will be updated to Android 14 and will continue to get security patches until the end of 2024 at least The Nokia X20 costs 50 more than the Realme 9 Pro even though the Realme has the better chipset Dimensity 920 vs Snapdragon 480 and better camera 50MP main with OIS 8MP ultra wide vs 64MP main 5MP ultra wide and faster charging battery 4500mAh 60W vs 18W The Realme also has a 64 90Hz AMOLED display compared to a 667 IPS LCD 60Hz on the X20 India The OnePlus 10T and iQOO 9T both cost the same at 50000 They have large 120Hz AMOLED FHD displays and both are powered by the Snapdragon 8 Gen 1 The batteries are similar with a slight advantage for the OnePlus 4800mAh150W for the 10T and 4700mAh120W for the iQOO The iQOO 9T has the lightly better cameras though with mostly identical main modules it also offers a better ultra wide 13MP vs 8MP and a short zoom lens  12MP 47mm Samsung started shipping the Galaxy A54 a week ago but initially the 8128GB units were hard to find Its 2000 cheaper than the 8256GB version and you can pick up a 256GB microSD for less than that or go with something bigger a 512GB SanDisk is 3330 The iQOO Neo 6 and Galaxy S20 FE are fairly close in price dont forget to click the 3000 coupon for the Samsung The iQOO uses the Snapdragon 870 chipset the S20 FE the vanilla Snapdragon 865 Both have midsized 120Hz displays FHD AMOLED panels The iQOO stands out with its 4700mAh80W battery vs 4500mAh25W for the Galaxy though it also has 15W wireless The Galaxy S20 FE has a 3x zoom camera 8MP and a microSD slot however Android 13 is likely its last OS update it is a 2020 model after all The iQOO is from mid2022 The vivo Y100 and Y56 went on sale last month They are fairly similar except hat the Y100 has the better screen 638 90Hz AMOLED vs 658 60Hz IPS LCD both FHD better chipset Dimensity 900 vs 700 and better main camera  64MP with OIS and 4K video vs 50MP no OIS no 4K The Y100 also has 44W fast charging for its 4500mAh battery the Y63 has more capacity 5000mAh but only charges at 18W Still its also 5000 cheaper The Samsung Galaxy A14 5G  the SMA146B variant specifically  uses the new Exynos 1330 chipset and has a 66 90Hz LCD with FHD resolution Its 5000mAh battery is as slow to charge as the Y56s it supports only 15W charging and it has a comparable 50MP main camera neither has an ultra wide lens The Tecno Spark 8 Pro is a rare sight in the sub10000 segment  fullfledged Android version 11 but still an FHD display 68 IPS LCD a large 5000mAh battery with 33W fast charging and an okay 48MP main camera no ultra wide It also has a microSD slot and a 35mm jack It doesnt have 5G connectivity but the Helio G85 chipset is normally found in much pricier phones USA While Samsung was taking preorders for the Galaxy S23 series it offered a free memory upgrade  an offer that has since expired Amazon is bringing it back though This means that you can get a Galaxy S22 256GB for the same price as the 128GB unit The Galaxy S23 and S23 Ultra switch to 512GB for no extra cost over the 256GB models The Sony WF1000XM5 are just around the corner but the old XM4 left us with little to complain about even after months of usage Currently they are 50 below their usual price Sony also has the highly specific Link Buds which are designed so that you can always hear your surroundings  they have a hole in them For a more traditional design with Active Noise Cancellation you can get the LinkBuds S instead they arent as good as the WF1000XM4 but they cost 50 less too Alternatively you can have the Google Pixel Buds Pro at the same 150 price tag We have reviewed all of these buds so you can read up on which ones will suit you best If the prices are too high for you you can also grab the Pixel Buds Aseries for about half the cost,Each week we bring you a selection of the best phone deals.,entertainment
