URL,Title,Description,Content,raw_full_content,spacy_full_content,final_full_content,topic
https://www.bbc.co.uk/sport/football/65214760,Real Madrid Karim Benzema Luka Modric and Toni Kroos to stay next season says Carlo Ancelotti,Coach Carlo Ancelotti believes Karim Benzema Luka Modric and Toni Kroos will stay with Real Madrid next season,Toni Kroos Karim Benzema and Luka Modric have 14 Champions League winners medals between them Coach Carlo Ancelotti believes Karim Benzema Luka Modric and Toni Kroos will stay with Real Madrid ne 1207 chars,Last updated on .From the section Spanish La Liga Toni Kroos Karim Benzema and Luka Modric have 14 Champions League winners medals between them Coach Carlo Ancelotti believes Karim Benzema Luka Modric and Toni Kroos will stay with Real Madrid next season. The longserving trio are all out of contract this summer but Ancelotti said they are talking about new deals. Former France striker Benzema 35 and Croatia midfielder Modric 37 have won five Champions League titles with Real since 2014 while exGermany midfielder Kroos 33 has won four. I think that in the end they will look for a solution said Ancelotti. There are advances because they are talking. Real have begun to prepare for the future by signing Eduardo Camavinga Dani Ceballos Aurelien Tchouameni and Federico Valverde since 2016. And although Kroos and Modric have played slightly less often this season Benzema remains the teams top scorer and claimed a hattrick in Wednesdays Copa del Rey win over Barcelona which all three started. I think they will stay Ancelotti added. We have to evaluate the players not by their age but by what they do. You can think the three dont have the physical profile or energy of the younger players but what these three have in terms of game management is unique you cant buy it on any market in the world. This is born with experience  age takes something from you but it gives you something back as well.,Last updated on .From the section Spanish La Liga Toni Kroos Karim Benzema and Luka Modric have 14 Champions League winners medals between them Coach Carlo Ancelotti believes Karim Benzema Luka Modric and Toni Kroos will stay with Real Madrid next season. The longserving trio are all out of contract this summer but Ancelotti said they are talking about new deals. Former France striker Benzema 35 and Croatia midfielder Modric 37 have won five Champions League titles with Real since 2014 while exGermany midfielder Kroos 33 has won four.,Last updated on .From the section Spanish La Liga Toni Kroos Karim Benzema and Luka Modric have 14 Champions League winners medals between them Coach Carlo Ancelotti believes Karim Benzema Luka Modric and Toni Kroos will stay with Real Madrid next season. The longserving trio are all out of contract this summer but Ancelotti said they are talking about new deals. Former France striker Benzema 35 and Croatia midfielder Modric 37 have won five Champions League titles with Real since 2014 while exGermany midfielder Kroos 33 has won four.,business
https://www.bbc.co.uk/news/world-europe-65083774,Strike brings Germanys public transport network to halt,The 24hour walkout is one of the largest the country has experienced in decades,Germanys transport network will be at a near standstill on Monday as two of the countrys largest unions strike Staff at airports ports railways buses and subways walked out shortly after midni 1656 chars,I am a bit shocked actually said one man who was trying to fly to the Spanish city of Mlaga. I didnt hear of it the strike so I have to find out what to do right now.,I am a bit shocked actually said one man who was trying to fly to the Spanish city of Mlaga. I didnt hear of it the strike so I have to find out what to do right now.,Germanys transport network will be at a near standstill on Monday as two of the countrys largest unions strike Staff at airports ports railways buses and subways walked out shortly after midni ,business
https://www.bbc.co.uk/news/world-64980565,Why did the US and allies invade Iraq 20 years ago,The US and three allies invaded Iraq 20 years ago but most countries were against the war,On 20 March 2003 US and allied forces invaded Iraq and toppled Saddam Husseins regime The US said Iraq had weapons of mass destruction and was a threat to international peace but most countries  5039 chars,Why did the US and allies invade Iraq 20 years ago? Published 20 March Image source Getty Images Image caption The 2003 invasion of Iraq toppled President Saddam Hussein On 20 March 2003 US and allied forces invaded Iraq and toppled Saddam Husseins regime. The US said Iraq had weapons of mass destruction and was a threat to international peace but most countries refused to support military action against it. Why did the US want to invade Iraq? In the Gulf War of 19901991 the US had led a multinational coalition which forced invading Iraqi forces out of Kuwait. Afterwards the UN Security Council passed Resolution 687 ordering Iraq to destroy all its weapons of mass destruction WMDs  a term used to describe nuclear biological and chemical weapons and longrange ballistic missiles. In 1998 Iraq suspended cooperation with UN weapons inspectors and the US and UK responded with air strikes. After alQaedas 11 September 2001 attacks on the World Trade Center in New York and the Pentagon in Washington President George W Bushs administration started making plans to invade Iraq. President Bush claimed Saddam was continuing to stockpile and manufacture WMDs and that Iraq was part of an international axis of evil along with Iran and North Korea. In October 2002 the US Congress authorised the use of military force against Iraq. Many people in Washington believed that there was significant evidence that Iraq had weapons of mass destruction and that it posed a genuine threat says Dr Leslie Vinjamuri director of the US and Americas Programme at Chatham House a foreign affairs think tank in London. In February 2003 thenUS Secretary of State Colin Powell asked the UN Security Council to give the goahead for military action against Iraq saying it was violating previous resolutions with its alleged WMD programme. However he did not persuade the Council. Most of its members wanted weapons inspectors from the UN and International Energy Authority  who had gone to Iraq in 2002  to carry out more work there to find evidence of WMDs. The US said it would not wait for the inspectors to report and assembled a coalition of the willing against Iraq. Who supported the war? Of the 30 countries in the coalition the UK Australia and Poland participated in the invasion. The UK sent 45000 troops Australia sent 2000 troops and Poland sent 194 special forces members. Kuwait allowed the invasion to be launched from its territory. Spain and Italy gave diplomatic support to the USled coalition along with several east European nations in the Vilnius Group who said they believed that Iraq had a WMD programme and was violating UN resolutions. What allegations did the US and UK make against Iraq? US Secretary of State Colin Powell told the UN in 2003 that Iraq had mobile labs for producing biological weapons. However he acknowledged in 2004 that the evidence for this appears not to be... that solid. Image source Getty Images Image caption US Secretary of State Colin Powell told the UN that Iraq was producing weapons of mass destructions The UK government made public an intelligence dossier claiming that Iraqi missiles could be readied within 45 minutes to hit UK targets in the eastern Mediterranean. The UKs thenPrime Minister Tony Blair said it was beyond doubt that Saddam Hussein was continuing to produce WMD. The two countries relied heavily on the claims of two Iraqi defectors  a chemical engineer called Rafid Ahmed Alwan alJanabi and an intelligence officer called Maj Muhammad Harith  who said they had firsthand knowledge of Iraqs WMD programme. Both men later said they had fabricated their evidence because they wanted the allies to invade and oust Saddam. Who refused to support the war? Two neighbours of the US Canada and Mexico refused to support it. Germany and France two key US allies in Europe also refused support. French foreign minister Dominique de Villepin said military intervention would be the worst possible solution. Turkey  a fellow Nato member and neighbour of Iraq  refused to let the US and allies use its airbases. Middle Eastern countries which had supported the US against Iraq in the 199091 Gulf War such as Saudi Arabia did not support its invasion in 2003. The Gulf Arab states thought the plan was crazy says Professor Gilbert Achcar an expert in Middle Eastern politics at University of London SOAS. They were worried about Iran getting control of Iraq after the fall of Saddams regime. What happened in the war? At dawn on 20 March 2003 Operation Iraqi Freedom began with 295000 US and allied troops invading Iraq across its border with Kuwait. 70000 members of the Kurdish Peshmerga militia fought Iraqi forces in the north of the country. By May Iraqs army had been defeated and its regime overthrown. Saddam Hussein was later captured tried and executed. However no weapons of mass destruction were found in Iraq. US troops withdrew from Iraq in 2011. America lost a lot of credibility from this war says Dr Karin von Hippel directorgeneral of the Royal United Services Institute think tank. You still hear people saying twenty years later why do we want to believe American intelligence? The BBCs security correspondent Gordon Corera seeks to find new answers to why the Iraq war happened what it meant and its legacy today. Listen at 1345 BST each weekday or stream or download all 10 episodes on BBC Sounds,Why did the US and allies invade Iraq 20 years ago? Published 20 March Image source Getty Images Image caption The 2003 invasion of Iraq toppled President Saddam Hussein On 20 March 2003 US and allied forces invaded Iraq and toppled Saddam Husseins regime. The US said Iraq had weapons of mass destruction and was a threat to international peace but most countries refused to support military action against it. Why did the US want to invade Iraq?,Why did the US and allies invade Iraq 20 years ago? Published 20 March Image source Getty Images Image caption The 2003 invasion of Iraq toppled President Saddam Hussein On 20 March 2003 US and allied forces invaded Iraq and toppled Saddam Husseins regime. The US said Iraq had weapons of mass destruction and was a threat to international peace but most countries refused to support military action against it. Why did the US want to invade Iraq?,business
https://www.cnn.com/travel/article/world-best-cities-public-transit-photos/index.html,The worlds best cities for public transit according to Time Out,A survey from Time Out ranks the 19 best cities for mass transit including Berlin Tokyo and New York,Editors Note Sign up for Unlocking the World CNN Travels weekly newsletter Get the latest news in aviation food and drink where to stay and other travel developments Europe and Asia dominate a 3539 chars,Editors Note Sign up for Unlocking the World CNN Travels weekly newsletter. Get the latest news in aviation food and drink where to stay and other travel developments. CNN  Europe and Asia dominate a new list of the worlds best cities for public transit. Time Out the publisher of global city guides polled 20000 people in 50 cities to find out how they feel about their local mass transit systems. The top ten  out of 19 total cities listed  is entirely comprised of destinations in Asia and Europe with Berlin landing in the number one spot. The highest entry from North America is New York City at number 15 and no other continents are represented  better luck next year Buenos Aires Doha and Melbourne. While only residents were surveyed this list is also useful for travelers as they decide where to go next and how best to get around. What makes for great transit? Public transit is a broad term that includes subways aboveground trains buses trams and even ferries. To make it onto Time Outs list at least 80 of polled residents had to agree that its easy to get around their city via mass transportation. According to Time Outs data a whopping 97 of Berliners had positive things to say about their citys mass transit infrastructure praising the network for being reliable comfortable and safe. But there are other factors to consider when traveling by train or bus  namely aesthetics. Stockholm in seventh place was one of the cities praised for its beautiful subway stations. Many of its Tunnelbana stations feature colorful and dramatic designs earning it the nickname the worlds longest art exhibit. Its not only the stations themselves that are known for good looks. Hong Kongs famous aboveground trains known locally as ding dings for the sound they make even have their own Pantone color HK Tram Green. These days the trams appear in a range of colors and designs but the iconic color dates from the postWorld War II era when the British military had a surplus of green paint. In addition to its highlyrated mass transit Singapores Changi airport regularly wins praise. FotoGraphicAdobe Stock Asian standouts Seven of the top 19 cities hailed for their mass transit systems are in Asia. Most are in east Asia with Singapore Shanghai and Taipei all picking up accolades but Mumbai squeaked in at 19th place. The Indian megacity recently introduced Chalo Pay a new app that makes it easier to book and pay for transit tickets without needing to carry cash. But it was Tokyo in third place that had the highest showing for the continent. The citys mass transit was applauded for being wellmaintained efficient and easy to navigate even for nonJapanese speakers. 92 percent of Taipei residents polled by Time Out said their citys transit was easy to use. SimonAdobe Stock European stars Six of the top 19 cities were in Europe with an additional two  London and Edinburgh  in the UK. Several of these cities won praise for having one unified payment system to cover a variety of forms of transit. In Copenhagen a regular commute can include water taxis that whisk travelers across the harbor while 10place Amsterdam makes it seamless to transfer between buses trains and trams. Perhaps its not a coincidence that both of these cities also appear on CNNs list of the worlds best cities for exploring by bicycle. Sustainability initiatives in the European Union mean that many metropolitan areas offer incentives to reduce car traffic. Whether you travel by tram train or bicycle its a way to visit major tourist attractions while reducing your carbon footprint. The worlds best cities for public transit 1. Berlin Germany 2. Prague Czech Republic 3. Tokyo Japan 4. Copenhagen Denmark 5. Stockholm Sweden 6. Singapore 7. Hong Kong 8. Taipei Taiwan 9. Shanghai China 10. Amsterdam Netherlands 11. London UK 12. Madrid Spain 13. Edinburgh UK 14. Paris France 15. New York City US 16. Montreal Canada 17. Chicago US 18. Beijing China 19. Mumbai India,Editors Note Sign up for Unlocking the World CNN Travels weekly newsletter. Get the latest news in aviation food and drink where to stay and other travel developments. CNN  Europe and Asia dominate a new list of the worlds best cities for public transit. Time Out the publisher of global city guides polled 20000 people in 50 cities to find out how they feel about their local mass transit systems.,Editors Note Sign up for Unlocking the World CNN Travels weekly newsletter. Get the latest news in aviation food and drink where to stay and other travel developments. CNN  Europe and Asia dominate a new list of the worlds best cities for public transit. Time Out the publisher of global city guides polled 20000 people in 50 cities to find out how they feel about their local mass transit systems.,business
https://www.cnn.com/travel/article/world-happiest-countries-2023-wellness/index.html,The worlds happiest countries for 2023,Theres cause for optimism in the latest report on world happiness Benevolence is about 25 higher than it was prepandemic and life evaluations from 2020 to 2022 have been remarkably resilient the report says,Editors Note Sign up for Unlocking the World CNN Travels weekly newsletter Get the latest news in aviation food and drink where to stay and other travel developments Theres cause for optimism  5704 chars,Editors Note Sign up for Unlocking the World CNN Travels weekly newsletter. Get the latest news in aviation food and drink where to stay and other travel developments. CNN  Theres cause for optimism in the latest report on world happiness. For one benevolence is about 25 higher than it was prepandemic. Benevolence to others especially the helping of strangers which went up dramatically in 2021 stayed high in 2022 John Helliwell one of the authors of the World Happiness Report said in an interview with CNN. And global happiness has not taken a hit in the three years of the Covid19 pandemic. Life evaluations from 2020 to 2022 have been remarkably resilient the report says with global averages basically in line with the three years preceding the pandemic. Even during these difficult years positive emotions have remained twice as prevalent as negative ones and feelings of positive social support twice as strong as those of loneliness Helliwell said in a news release. The report which is a publication of the UN Sustainable Development Solutions Network draws on global survey data from people in more than 150 countries. Countries are ranked on happiness based on their average life evaluations over the three preceding years in this case 2020 to 2022. The report which was released on Monday identifies the happiest nations those at the very bottom of the happiness scale and everything in between plus the factors that tend to lead to greater happiness. March 20 is the International Day of Happiness a day designated by the United Nations thats marking its 10th anniversary in 2023. Finland where Senate Square in Helsinki is pictured is No. 1 for happiness for the sixth year in a row. espiegleAdobe Stock Sixyear winning streak for worlds happiest nation For the sixth year in a row Finland is the worlds happiest country according to World Happiness Report rankings based largely on life evaluations from the Gallup World Poll. The Nordic country and its neighbors Denmark Iceland Sweden and Norway all score very well on the measures the report uses to explain its findings healthy life expectancy GDP per capita social support low corruption generosity in a community where people look after each other and freedom to make key life decisions. But since we cant all move to Finland is there something other societies can learn from these rankings? Is it are they doing things that we wish wed seen before and we can start doing? Or is it something unique about their climate and history that make them different? And fortunately at least from my perspective the answer is the former said Helliwell who is a professor emeritus at the Vancouver School of Economics University of British Columbia. Taking a holistic view of the wellbeing of all the components of a society and its members makes for better life evaluations and happier countries. The objective of every institution should be to contribute what it can to human wellbeing the report says which includes accounting for future generations and preserving basic human rights. Israel moves up to No. 4 this year from its No. 9 ranking last year. The Netherlands No. 5 Switzerland No. 8 Luxembourg No. 9 and New Zealand No. 10 round out the top 10. Australia No. 12 Canada No. 13 Ireland No. 14 the United States No. 15 and the United Kingdom No. 19 all made it into the top 20. Lithuania with the main square in Kaunas pictured made it into the top 20 in the latest World Happiness Report. Subodh AgnihotriiStockphotoGetty Images While the same countries tend to appear in the top 20 year after year theres a new entrant this year Lithuania. The Baltic nation has been climbing steadily over the past six years from No. 52 in 2017 to No. 20 on the latest list. And the other Baltic countries Estonia No. 31 and Latvia No. 41 have been climbing in the ranks too. Its essentially the same story thats playing out in the rest of Central and Eastern Europe Helliwell said. Countries in those regions probably have normalized that post1990 transition and are feeling more solid in their new identity as the years pass he said. France dropped out of the top 20 to No. 21 in this years report. Nations ranked lower for happiness At the very bottom of the list is Afghanistan at No. 137. Lebanon is one rank above at No. 136. Average life evaluations in these countries are more than five points lower on a scale from 0 to 10 than in the 10 happiest countries. Russias invasion of Ukraine put both countries very much in the global spotlight as the 2022 report was released. So where do these two nations stand according to the latest surveys? Wellbeing in Ukraine has definitely taken a hit but despite the magnitude of suffering and damage in Ukraine life evaluations in September 2022 remained higher than in the aftermath of the 2014 annexation supported now by a stronger sense of common purpose benevolence and trust in Ukrainian leadership the report says. Confidence in their governments grew in both countries in 2022 the survey says but much more in Ukraine than in Russia. And Ukrainian support for the leadership in Russia fell to zero. In this years rankings Russia is No. 70 and Ukraine is No. 92. Looking forward The disruptions of the pandemic have spurred a lot of reflection. People are rethinking their life objectives Helliwell said. Theyre saying Im going back but what am I going back to? What do I want to go back to? How do I want to spend the rest of my life? Hes hoping this move towards thinking about values and other people more explicitly will affect not just factors such as which jobs or schools people choose but also how they operate within those environments. It isnt really about the grades or the salary its about cooperating with other people in a useful way. And of course thats useful for the world but the whole point of this happiness research is that its also good for the people doing it. In other words you do end up feeling better about yourself if youre actually looking after other people rather than number one. Worlds happiest countries for 2023 1. Finland 2. Denmark 3. Iceland 4. Israel 5. Netherlands 6. Sweden 7. Norway 8. Switzerland 9. Luxembourg 10. New Zealand 11. Austria 12. Australia 13. Canada 14. Ireland 15. United States 16. Germany 17. Belgium 18. Czech Republic 19. United Kingdom 20. Lithuania,Editors Note Sign up for Unlocking the World CNN Travels weekly newsletter. Get the latest news in aviation food and drink where to stay and other travel developments. CNN  Theres cause for optimism in the latest report on world happiness. For one benevolence is about 25 higher than it was prepandemic.,Editors Note Sign up for Unlocking the World CNN Travels weekly newsletter. Get the latest news in aviation food and drink where to stay and other travel developments. CNN  Theres cause for optimism in the latest report on world happiness. For one benevolence is about 25 higher than it was prepandemic.,business
