URL,Title,Description,Content,raw_full_content,spacy_full_content,final_full_content,topic
https://consent.google.com/ml?continue=https://news.google.com/rss/articles/CBMieGh0dHBzOi8vd3d3LnJldXRlcnMuY29tL2J1c2luZXNzL2Vudmlyb25tZW50L2dlcm1hbnktc2F5cy1tYWtpbmctcHJvZ3Jlc3MtZXUtdGFsa3MtMjAzNS1iYW4tZm9zc2lsLWZ1ZWwtY2Fycy0yMDIzLTAzLTIwL9IBAA?oc%3D5&gl=FR&hl=en-US&cm=2&pc=n&src=1,Germany says making progress in EU talks on 2035 ban on fossil   Reuterscom,Germany says making progress in EU talks on 2035 ban on fossil  Reuterscom,We use cookies and data toulliDeliver and maintain Google servicesliliTrack outages and protect against spam fraud and abuseliliMeasure audience engagement and site statistics to unde 1131 chars,12 Cars are pictured at rush hour traffic on A100 highway during a snowfall in Berlin Germany February 8 2021. REUTERSFabrizio Bensch BERLIN March 20 Reuters  Talks between Germanys Transport Ministry and the European Commission about the planned end of new combustion engines from 2035 are moving forward the ministry said on Monday but added it could not say when an agreement would be reached. After months of negotiations the European Parliament the Commission and European Union member states agreed last year to the law that would require new cars sold in the EU from 2035 to have zero CO2 emissions  effectively making it impossible to sell combustion engine cars from that date. But Germany this month declared its lastminute opposition. It wants sales of new cars with internal combustion engines to be allowed after that date if they run on efuels. There are positive trends that are a good basis for further talks a spokesman for the ministry told a news conference. The ministry run by the liberal Free Democratic Party FDP proposed last week that the Commission should provide a separate vehicle category for cars that run only on efuels a letter from the ministry to the EU executive seen by Reuters showed. The Commission declined to comment on the letter which also suggested allowing carmakers to count such cars towards complying with CO2 targets. EU climate policy chief Frans Timmermans said in a news conference on Thursday that once a deal on a law is agreed between EU countries and the European Parliament it is important that both sides respect it. At the same time we have to make sure that the interpretation of that agreement people give is also something we can agree upon. And this is an ongoing conversation we are having with the German authorities right now Timmermans said. Such changes are legally problematic as the European Parliament has approved the regulations agreed between the blocs member states and the Commission meaning any change could be complicated and timeconsuming. An EU official said member states had been told at a meeting in November that the Commission would make a proposal on registering cars running on efuels after 2035 but only after the CO2 law for cars is finally adopted. Reporting by Riham Alkousaa Markus Wacket in Berlin Kate Abnett in Brussels editing by Barbara Lewis and Paul Simao Our Standards The Thomson Reuters Trust Principles.,12 Cars are pictured at rush hour traffic on A100 highway during a snowfall in Berlin Germany February 8 2021. REUTERSFabrizio Bensch BERLIN March 20 Reuters  Talks between Germanys Transport Ministry and the European Commission about the planned end of new combustion engines from 2035 are moving forward the ministry said on Monday but added it could not say when an agreement would be reached. After months of negotiations the European Parliament the Commission and European Union member states agreed last year to the law that would require new cars sold in the EU from 2035 to have zero CO2 emissions  effectively making it impossible to sell combustion engine cars from that date. But Germany this month declared its lastminute opposition.,12 Cars are pictured at rush hour traffic on A100 highway during a snowfall in Berlin Germany February 8 2021. REUTERSFabrizio Bensch BERLIN March 20 Reuters  Talks between Germanys Transport Ministry and the European Commission about the planned end of new combustion engines from 2035 are moving forward the ministry said on Monday but added it could not say when an agreement would be reached. After months of negotiations the European Parliament the Commission and European Union member states agreed last year to the law that would require new cars sold in the EU from 2035 to have zero CO2 emissions  effectively making it impossible to sell combustion engine cars from that date. But Germany this month declared its lastminute opposition.,business
https://www.androidcentral.com/phones/oppo-and-oneplus-could-exit-major-eu-markets-altogether-according-to-new-report,OPPO and OnePlus could exit major EU markets altogether according to new report,A Nokia lawsuit banned OPPO and OnePlus phone sales in Germany and that could be extending to cover the EU as a whole,It looks like OPPO and OnePlus could be making their exodus from major markets in the EU A post in Chinese publication 36Kr suggests the BBKowned entities are considering pulling out of the UK an 2050 chars,A new report suggests OPPO and OnePlus could be making their exodus from major markets in the EU. A post in Chinese publication 36Kr suggests the BBKowned entities are considering pulling out of the U.K. and Germany and a tweet by leaker Max Jambor indicates France and The Netherlands may also be affected. Both OPPO and OnePlus have faced significant challenges in Germany in the last six months. A patent lawsuit filed by Nokia the networking services provider not HMD Global effectively barred both OPPO and OnePlus from selling phones in Germany in August 2022 and if you go to the OnePlus Germany opens in new tab site you will see the companys latest launches  including the Buds Pro 2 and the OnePlus Pad  but no phones at all. I can confirm OPPO and OnePlus are pulling out of Europe. First to leave are Germany UK France and Netherlands.March 27 2023 See more Nokias lawsuit alleged that both OnePlus and OPPO used the brands 5G technologies in their phones without paying royalties and with the German court siding in Nokias favor both brands had to pull out of Germany. Thankfully it looks like the lawsuit wont have any farreaching consequences for the BBKowned entities and that it will be business as usual for the rest of the region. In a statement provided to Android Central OPPO and OnePlus confirmed that both companies will continue to serve existing European markets with new products launching over the coming months OPPO and OnePlus are committed to all the existing European markets and the UK. We had a great start in 2023 with the successful launches of several products in Europe and have a lineup of upcoming products for the rest of the year. As always OPPO and OnePlus will continue to provide more innovative products and the bestinclass service for users moving forward. OPPO had a big launch event in the U.K. a few weeks ago for the launch of its latest foldable the Find N2 Flip and the device is up for sale in the country. Similarly the OnePlus 11 is listed in the U.K. and OnePlus has maintained several times that the best OnePlus phones would be available in the U.K. with the region playing a key role in the manufacturers global efforts.,A new report suggests OPPO and OnePlus could be making their exodus from major markets in the EU. A post in Chinese publication 36Kr suggests the BBKowned entities are considering pulling out of the U.K. and Germany and a tweet by leaker Max Jambor indicates France and The Netherlands may also be affected. Both OPPO and OnePlus have faced significant challenges in Germany in the last six months. A patent lawsuit filed by Nokia the networking services provider not HMD Global effectively barred both OPPO and OnePlus from selling phones in Germany in August 2022 and if you go to the OnePlus Germany opens in new tab site you will see the companys latest launches  including the Buds Pro 2 and the OnePlus Pad  but no phones at all.,A new report suggests OPPO and OnePlus could be making their exodus from major markets in the EU. A post in Chinese publication 36Kr suggests the BBKowned entities are considering pulling out of the U.K. and Germany and a tweet by leaker Max Jambor indicates France and The Netherlands may also be affected. Both OPPO and OnePlus have faced significant challenges in Germany in the last six months. A patent lawsuit filed by Nokia the networking services provider not HMD Global effectively barred both OPPO and OnePlus from selling phones in Germany in August 2022 and if you go to the OnePlus Germany opens in new tab site you will see the companys latest launches  including the Buds Pro 2 and the OnePlus Pad  but no phones at all.,business
https://www.theguardian.com/world/2023/mar/28/german-leopard-2-tanks-now-in-ukraine-berlin-confirms,German Leopard 2 tanks now in Ukraine Berlin confirms,Eighteen German vehicles handed over at border to bolster military supplies from Britain and EU countriesulliRussiaUkraine war  latest news updatesliulGermanys muchawaited shipment of 18 Leopard 2 battle tanks has arrived in Ukraine the German ,Germanys muchawaited shipment of 18 Leopard 2 battle tanks has arrived in Ukraine the German defence ministry has confirmed After months of prevaricating the Germany government announced in late 2559 chars,Germanys muchawaited shipment of 18 Leopard 2 battle tanks has arrived in Ukraine the German defence ministry has confirmed. After months of prevaricating the German government announced in late January it would provide Kyiv with the stateoftheart fighting vehicles as part of a deal under which several EU states would contribute to a shipment of two Leopard 2 battalions and 31 Americanmade M1A2 Abrams tanks from the US. Berlin had promised 14 vehicles but increased that to 18 in order to make up the numbers of a Ukrainian battalion with Portugal contributing three tanks and Sweden 10. Poland has supplied Ukraine with a battalion of the older Leopard 2 A4 model. As promised our tanks have arrived on time in the hands of our Ukrainian friends Boris Pistorius the German defence minister said on Monday night. I am sure that they can make the difference on the front. The vehicles were handed over at the Ukrainian border at the end of last week the news magazine Der Spiegel reported adding that 40 Marder infantry fighting vehicles and two tank recovery vehicles promised by Berlin have also arrived in Ukraine. For security reasons the German government would not comment on the route by which the tanks were delivered. Kyiv which had a limited numbers of tanks from the Soviet or postSoviet era has said it urgently needs heavier armour for its defence against Russias invasion with the Germanmade Kampfpanzer Leopard 2 at the top of its list. Armed with a 120mm smoothbore gun and two 7.62mm machine guns the 1970sdesigned machine is the most popular tank in Natos inventory because of its speed of up to 42 miles an hour fuel efficiency and ability to shoot with high levels of accuracy even while manoeuvring over rough terrain. Operated by a crew of four  a commander gunner loader and driver  about 2000 Leopard 2s are in use by European countries. Over the last two months Ukrainian soldiers have been trained in using the complex weapons system of the tanks A6 variant at a Bundeswehr site in Munster Lower Saxony. The Ukrainian soldiers did not only prove themselves to be incredibly motivated but also able to handle the technology and deployment principles a Bundeswehr commander Bjrn Schulz told Der Spiegel. Confirmation that the German tanks had been delivered came as the Ukrainian defence ministry spokesperson Iryna Zolotar said Britishmade Challenger 2 tanks were in Ukraine already. The defence minister Oleksii Reznikov posted a picture of a Challenger 2 alongside other westernmade military vehicles on his Facebook page describing the British vehicle as a work of military art. The UKs Ministry of Defence declined to comment but confirmed Ukrainian tank crews training in Britain had returned home after completing their tank training.,Germanys muchawaited shipment of 18 Leopard 2 battle tanks has arrived in Ukraine the German defence ministry has confirmed. After months of prevaricating the German government announced in late January it would provide Kyiv with the stateoftheart fighting vehicles as part of a deal under which several EU states would contribute to a shipment of two Leopard 2 battalions and 31 Americanmade M1A2 Abrams tanks from the US. Berlin had promised 14 vehicles but increased that to 18 in order to make up the numbers of a Ukrainian battalion with Portugal contributing three tanks and Sweden 10. Poland has supplied Ukraine with a battalion of the older Leopard 2 A4 model.,Germanys muchawaited shipment of 18 Leopard 2 battle tanks has arrived in Ukraine the German defence ministry has confirmed. After months of prevaricating the German government announced in late January it would provide Kyiv with the stateoftheart fighting vehicles as part of a deal under which several EU states would contribute to a shipment of two Leopard 2 battalions and 31 Americanmade M1A2 Abrams tanks from the US. Berlin had promised 14 vehicles but increased that to 18 in order to make up the numbers of a Ukrainian battalion with Portugal contributing three tanks and Sweden 10. Poland has supplied Ukraine with a battalion of the older Leopard 2 A4 model.,business
https://www.theguardian.com/politics/2023/apr/08/french-and-german-tourists-turn-their-back-on-brexit-britain,French and German tourists turn their back on Brexit Britain,Industry leaders fear new entry restrictions and the UKs tarnished image among some Europeans have caused a decline in EU visitorsFrench and German tourists are beginning to avoid the UK tourism leaders fear because of postBrexit restrictions on travellin,French and German tourists are beginning to avoid the UK tourism leaders fear because of postBrexit restrictions on travelling with identity cards Since antiCovid measures ended across Europe l 5175 chars,French and German tourists are beginning to avoid the UK tourism leaders fear because of postBrexit restrictions on travelling with identity cards. Since antiCovid measures ended across Europe last year tourism has started to recover but there are growing signs that significant numbers of French and Germans  two of the largest markets for UK tourism  are staying away. Since October 2021 EU citizens have needed a passport to enter the UK. Previously they could use ID cards but less than half the population of France and Germany hold a valid passport. People who run tourist attractions and businesses in the UK say that although Americans have returned in large numbers the French and Germans have not. Jerseys government is so concerned that last month it announced a pilot project allowing French citizens to show their ID cards on day trips to the island. This year walking tours in Oxfordshire a significant part of the tourist trail for foreign visitors are seeing bookings from France and Germany at half their 2019 levels. The number of passenger vehicles transported by Le Shuttle through the Channel tunnel in the first two months of 2023 dropped to 251175 compared with 314497 in 2019. Brittany Ferries said in December that it had 155000 arrivals in 2022 compared with 338000 in 2019. The decline is not just down to the issue of passports  Brexit has also battered the perception of Britain as a welcoming nation for tourists. Data from Visit Britain and the Anholt Ipsos Nation Brand Index shows a decline in how French and German people view the UKs standing compared with other countries. In 2016 Germans ranked the UK as the 7th best place to visit and French people ranked it 9th. By 2022 the UK had fallen to 16th and 14th respectively. Joss Croft OBE chief executive of UKinbound the trade association for the inbound tourism industry said French and German tourists still regard the UK very highly. However we know that the introduction of the new requirement for passports for EU citizens to access the UK  is proving to be a deterrent to travel particularly for school groups due to the additional costs and bureaucracy he said. School groups are particularly badly affected because if one or two children in a class of 30 do not have passports teachers will elect to travel to Ireland or Malta for English language trips instead. Children with nonEU passports such as refugees will also need a 95 visa to enter the UK. Research by the Tourism Alliance last year found there had been an 83 drop in schoolchildren and students visiting the UK leading to a loss of 875m and 14500 jobs. About 28 million people in Germany have passports according to a 2007 parliamentary answer out of a population of 83 million. In France about 32 million passports have been issued in the last 10 years out of a population of 67 million. Hayley BeerGamage chief executive of Experience Oxfordshire said that bookings from French and German groups were at 50 of prepandemic levels. That clearly shows that actually the market isnt returning and the desire  to visit Oxfordshire England the UK is not there as it was before the pandemic she said. Weve got to make sure that the nation is not losing those markets the other side of the pandemic. skip past newsletter promotion Sign up to First Edition Free daily newsletter Archie Bland and Nimo Omer take you through the top stories and what they mean free every weekday morning Privacy Notice Newsletters may contain info about charities online ads and content funded by outside parties. For more information see our Newsletters may contain info about charities online ads and content funded by outside parties. For more information see our Privacy Policy . We use Google reCaptcha to protect our website and the Google Privacy Policy and Terms of Service apply. after newsletter promotion David Edwards of the Scattered Clouds travel consultancy said that holiday visits from France and Germany had been falling since 2015 while those from elsewhere had risen. Broadly speaking many Europeans have a less favourable view of some aspects of the UK he said. They are a really important market. The Germans particularly visit parts of Britain that others do not like Devon and Cornwall. But theyre not going to disappear. Last month when Rishi Sunak met Emmanuel Macron following the announcement of the Windsor framework the leaders announced that France and the UK would expand opportunities for school trips. Emma English executive director of the British Educational Travel Association Beta said that ID cards remained an issue but her members were enthused by the declaration. There is however no information on this she added. Beta has written to Robert Jenrick the immigration minister asking for details. Businesses are also concerned about plans to introduce electronic travel authorisation ETA rolling out from October. The scheme similar to the USs Esta system will mean that even tourists who do not require a visa will need to pay for a digital permit. Richard Toomer executive director of the Tourism Alliance said ETAs need to be priced at a reasonable level. We really need to look again at our high visa costs he said. European ID cards no longer being accepted at the UK border is a significant barrier to certain travellers especially school groups but were hopeful well see some movement on this soon particularly for travellers to and from France.,French and German tourists are beginning to avoid the UK tourism leaders fear because of postBrexit restrictions on travelling with identity cards. Since antiCovid measures ended across Europe last year tourism has started to recover but there are growing signs that significant numbers of French and Germans  two of the largest markets for UK tourism  are staying away. Since October 2021 EU citizens have needed a passport to enter the UK. Previously they could use ID cards but less than half the population of France and Germany hold a valid passport.,French and German tourists are beginning to avoid the UK tourism leaders fear because of postBrexit restrictions on travelling with identity cards. Since antiCovid measures ended across Europe last year tourism has started to recover but there are growing signs that significant numbers of French and Germans  two of the largest markets for UK tourism  are staying away. Since October 2021 EU citizens have needed a passport to enter the UK. Previously they could use ID cards but less than half the population of France and Germany hold a valid passport.,business
