URL,Title,Description,Content,full_content,topic
https://www.theguardian.com/culture/2023/apr/02/rachael-stirling-private-lives-donmar-interview,Rachael Stirling Promise me youll take out half the swearing,The actor on sparring with Stephen Mangan in a new Private Lives why she didnt want to be a Bond girl and what she learned from pulling pintsSince scandalising BBC viewers more than 20 years ago in Tipping the Velvet Rachael Stirling has become one of our,Since scandalising BBC viewers more than 20 years ago in Tipping the Velvet Rachael Stirling has become one of our most soughtafter actors on stage and screen Other TV credits include The Bletchle 5529 chars,Since scandalising BBC viewers more than 20 years ago in Tipping the Velvet Rachael Stirling has become one of our most soughtafter actors on stage and screen Other TV credits include The Bletchley Circle Women in Love and Mackenzie Crooks Detectorists Shes now in rehearsals for the Donmar Warehouses new production of Nol Cowards comedy Private Lives in which she and Stephen Mangan will play Amanda Prynne and Elyot Chase a divorced couple who cant resist one last hurrah The 45yearold Stirling  whose mother was the late Diana Rigg  is married to Elbow frontman Guy Garvey with whom she has a sixyearold son How are preparations for Private Lives They are full of joy It is one of the most pleasurable parts to play and story to tell  this very passionate narcissistic combustive dangerous costly and hilarious relationship And to be able to do it in the Donmar where no audience member is more than four rows away They are in your armpit they can smell the sweat and see up your nostrils so youve got to be on your game or you will be exposed The Observers 1930 review of the original production noted that the play could not stand up to the slightest clumsiness in the acting Do you agree Yes I do You have to have two actors who trust each other totally and who arent playing stupid fucking ego games outside of the stupid fucking ego games that their characters are playing Otherwise youd have just too many explosions going on Guy and my son will just improvise songs or gags Its made me less afraid of constantly coming up with daft shit So its a nightmare being paired with Stephen Mangan Laughs Steve Mangan is just the dream There are many actors whose balls you have to cup in order to be able to More laughter If you have a funnier line you have to sort of soften the blow But not this man this man can stand up to anything How does your version differ from other revivals Were doing the grittiest version of it Weve got some proper scrapping battling going on Ive got a torn pectoral muscle thats just about hanging on So we need to get fit All that fighting and fucking every night is going to be exhausting Sold Recently youve appeared more in theatre than on TV Is that your preference these days I get offered the great big thwacking gorgeous parts in the theatre And telly not so much I come back to do things like Detectorists because its the gentlest wrappedinthearmsofMackenzie Crook nothingcangowrong experience but Im just a bit pickier about telly Will there be more Detectorists No definitely not We auctioned off the Triumph TR7 for Red Nose Day Thats all folks With her husband Guy Garvey April 2022 Photograph David M BenettGetty Images Is it true you proposed to Guy Garvey on a leap year I did I asked my beloved to marry me I went with my brother to Halfpenny Bridge off Harrow Road in west London where I lived and we bought loads of chalk and I wrote on the bridge Marry me Shindig which was my name for him And then squirted it with hairspray in case it rained Why Shindig Its because when I met him the first thing I said to him was Ahhhh you use the word shindig in one of your songs Because I really enjoy that word And Guy came back with Ive also used the word shenanigans And thats when love was born is all I can say Has living with him changed the way that you work I used to be a nervous improviser but now Guy and my son will just improvise songs or gags and Ill join in Hes made me less afraid of constantly coming up with daft shit Less afraid of that little critic on your shoulder saying Thats not good enough Its been a revelation that everything is on the way to something There was a period about 10 years ago when you stopped acting for a few months Did you always know youd come back to it No Id broken up with somebody and in order not to get depressed and fall down I needed to go and do some manual labour I mean lets face it I didnt go down a coalmine but I went to go and work in a pub for a bit And do some peoplewatching and clean up some sick It was very grounding Did the break make you appreciate acting When I was much younger I was sent off for auditions for a Bond movie Casino Royale And I just remember I thought This is not me I dont feel like a Bond girl This is awful I found myself being told what it was I ought to want and it was never what I wanted Ive always been a pathetic peoplepleaser but perhaps birth and death and all these things have made me less so Stirling with Mackenzie Crook in Detectorists Photograph BBCChannel X Do you have any cultural recommendations Im going to the brilliant Lisa ONeill gig at the Barbican On TV Guy and I are just lapping up the new Ted Lasso Thats not the most imaginative answer but its kind  its not cruel telly And introducing my son to David Attenborough has been one of the greatest joys Attenboroughs documentary about the titanosaur  his eyes nearly popped out of his head So now thats become our Sunday night thing Whats your happy place I do ballet with a gorgeous exballerina called Charlotte Toner I played Marie Rambert in a drama about 15 years ago and I had to go and train with the Birmingham Royal Ballet and I remembered how much I loved it Shes totally changed my brain and body and I do it with women from all walks of life Some can get their legs up to their ears and some like me cant quite Thanks Rachael its been great speaking to you Promise me Tim that youll take out half the swearing Only leave in the very funny fucks,entertainment
https://www.theguardian.com/lifeandstyle/2023/apr/02/seamas-oreilly-my-young-son-thinks-he-is-a-huge-ireland-rugby-fan,My young son thinks he is a huge Ireland rugby fan,Yet he was reduced to tears when England got thumped in the Six NationsBefore England played Ireland in the final game of the Six Nations we asked my son which team he supported Ireland he said cheerily before adding somewhat cryptically because they ,Before England played Ireland in the final game of the Six Nations we asked my son which team he supported Ireland he said cheerily before adding somewhat cryptically because they dont always do 2934 chars,Before England played Ireland in the final game of the Six Nations we asked my son which team he supported Ireland he said cheerily before adding somewhat cryptically because they dont always do the right thing Were still not sure what that meant or how fervent his Irish patriotism really is since he reacted to Englands defeat with huge racking sobs A lot of this is down to the fact that at four he is touchingly empathetic towards anyone who loses His joy at seeing a goal in football reaches a fever pitch when they all hug each other  his favourite part  but crashes immediately down to Earth once he spots the opposition looking sad and humiliated His ideal football match would be one in which everyone gets a goal but each is then sucked into a time vortex and deleted rendering the scoreline a fair balanced and painless 00 The boys grasp of geography is basically England most Ireland the rest But we cant ignore the possibility that our sense of Irish identity has left him eager to embrace his Englishness To be clear we know hes both and such queries dont give us the same urge to place him in an Irish Heritage ReEducation Camp we have witnessed among some of our other Irish friends here My son isnt particularly well travelled having only ever set foot in England and Ireland and his conception of the former is nebulous He has not yet grasped that his own world largely contained to around a dozen streets in north Walthamstow is a tiny bit of a small corner of a mediumsized country As a result his grasp of geography is basically England most Ireland the rest meaning that any moderately long bit of travel in any direction inevitably prompts him to ask if were in Ireland now Its cute but mildly inconvenient especially when we get off a train in Nottingham East Sussex or even central London and find him distraught that his grandparents arent there to greet him A trip to the map in his bedroom shows the depth of his geographical knowledge He finds Great Britain which he insists is England my apologies to Scotland and Wales but this is just a warmup Horrified by how small this seems by itself he proceeds to annexe an alarming number of other countries too His entire life could not possibly be constrained to that small patch of Earth so large tracts of Europe Asia and Africa must simply be England too Four years as an Englishman have turned my sweet young boy into Cecil Rhodes Auntie Maeves house a 15minute walk from home he locates in Cyprus Pondering the traveltime it takes to reach Uncle Shane in Surrey he places Kingston in Australia He is dumbstruck as we correct him naming countries as best we can leaving him baffled that theres so much he hasnt seen And wheres Ireland we ask He looks at us with condescension before hitting the bullseye first time prodding a small finger at the only country that looks like a teddy bear driving a car Its sort of just a bit of England he says We do not disguise our horror already drafting plans for a reeducation camp in our heads Follow Samas on Twitter shockproofbeats,entertainment
https://www.theguardian.com/sport/2023/apr/05/richard-whitehead-worries-disabled-athletes-known-more-for-reality-tv-than-sport,Whitehead worries disabled athletes are known more for reality TV than sport,ulliDouble Paralympic champion wants sporting success to be focusliliWhitehead fronts newly launched Disability Sports AllianceliulParalympic champion Richard Whitehead says too many disabled athletes are known for their time on reality TV show,Paralympic champion Richard Whitehead says too many disabled athletes are known for their time on reality TV shows rather than their exploits in sport Whitehead a double gold medallist and world r 3474 chars,The Paralympic champion Richard Whitehead says too many disabled athletes are known for their time on reality TV shows rather than their exploits in sport Whitehead a double gold medallist and world recordholder is one of a number of highprofile Paralympians to have appeared on a celebrity show He appeared on Celebrity Hunted while Ellie Simmonds was on Strictly Come Dancing and Kadeena Cox has been on Im a Celebrity  Get Me Out of Here However Whitehead says their sporting achievements are being forgotten and has called for change in the exposure successful disabled athletes are getting The 46yearold surged into the public consciousness after his mesmerising sprint from the back of the field to win the T42 200m title at London 2012 which he defended in Rio four years later He is now fronting the new Disability Sports Alliance  a digital platform designed to drive awareness of disability sport  after research found 67 of UK adults were unable to name a competitive or retired disabled athlete Its astounding that people associate the athletes with other media opportunities and not their own speciality he said You want to be remembered as an athlete you want to represent professionalism you want to represent more than just the sport but also you want to be identified through the successes that youve had and then transcend to other areas as well Its about celebrating those successes and understanding that Paralympic athletes have so many barriers and obstacles to overcome where were just getting on the field of play and then being successful To have all these barriers and obstacles after youve been successful is really frustrating Kadeena Cox who was on Im a Celebrity  Get Me Out of Here in 2021 is a fourtime Paralympic gold medallist in two sports Photograph ITVShutterstock While the exposure is there for the highestprofile athletes in the entertainment genre Whitehead has called out the lack of disability sport being shown on TV and the personal stories that are being missed out on because of that The channels are just gobbled up by these mainstream ablebodied sports whether its cricket whether its football and disability sports take a backseat he said The storytelling is really part of that When you look at the Olympic athletes that you associate with success theres always a really great story Jess Ennis Mo Farah they have really great stories and we want to start to give those elite Paralympic athletes elite disabled athletes those opportunities to have the story out there Im sure it resonates with a lot of the publics obstacles and challenges theyre having to overcome skip past newsletter promotion Sign up to The Recap Free weekly newsletter The best of our sports journalism from the past seven days and a headsup on the weekends action Privacy Notice Newsletters may contain info about charities online ads and content funded by outside parties For more information see our Newsletters may contain info about charities online ads and content funded by outside parties For more information see our Privacy Policy  We use Google reCaptcha to protect our website and the Google Privacy Policy and Terms of Service apply after newsletter promotion My message is that we deserve this opportunity through the success weve had Theres been so many things that have been lost within success but now its time for social change Now its time to hold people accountable When organisations and the media say they have an inclusive strategy around disability sport its time to hold people to account to that,entertainment
https://www.theguardian.com/food/2023/apr/04/easter-dessert-make-in-advance-kitchen-aide,Make or bake I need a great dessert for Easter I can make in advance,Theres no shortage of suggestions for sweet treats you can make ahead of time from trifle and mousse to sprucedup carrot cake and macaroonsulliGot a culinary dilemma Email feasttheguardiancomliulWhats a good makeahead dessert for entertaini,Whats a good makeahead dessert for entertaining over EasterChris BristolA classic chocolate mousse is unbeatable says Gurdeep Loyal author of the recently published Mother Tongue Theres a rest 3079 chars,Whats a good makeahead dessert for entertaining over Easter Chris Bristol A classic chocolate mousse is unbeatable says Gurdeep Loyal author of the recently published Mother Tongue Theres a restaurant in Paris called Chez Janou thats famous for making a gigantic bowl of chocolate mousse every day which you basically help yourself to What makes this 1960s dinner party favourite such a good tactic however is that it can be done well ahead of time and left in the fridge Then turn it into chocolate mousse sundaes Loyal suggests Give everyone loads of bits to adorn it with  crushed amaretti meringue almond praline  Its fun and interactive The immaculate chocolatiness of a torte also hits the makeahead sweet spot Chocolatier Paul A Young author of The Joy of Chocolate starts with the base which is similar to that of a cheesecake Crush chocolate chip cookies mix in melted butter then press into the bottom of a cake tin For the filling youll need equal amounts of dark chocolate and double cream Melt the chocolate warm the double cream then mix the two spread on to your base and chill You could Young adds flavour the filling with cinnamon and nutmeg for hot cross bun vibes or if its adults only add a splash of brandy or rum Once set top with mini eggs or differentsized Easter eggs  pile them really high It will then sit happily in the fridge over the weekend Of course Easter is not solely about chocolate It also lends itself to a sprucedup carrot cake Loyal says An oilbased batter means it will stay moist then stir in toasted pistachios sultanas soaked in lady grey a mix of citrus zests and spices such as cardamom cinnamon and tonka beans If youre feeling fancy finish with a saffroninfused cream cheese icing Like all rightthinking people Loyal also sets his sights on a really creamy amped up school dinner rice pudding with roast fruit spooned all over it Cover early strawberries in sugar some fennel seeds and black pepper then roast slowly until jammy And everyone knows that rice pudding tastes best a few days after its made For Claire Ptak of Violet Bakery in London and author of Love is a Pink Cake meanwhile easy Easter entertaining means bitesize coconut macaroons Dip them in milk or white chocolate and dust with dried fruit powder  for extra flavour add a pinch of salt Trifles meanwhile are the loweffort highly customisable dessert that everyone will love and they even work layered in a baking tin Tom Oxford cofounder of The Exploding Bakery in Devon stacks up ground almond sponge jelly custard and a combination of double cream whipped with mascarpone and icing sugar One tip though Double up on the custard powder so the custard sets harder than normal which makes it easier to cut into slabs Oh and dont forget to finish with hundreds and thousands Also scoring high in the fun factor stakes are icebox cakes Loyal says What youre doing is layering a pack of biscuits custard or lemon creams or Jammie Dodgers say with softened icecream a bit like a lasagne Loyal might ripple his cake with fruit jam or hot marmalade too Freeze then remove to soften before slicing Its like a biscuit Viennetta And what could be better than that,entertainment
https://www.theguardian.com/theguardian/2023/apr/01/megxit-to-mcnugget-boots-some-of-the-best-april-fools-day-2023-gags,Megxit to McNugget boots some of the best April Fools Day 2023 gags,Media and brands take chance to offer up some light relief including Matt Hancock cheddar and an Oasis reunionAmid these often dark and difficult times  and with a rising ride of online disinformation  judging the tone of a good April Fools gag has become,Amid these often dark and difficult times and with a rising ride of online disinformation judging the tone of a good April Fools gag has become much harder for news organisations On Saturday morning 2778 chars,Amid these often dark and difficult times  and with a rising tide of online disinformation  judging the tone of a good April Fools gag has become much harder for news organisations On Saturday morning though readers enjoyed waking up to a wealth of stories offering some light relief The Sun published a piece announcing the launch of Prince Harry and Meghans new video game Megxit Call of Dukey in which the royal couple try to reach California while dodging obstacles including rival royals and the media along the way The piece claimed a source had said There are some brilliant secret levels including one where the player finds themself in the Duke of Yorks bedroom confronted by a raging Prince Andrew bouncing on his bed hurling teddy bears It seemed the logical progression after the success of his book and Netflix series There were also reports that some of Britains tallest buildings including the BT Tower were to be converted into wind turbines to help Britain reach net zero under radical climate plans secretly approved by the government The Treasury is understood to be hugely supportive of the scheme as it will help bring down the cost of electricity in London the Telegraph claimed in a report by Lois Raplof Meanwhile Wales Online reported the introduction of 20mph speed limits along the M4 to reduce pollution accidents and confusion caused by Welsh language road signs Durham Universitys student newspaper Palatinate announced that the small northeast city would be the site of the newest Formula One street circuit with some of its cobbled streets and ancient monuments being incorporated into the track East London Radio stated that its morning show would be sponsored by Matt Hancock cheddar In a tweet it called on listeners to add more to your cooking than just a knob of butter  include a knob of cheese too Greenpeace admitted to paying Kwasi Kwarteng 10000 a day to support windfarms And the rugby team Northampton Saints announced the opening of a hospitality suite halfway up the Northampton Lift Tower Others getting in on the fun included McDonalds which unveiled its new Big McNugget Boot the most flavoursome shoe of SS23 and the paint brand Dulux which decided to ditch its iconic sheepdog logo in favour of a king charles spaniel in honour of the new monarch Snack company Babybel declared its individually wrapped cheeses would be replaced by a new square version to be taken more seriously The company wrote After it came to light that the brand is deemed too fun the decision has been made to change to a new more mature shape Calling all fashionistas  Weve got the must have drop of the season Unveiling the Big McNugget Boot the most flavoursome shoe of SS23 Releasing exclusively through the McDonalds App this Monday pictwittercom1hjFuFZOfG  McDonalds UK McDonaldsUK April 1 2023 In a fake press release the dating app Tinder said it would be banning all images of people holding fish and the language learning app Duolingo said it had partnered with the streaming service Peacock on a fake dating show called Love Language The catch in which none of the singletons speak the same language as one another and therefore must use Duolingo to communicate The Eiffel Towers official Twitter page announced it would be transformed into the worlds biggest slide and Londons Royal Albert Hall claimed that newly unearthed documents show Churchill wanted to use Hitlers lost testicle as a propaganda tool during the second world war REVEALED Winston Churchill wrote to the Hall in 1940 asking if we really had Hitlers ball httpstco1cy0lcWKoC pictwittercom9gef6UUZkH  Royal Albert Hall RoyalAlbertHall April 1 2023 A host of entertainers also joined in with presenting duo Ant and Dec telling their followers they are in talks to join the cast of the new Bond movie And so far more than 2000 people have liked a tweet from an Oasis fan account featuring an edited image of the estranged Gallagher brothers that suggests they have just enjoyed a night out together,entertainment
