URL,Title,Description,Content,full_content,topic
https://www.theguardian.com/artanddesign/2023/apr/04/rossettis-review-tate-dante-gabriel-christina,The Rossettis review  lurid lusciouslipped beauties drown out the familys real talent,Tate Britain LondonDante Gabriels paintings are overshadowed by his sister Christinas poetry in this baffling overblown exhibition about the decidedly nonrevolutionary preRaphaelitesIts obvious from the very first room of Tate Britains overblown baf,Its obvious from the very first room of Tate Britains overblown baffling celebration of the radical and revolutionary preRaphaelites who was the real talent in the Rossetti family the poet Chris 5627 chars,Its obvious from the very first room of Tate Britains overblown baffling celebration of the radical and revolutionary preRaphaelites who was the real talent in the Rossetti family the poet Christina Rossetti You can hear readings of her poems here including Colour which praises colours in almost childlike spiritually clear images What is yellow pears are yellow  Rich and ripe and mellow Unfortunately as you listen you are obliged to look at her brother Dante Gabriel Rossettis 184950 painting The Annunciation displayed like the icon it isnt in the middle of the space Where Christinas images have a crystalline exactitude that makes them pretty much timeless this work is strictly for buffs of Victoriana It is like some sort of taxidermy exhibit a leaden quotation of medieval art thats neither properly medieval nor bitingly modern Although this exhibition strives to set her verse alongside his art theres only so far you can go with bringing literature into the gallery via poems printed on walls Her steady quiet voice is drowned out by his lurid paintings of lusciouslipped beauties It looks as if DG never tried to draw anyone or anything freshly from life ever His pseudoRenaissance paintings are heavily worked up concoctions of symbolist erotica  and it turns out his drawings are like that too When he sketches his models who are his lovers he never sticks with what he sees but transfigures them in abstracted simplified lines Not that hes an abstract artist Just an emptily idealising one Surely the reason why he never completed Found is that he knew it was an awful painting The PreRaphaelite Brotherhood were a bunch of soso male artists who got together in 1848 to dress up their art in the borrowed robes of 15thcentury religious fervour and promote themselves as social saviours But the wall text will have us believe they were revolutionaries who wanted to express themselves authentically with art and poetry based on lived experience and nature that they were a group of young men and women in spite of stressing Brotherhood in their name Thus were told that John Everett Millaiss 1850 watercolour A Baron Numbering his Vassals actually depicts the class conflicts of 1840s Britain Really It looks like a placid portrayal of medieval folk to me The show pushes its exaggerated political claims for the preRaphaelites to absurdity in an extended exploration of Rossettis unfinished painting Found in which a woman of the streets who has collapsed against a wall is saved from death by a rustic In a series of halfpainted halfbaked canvases Rossetti dwells on the sensual face of his model Fanny Cornforth in a way that ludicrously undermines the supposed social message of the work The exhibition takes it all with leaden literalism as a radical revolutionary indictment of Victorian capitalism In reality its a collision between Rossettis erotic narcissism and his attempt to create a conscientious painting Surely the reason he never completed Found is because he knew it was awful Dante Gabriel Rossettis Proserpine Photograph Matt Greenwood Tate If there was a preRaphaelite painter who fitted this shows vision of a socialistfeminist critique of the Victorian social order that artist was William Morris not Rossetti Morris actually was a socialist But while he was trying to design Utopia Rossetti was having an affair with and painting his wife Jane And while the morally fervent John Ruskin was praising and buying not only his art but that of his lover and eventual wife Elizabeth Siddal Rossetti was betraying Siddal with Cornforth In its desperation to see the Rossettis as highminded and progressive this exhibition makes a startling factual error A wall text explaining Rossettis 1859 painting Bocca Baciata tells us it illustrates The Decameron a sensual medieval Italian poem by Giovanni Boccaccio The same claim is in the catalogue But there is no medieval poem called The Decameron It is the founding masterpiece of Italian prose a collection of ribald stories thats an ancestor of the modern novel Rossetti in fact is illustrating the seventh tale on the second day of The Decameron in which an eastern princess on her way to marry the Prince of Algarve is shipwrecked before being pursued and in effect raped by a series of men So this painting is very far from the romantic radicalism this exhibition claims for him In portraying his lover Fanny Cornforth as Boccaccios princess he seems rather to be making a dirty joke or sexual boast What a laugh DG Rossetti was no radical pinup but at least he supported Siddal to become an artist Her paintings like his depict Arthurian romances with brightly hued passion But their combination of selftaught naive drawing with preRaphaelite fantasy is often clumsy and inert Then again thats also true of the more technically refined works of the male preRaphaelites skip past newsletter promotion Sign up to Art Weekly Free weekly newsletter Your weekly art world roundup sketching out all the biggest stories scandals and exhibitions Privacy Notice Newsletters may contain info about charities online ads and content funded by outside parties For more information see our Newsletters may contain info about charities online ads and content funded by outside parties For more information see our Privacy Policy  We use Google reCaptcha to protect our website and the Google Privacy Policy and Terms of Service apply after newsletter promotion The exhibition excludes Millaiss Ophelia in which Siddal floats in macabre ecstasy even though its owned by Tate probably because it wants to get away from the myth of Siddal She was a real person  but she quickly became a fantasy figure for Rossetti who cherished a lock of her hair  exhibited here  and later got his friends to open her grave in Highgate Cemetery London Christina had her brothers number Her poem In an Artists Studio printed on a wall here evokes a mysterious model whose face looks out from all his canvases This omnipresent nameless girl haunts the artists work He feeds upon her face by day and night Its the preRaphaelite muse a myth this show signally fails to bust Christina Rossetti sees the role women will always have in her brothers art to be fed on,entertainment
https://www.theguardian.com/tv-and-radio/2023/apr/01/rental-health-radio-4-saturday-night-at-the-movies-jonathan-ross-classic-fm-tims-listening-party-absolute-tagged-podcast,The week in audio Rental Health Saturday Night at the Movies Tims Listening Party Tagged  review,Radio 4 took an indepth look at local incarnations of the housing crisis from Leeds to Ullapool while Jonathan Ross and Tim Burgess find new radio homesRental Health BBC Radio 4  BBC SoundsSaturday Night at the Movies  Classic FMTims Listening Party  ,Rental Health BBC Radio 4  BBC SoundsSaturday Night at the Movies  Classic FMTims Listening Party  Absolute FMTagged  Somethin ElseSony Music Entertainment Im worried about Kieran Hes doing  5588 chars,Rental Health BBC Radio 4  BBC Sounds Saturday Night at the Movies  Classic FM Tims Listening Party  Absolute FM Tagged  Somethin ElseSony Music Entertainment Im worried about Kieran Hes doing really well at work and he loves Leeds where hes settled but his home is wrecking his life Hes in a basement flat but its freezing and the cracks in the wall mould on the floor just the general smell of the flat are bringing him down So why doesnt Kieran move Well hes trying to Hes seeing four or five flats a day Before this flat he moved seven times in as many years At the moment in Yorkshire the situation for anyone wanting to rent a home is completely impossible John Hudson a Grimsby estate agent explains that renting a property is like applying for a job His agency makes a video of the property then we invite people to look at that video and then submit a preliminary application form And then we select perhaps the best two or three candidates to do a direct viewing Later he says You sometimes feel like youre playing God Radio 4s Rental Health series started and ended last week Not a full takeover of the station just a few pointed programmes about the state of the UKs rented housing each one packed with devastating facts In Hunt for a Home where we met Kieran and many others desperate to rent we were told that the average house price in the UK is now nine times the average wage A ratio not seen since 1876 said the presenter Rima Ahmed from BBC Radio Leeds Other facts 500000 homes have been taken out of the English private market since 2018 40 local authorities didnt buy or acquire any social housing between 2016 and 2021 on average there are 13 households applying for each new rental Then in All Work and No Homes Pennie Stuart talked to people in Ullapool in the Highlands where there are lots of jobs but no homes for those who want to fill them There are a few available but they are massively expensive local house prices are 130 of the Scottish average wages 87 of the Scottish average This is an easy gig for Ross and an easy listen for Classic FMers Such stark statistics weaved in and around these two programmes as they did in Solutions  shorter shows offering different approaches to housing Kirsty Lang discussed Vienna her home since leaving London When it comes to housing this is another universe she says In what way Well after the first world war Vienna decided to take housing by the scruff of the neck and now it has various city laws that mean that rents are subsidised and housing developers must designate twothirds of their new buildings as lowincome housing Now 60 of people living in Vienna enjoy subsidised rent Lang also visited Tower Bridge in London to look at houseboat communities and checked out communal housing in various cities all very interesting In Ullapool meanwhile businesses are trying to sort the housing problems themselves setting up flats and glamping pods so that when they advertise a job they can say accommodation is provided In Yorkshire though things arent getting any better Landlords are selling up because of increased mortgage payments a lack of tax relief on mortgage interest and other new rules Poor Alexandra has never missed a rental payment in 14 years but her landlord defaulted on a mortgage payment and the bank is about to repossess her flat She cant find anything to rent privately so shes trying the council I will take the tent I will put the tent in the front of Leeds city council she says And I will stay there According to Shelter there are 1 million people across the country on the council house waiting list All of the Rental Health programmes were excellent though I did wonder where the ministers were The series can suggest all the solutions in the world but its national government that needs to take them on Here are two people with nice new homes Jonathan Ross has taken over the Saturday Night at the Movies slot on Classic FM previously hosted by Andrew Collins At one point in his career Ross would rely on his flybytheseat natural presenting charm rather than indepth research Not so much now plus when it comes to film hes had years of expertise In a nicely pitched programme about European film he described hanging out with Pedro Almodvar discussed Fellini recommended obscure French movies Occasionally his links seemed a bit read but this is an easy gig for Ross and an easy listen for Classic FMers Adorable new Absolute Radio host Tim Burgess in stripes with lr Patrick Stump Andy Hurley and Pete Wentz of Fall Out Boy Photograph Joe MaherGetty Images For Bauer Media Another engaging host with a new place is Charlatans singer Tim Burgess whose pandemic Twitter creation Tims Listening Party has found an audio home at Absolute His first show featured the new Fall Out Boy album complete with Patrick Stump Pete Wentz and Andy Hurley from the band Im not a FOB fan but you would need a heart far harder than mine not to love this show Burgess is an adorable host natural and relaxed with musicians experienced in talking about records as an art form Any band would kill to get their LP played and treated with such respect Just room to mention the lively if occasionally irritating new podcast drama series Tagged Its about Instagram influencers isnt everything who might be being stalked though really its about how well a young married couple know each other The plot points are ludicrous plus influencers would spend a lot more time checking their feed but everything licketysplits along and this is a sunny fun modern murder mystery that somehow overlaps with The New Nomads another Rental Health programme,entertainment
https://www.theguardian.com/world/2023/apr/01/smuggled-iranian-carving-worth-30m-seized-at-airport-by-uk-border-patrol,Smuggled Iranian carving worth 30m seized at airport by UK border patrol,The ancient treasure has been restored and will go on show at the British Museum before going back homeIt was carved almost 2000 years ago and is such an important sculpture that if it appeared on the art market today it could fetch more than 30mBut this i,It was carved almost 2000 years ago and is such an important sculpture that if it appeared on the art market today it could fetch more than 30m But this is a previously unrecorded antiquity that  4307 chars,It was carved almost 2000 years ago and is such an important sculpture that if it appeared on the art market today it could fetch more than 30m But this is a previously unrecorded antiquity that can never be sold For the large fragment of a Sasanian rock relief  which depicts an imposing male figure carved in the 3rd century AD  has been freshly gouged from a cliff in Iran with an angle grinder It was heading for the black market in Britain when it was seized at Stansted airport Border Force officers became suspicious when they saw its haphazard packaging perhaps intended to suggest that it was a worthless item The antiquity which is over one metre in height was hacked out of living rock or rock that has been carved in situ Dr St John Simpson a senior curator and archaeologist in the British Museums department of the Middle East said We almost never come across a case of something being cut out of the living rock Thats a level of brutalism that surpasses anything Youve even got felttip marks on the back before theyve used an angle grinder to slice diagonally behind it and across the top It was then packed in an incredibly bad manner in a small almost unpadded crate held together with nails If it had been a stateof theart arthandling type crate that would have attracted a different sort of attention because it required all sorts of paperwork He has identified it as a unique rock relief sculpture dating to the period of the Sasanian empire AD224651 It belongs to a period when Iran was the centre of a powerful empire stretching from Syria to the Caucasus and Central Asia and with its capital at Ctesiphon south of presentday Baghdad he said The Sasanians were powerful rivals of Rome and famous today for their fine silverwares and cut glass As it was carved from a calcareous limestone which is found across Iran it is impossible to pinpoint the exact location There are only about 30 known Sasanian rock reliefs in existence mostly dating to the third century Almost all are in a relatively small part of Iran in their ancestral homeland of Fars province Simpson said We suspect it comes from somewhere in the Shiraz area Stylistically it is similar to one known in the region I think it probably is part of a big sequence There might be more bits out there The lack of an inscription makes it impossible to identify the person depicted but his dress and diademed headdress signifies him as a person of high rank His gesture of greeting and submission with a raised bent forefinger is a feature of Sasanian art when figures are in the presence of royalty which suggests that this was part of a larger composition with the king to the right and perhaps other figures behind The relief had broken into two because it had been so badly packed The British Museum has now had it repaired by conservators It looks amazing Simpson said It is stunningly attractive The valuation could be anything really Were talking 20m to 30mplus Theres never been anything like it on the market He said the artefact would be incredibly valuable on the black market Looters were apparently undeterred by severe penalties in place if they are caught he added In Iran they still have the death penalty for trafficking of antiquities People have been tried and executed in Iran within the last couple of decades Were seeing more Iranian material  people are willing and able to break the sanctions despite the death penalty Dr St John Simpson British Museum But in the last few years weve seen more Iranian material So that means that people are willing and able to break the sanctions The case has been investigated by Interpol and the National Crime Agency but no arrests have been made so far although the packaging stipulated the sender recipient and destination  a UK internet auction site which said that it was not expecting it After the object was formally forfeited to the Crown the British Museum received permission from the Iranian government to display it for three months before sending it to the National Museum in Tehran In a statement Seyed Mahdi Hosseini Matin charg daffaires of the Islamic Republic of Iran in London said We sincerely hope that further expansion of cooperation between the British Museum and the Iranian Embassy in London would continue to be effective in fighting against illicit trafficking of cultural properties and protect the cultural heritage of mankind,entertainment
https://www.theguardian.com/stage/2023/apr/03/jodie-comer-praises-sisterhood-of-backstage-theatre-workers-olivier-awards-prima-facie,Jodie Comer praises sisterhood of backstage theatre workers,Killing Eve star who won best actress prize at the Olivier awards for Prima Facie pays tribute to women behind the scenes of Suzie Millers playulliOlivier awards full list of winnersliulJodie Comer has paid tribute to the sisterhood of theatre,Jodie Comer has paid tribute to the sisterhood of theatre workers behind the scenes on her West End debut Comer won the best actress prize at the Olivier awards on Sunday night for her performance  2159 chars,Jodie Comer has paid tribute to the sisterhood of theatre workers behind the scenes on her West End debut Comer won the best actress prize at the Olivier awards on Sunday night for her performance in Suzie Millers play Prima Facie After collecting her award she praised the stage management team saying I just felt so held every night  The women were backstage the whole time doing their work holding me up making sure everyone felt safe and happy making sure we were having fun really truly caring about what it was that we were doing The Killing Eve star said that they are all still connected through a WhatsApp group We call it the sisterhood because we just felt so close to each other Prima Facie which ran at the Harold Pinter theatre in London last year stars Comer as a barrister who defends men of rape and is assaulted herself It led Comer to reappraise the legal system for sexual assault cases Id never really questioned it before and I was actually quite embarrassed about that she said explaining that the play explores the notion of reaching a legal truth in court There is no real truth only legal truth  I struggled to wrap my head around that And the fact that the accused has the right to remain silent  its actually the victim who stands on trial and not the accused perpetrator Those were things that I was really surprised by Researching the play the Prima Facie team sat in on real trials Accepting the Olivier award for best new play Miller thanked the barristers and the judges of the Old Bailey who really supported us Police officers too had been very transparent with us added Comer who remarked that those involved in sexual assault trials had spoken about what their job demands of them and sometimes how they have to put aside their own feelings as women to commit to the job that they do Comer said that at the first West End preview she could hear gasps from women in the audience and was aware that Prima Facie had started a conversation and that if theatre or television can do that then it is second to none The play is a monologue but in her acceptance speech she stressed that it takes so many people to make the show what it is Among those she thanked was the shows composer Rebecca Lucy Taylor Self Esteem Next month Comer begins a 10week run of the play on Broadway,entertainment
