URL,Title,Description,Content,full_content,topic
https://www.theguardian.com/uk-news/2023/apr/03/novichok-poisoning-dawn-sturgess-death-wiltshire-inquiry-date,Inquiry into novichok death of Dawn Sturgess to begin in autumn 2024,Exclusive date set for start of longawaited hearing into Wiltshire womans 2018 poisoningThe longawaited independent inquiry into the death of Dawn Sturgess in the Wiltshire novichok poisonings will begin in autumn 2024 the Guardian can revealSturgesss ,The longawaited independent inquiry into the death of Dawn Sturgess in the Wiltshire novichok poisonings will begin in autumn 2024 the Guardian can reveal Sturgesss father Stan Sturgess express 3063 chars,The longawaited independent inquiry into the death of Dawn Sturgess in the Wiltshire novichok poisonings will begin in autumn 2024 the Guardian can reveal Sturgesss father Stan Sturgess expressed relief that a date had been set and said he hoped it would mean that those responsible for the attack would be held to account He said Its been a long and trying time but finally with a brilliant legal team we can move forward hopefully finding out who is accountable The inquiry is due to begin on 14 October 2024 which will be more than six years after Sturgess died The former Russian spy Sergei Skripal was the target of the poisoning in Salisbury in March 2018 He his daughter Yulia and a police officer DS Nick Bailey were poisoned but survived Four months later Sturgess 44 and her partner Charlie Rowley were also poisoned after he found a fake perfume bottle containing novichok Rowley recovered but Sturgess died on 8 July 2018 Sturgesss family have battled to try to find out the truth of what happened to their daughter and pushed for her inquest to be converted into an inquiry which would have more power to examine issues such as the role of the Russian state and to consider sensitive information in secret In November 2021 the then home secretary Priti Patel announced that this would happen but since then Sturgesss family has been disappointed by the pace of the process pointing out it involves pressing matters of national security They are also keen that the inquiry gets to the bottom of the still unexplained gap between the attack on the Skripals and the poisoning of Sturgess and Rowley Rowley has several times expressed his frustration about the lack of clarity of what happened to him and Sturgess He said on Monday Its good we have the date for the inquiry The inquiry team later confirmed the date and said the open substantive hearings would begin in Salisbury There continue to be concerns in Wiltshire that the attack could have longterm implications for public safety if not all of the novichok used in the attack on the Skripals was recovered skip past newsletter promotion Sign up to First Edition Free daily newsletter Archie Bland and Nimo Omer take you through the top stories and what they mean free every weekday morning Privacy Notice Newsletters may contain info about charities online ads and content funded by outside parties For more information see our Newsletters may contain info about charities online ads and content funded by outside parties For more information see our Privacy Policy  We use Google reCaptcha to protect our website and the Google Privacy Policy and Terms of Service apply after newsletter promotion At a preliminary hearing last month lawyers for the UK government defended delays in disclosing documents claiming that substantial redactions were needed to protect sensitive information from the hostile state that is Russia The familys KC Michael Mansfield told the hearing that the family would like rolling disclosure including CCTV of Yulia Skripal allegedly being followed upon her arrival in the UK He told the court in London that there must be some material that could be released without sensitivities Addressing the chair of the inquiry Lord Hughes on the disclosure delays Andrew OConnor KC counsel to the inquiry said Theres no hiding from the fact that the disclosure process in this inquiry is taking an exceptionally long time Public hearings are to be held in Salisbury and London The UK government has blamed the Russian state for the novichok attack and the British police have identified three suspects wanted over the poisonings,entertainment
https://www.theguardian.com/tv-and-radio/2023/apr/03/strangers-on-a-plane-review-channel-4,Strangers on a Plane review  so dim it makes Made in Chelsea seem like Newsnight,Take five strangers fly them to Benidorm and get them to each curate a day of entertainment  it must have been a desperate morning at the ideas meeting when this was commissionedWyen is a 33yearold singer and makeup entrepreneur from London She also talk,Wyen is a 33yearold singer and makeup entrepreneur from London She also talks about herself in the third person My idea of a nightmare holiday would include camping Shes definitely not doing tha 4626 chars,Wyen is a 33yearold singer and makeup entrepreneur from London She also talks about herself in the third person My idea of a nightmare holiday would include camping Shes definitely not doing that Safari  shes definitely not doing that either Another thing Wyen definitely isnt doing is successfully hosting a day of funrelated shenanigans for four strangers even though that is her assignment on a new show so unremittingly dim it makes Made in Chelsea seem like Newsnight Strangers on a Plane takes five strangers flies them to Benidorm and tasks each to curate a day of entertainment for the others At the end of five days the contestant who most entertains the others wins the coveted prize another week in Benidorm  or Benners as the presenter unaccountably calls it  with a loved one Essentially its Come Dine with Me with less food more sun and the same sarky bants from the presenter It also bears the hallmarks of a lean morning at Channel 4s ideas meeting Celebrity Transplant Swap Embarrassing Bidets With Kevin McCloud Tom Daleys Dive Pool Karaoke and even Monkey Tennis presumably werent on the agenda while this was green lit Its title makes me wish I was watching Samuel L Jackson battle snakes at 35000ft Wyen begins the day by offering fellow contestants champagne on a yacht Lisa 51 from Doncaster snootily points out that its really cava on a fishing boat But then Lisas judgment may not be all that she tells us that her friends call her the Princess raising the possibility she hasnt considered they might not mean it as a compliment Wakefield waiter Jason 37 jumps into the sea midcruise  that certainly would have been my escape plan  and later complains that Wyen as host should have joined him in the water Which suggests early doors Jason has got a hair trigger when it comes to making unjustified complaints Glaswegian barber Exauc 21 claims to be bored on this excursion probably because his fellow contestants look old enough to be his parents or grandparents Sixtysomething Windsor publican Ray seems alone among these incisively selected grotesques easy to please even when Wyen calls him RayRay which would have made me unleash the disembowelling cutlass Wyen compounds these failures by taking a suite at the fivestar hotel shes chosen leaving only twin rooms for those she needs to impress The appeal of the show  such as it is  involves watching five Brits who clearly didnt get the memo about gametheory machiavellian strategising that every other realitygameshow contestant from Love at First Sight to Love Island imbibed with their mothers milk At least Wyen leaves a gift on each bed Unfortunately though it is a Tshirt featuring a photograph of Wyen Jason examines his deciding to regift it as a duster for his mum Matters thankfully turn unpleasant during the evenings entertainment After a blahlooking meal at an Italian restaurant you know whats good to eat in Spain Wyen Spanish food she whisks her new mates to a club Jason who may well be able to pick a quarrel with a napkin kicks off because Exauc is laughing  possibly at Jasons moves Like Vivien Leigh in Gone with the Wind Jason flounces with aplomb He did try to ruin my vibe says Exauc evenly Wyen takes the flounce as personal betrayal saying Im not going to let one clown stop the show This is my day Wyens day and youre going to do what I came to do As a host Wyen is what Basil Fawlty is to the hospitality sector  or Matt Hancock to professionalism skip past newsletter promotion Sign up to Whats On Free weekly newsletter Get the best TV reviews news and exclusive features in your inbox every Monday Privacy Notice Newsletters may contain info about charities online ads and content funded by outside parties For more information see our Newsletters may contain info about charities online ads and content funded by outside parties For more information see our Privacy Policy  We use Google reCaptcha to protect our website and the Google Privacy Policy and Terms of Service apply after newsletter promotion Wyen concludes the soiree by serenading contestants from the clubs stage Recall Natasia Demetrious Sophie singing to guests at the Annual Haringey Letting awards in Stath Lets Flats though less charming and youll get the idea What happens in Benidorm unacceptably doesnt stay in Benidorm Amazingly Wyens hosting skills earn her 75 out of a possible 100 points from her fellow contestants Jason sends her an impeccably passiveaggressive message We know you But do you know us Im pretty sure Wyen doest care about whether the other contestants know her Rather shes plotting her revenge Benidorm style Now I can go and be a brat on their days To be fair that does sound mildly diverting Until Channel 4 commissions Monkey Tennis this will have to do,entertainment
https://www.theguardian.com/sport/2023/apr/04/dp-world-tour-wins-landmark-arbitration-case-against-liv-golf-rebels,DP World Tour wins landmark arbitration case against LIV Golf rebels,ulliWestwood and Poulter may never feature on Tour againliliTwelve players had contested imposition of sanctionsliulThe DP World Tour was correct to impose sanctions on members who appeared on the rebel LIV circuit without permission an arbitr,The DP World Tour was correct to impose sanctions on members who appeared on the rebel LIV circuit without permission an arbitration panel has determined in what marks a public embarrassment to the 2324 chars,The DP World Tour was correct to impose sanctions on members who appeared on the rebel LIV circuit without permission an arbitration panel has determined in what marks a public embarrassment to the golfers who challenged the penalty It is now likely players such as Lee Westwood and Ian Poulter will never feature on the DP World Tour again Westwood Poulter and 10 others contested the imposition of a 100000 fine and twoweek suspension after they played in LIVs first tournament at the Centurion Club last year without a release from the DP World Tour These were stayed pending the outcome of a case which was heard over five days in London in February The Tour had argued players were in breach of membership regulations with the players insisting they were entitled to perform on a different platform Sport Resolutions is expected to announce this week that panel members found in favour of the Tour who must now decide whether to pursue further financial payback for appearances in subsequent LIV events The golfers can opt to appeal against the outcome after conversations with LIVs legal representatives There is also the very real prospect of the players resigning from the DP World Tour in a bid to halt the disciplinary process entirely A spokesperson for the DP World Tour said Out of respect for the confidentiality of the process conducted by Sport Resolutions we will make no comment on any aspect of the arbitration until the decision is formally announced Speaking ahead of his 15th Masters appearance Rory McIlroy stayed clear of the controversy attached to this subject McIlroy has sat firmly in the camp of the DP World and PGA Tours in opposition to the LIV threat I dont know if I can comment on it too much said the Northern Irishman But if that is the outcome then that certainly changes the dynamic of everything Im not a lawyer But if the arbitration panel think thats the right decision then I have to go by what they say skip past newsletter promotion Sign up to The Recap Free weekly newsletter The best of our sports journalism from the past seven days and a headsup on the weekends action Privacy Notice Newsletters may contain info about charities online ads and content funded by outside parties For more information see our Newsletters may contain info about charities online ads and content funded by outside parties For more information see our Privacy Policy  We use Google reCaptcha to protect our website and the Google Privacy Policy and Terms of Service apply after newsletter promotion A separate antitrust case between the PGA Tour and LIV is due to be heard in the United States in 2024,entertainment
https://www.theguardian.com/football/2023/apr/05/callum-wilson-and-joelinton-double-up-as-newcastle-thrash-west-ham,Callum Wilson and Joelinton double up as Newcastle thrash West Ham,This was a painful lesson for West Ham in focus finishing and discipline A rampant Newcastle deserved this handsome victory at the London Stadium if only because they succeeded in getting the basics right They profited from Callum Wilson and Joelinton pun,This was a painful lesson for West Ham in focus finishing and discipline A rampant Newcastle deserved this handsome victory at the London Stadium if only because they succeeded in getting the basi 4617 chars,This was the night when West Hams complacency caught up with them A rampant Newcastle deserved this handsome victory at a mutinous London Stadium if only because they succeeded in getting the basics right Eddie Howes impressive side did not even have to work hard for their goals and as the match drew to a close it was hard to know what more West Ham need to see before accepting that David Moyess time is up Out of the bottom three on goal difference West Ham have ignored the obvious for too long and are paying for their failure to act This was a humiliation for Moyes The Scot watched helplessly as his side were given a lesson in focus by opponents cantering towards the Champions League after their fourth consecutive win He listened grimly as the last few home fans left in the stadium applauded when Newcastles crowing supporters taunted Moyes with chants of Youre getting sacked in the morning The travelling Toon Army had a point and the atmosphere turned toxic Moyes was booed off after a rotten defensive display from West Ham and the onus is on the coowner David Sullivan to act There can be no excuses Everything was too easy for Newcastle as they exposed Moyess dreadful fullbacks Thilo Kehrer and Emerson Palmieri and accepted the gifts from West Hams centrebacks Kurt Zouma and Nayef Aguerd whose shocking performance was summed up by the moment when he killed off any chance of a comeback by handing Callum Wilson his second goal of the evening 22 seconds into the second half It was Wilson who had got the ball rolling in the sixth minute punishing slack marking after Sad Benrahma neglected his defensive duties and gave Allan SaintMaximin too much time to cross There was a vast difference in application between the sides Newcastle were jaded after their win over Manchester United and Howe was not happy with their level during a pulsating first half but their resilience meant they tightened their grip on third place I dont think we were perfect Howe said West Ham made it a good game But we took our chances When you reflect back to Sunday the emotion that took out of us we looked a little fatigued We were great in elements of our game Mentally we got through it and got a massive result Every positive result strengthens our position Nothing is going to be decided short term The same applies at the opposite end of the table West Ham had glimpsed a chance to climb but they cannot relax after their first home defeat since December Their away form is dreadful and they still have to host Arsenal United and Liverpool They could do with a result at Fulham on Saturday Joelinton fires home in the 90th minute of the game to seal a 51 win for Newcastle Photograph John WaltonPA At least the early signs had been encouraging for West Ham They were direct when they attacked and could have led when Jarrod Bowen tore down the right inside the first minute held off Dan Burn and produced a cutback so inviting it almost made Bruno Guimares turn the ball into his own net Guimares was relieved to see the ball bounce off a post then for Declan Rice to hammer a shot over West Hams wounds were selfinflicted There were groans when Kehrer misjudged a long ball and conceded a needless corner in the sixth minute West Hams concentration faded The corner was cleared as far as SaintMaximin who danced past Benrahmas feeble challenge and crossed for Wilson to head past Lukasz Fabianski skip past newsletter promotion Sign up to Football Daily Free daily newsletter Kick off your evenings with the Guardians take on the world of football Privacy Notice Newsletters may contain info about charities online ads and content funded by outside parties For more information see our Newsletters may contain info about charities online ads and content funded by outside parties For more information see our Privacy Policy  We use Google reCaptcha to protect our website and the Google Privacy Policy and Terms of Service apply after newsletter promotion Zouma and Aguerd had lost Wilson who replaced Alexander Isak up front and Newcastle capitalised on the confusion Seven minutes later Fabian Schr stepped out of from the back and played a ball straight through the middle Played onside by Emerson Joelinton rounded Fabianski and made it 20 Still though Newcastle were not entirely secure at the back West Ham responded Michail Antonio and Lucas Paqueta both going close Fabianski stopped Wilson and West Ham took note of Nick Pope receiving treatment Antonio stopped Newcastles goalkeeper coming for Bowens corner in the 39th minute and Zoumas header dragged West Ham back into it West Ham were energised by the goal albeit a little fortunate not to lose Emerson for a foul on Jacob Murphy They were still too erratic West Ham were not equipped to deal with Newcastles aggression The third goal summed it up Aguerd received a pass from Fabianski dithered and lost possession to Murphy who presented Wilson with an open goal Out of the window went Moyess halftime instructions Newcastle looked for more Murphy and SaintMaximin testing Fabianski West Hams shape was gone Fabianski miscontrolled Guimaress ball and Isak lobbed in the fourth The home sections emptied out Those who stayed could at least appreciate Joelintons fine finish for Newcastles fifth in added time,entertainment
https://www.theguardian.com/stage/2023/apr/02/cinderella-royal-ballet-review-marianela-nunez-vadim-muntagirov-ashtons-classic-fairytale-with-extra-frills,Cinderella review  Ashtons classic fairytale with extra frills,Royal Opera House LondonMarianela Nuez Vadim Muntagirov and company shine  as do their costumes  in the Royal Ballets overthetop new design of this intricate workFirst the good news Frederick Ashtons Cinderella created in 1948 and so the first full,First the good news Frederick Ashtons Cinderella created in 1948 and so the first fulllength British ballet is back after too long an absence Its swooning Prokofiev score full of sharp reminder 2186 chars,First the good news Frederick Ashtons Cinderella created in 1948 and so the first fulllength British ballet is back after too long an absence Its swooning Prokofiev score full of sharp reminders that midnight is about to strike is as entrancing as ever On opening night for this new Royal Ballet production it starred Marianela Nuez who brings to the heroine a wholehearted goodness delicate arched feet and a speed and lightness that make her radiant both as a putupon drudge dancing with a broom and as a transformed beauty winning her princes heart at the ball As that prince Vadim Muntagirov is warmly attentive The scenes where they seem to follow each other around the stage as if tugged by an invisible thread melting into one anothers movements floating into one anothers arms have a gentle loveliness alongside the grandeur As if tugged by an invisible thread Vadim Muntagirov Prince and Marianela Nuez Cinderella Photograph Tristram KentonThe Guardian The entire company rises to the challenge of Ashtons intricate choreography with some aplomb You can see how hard it is how fast he makes their feet work and how insistently he pushes the shape of their bodies so that there is a constant flow of movement from head to foot creating subtle diagonals where most choreographers would present a step straight on The bad news Few ballets have a more troubled design history than this Cinderella as if the shoe never quite fits The last revival was unremittingly brown This new production tips the balance the other way Tom Pyes sets are big and gracious and much enlivened by Finn Rosss videos that turn Cinderellas home into a tapestry of the seasons But Alexandra Byrnes costumes are too fussy and citrusbright They work best at their simplest  icy blues for the corps de ballet of stars flowing mauve for the fairy godmother  but their elaborate detail is too often over the top You cant see the beauty of the steps for all the overlaid glitter The stepsisters  Ashtons tribute to the pantomime tradition of the dame  suffer most These are meant to be women who care about their appearance and Gary Avis as the big bossy one and Luca Acri as the delicate shy one take care to make them as real as their conception allows But they wear dresses that show their vests when they go to the ball Its a travesty of travesti,entertainment
https://www.theguardian.com/football/2023/apr/05/west-hams-david-moyes-pleads-for-time-but-admits-job-is-at-risk-after-thrashing,West Hams David Moyes pleads for time but admits job is at risk after thrashing,ulliMoyes If you lose badly youre always in jeopardyliliScot confident he has boards support after Newcastle win 51 liulDavid Moyes pleaded for time after West Ham fell to a humiliating 51 home defeat to Newcastle United on Wednesday nig,David Moyes pleaded for time after West Ham fell to a humiliating 51 home defeat to Newcastle United on Wednesday night  but the manager admitted that he would have no complaints if he loses his jo 2243 chars,David Moyes pleaded for time after West Ham fell to a humiliating 51 home defeat to Newcastle United on Wednesday night  but the manager admitted that he would have no complaints if he loses his job Moyes who was booed off after the final whistle is under huge pressure after Newcastle deepened his sides relegation worries The atmosphere was toxic during the closing stages at the London Stadium and West Ham who are only out of the bottom three on goal difference face a huge decision over whether to sack the Scot before travelling to Fulham on Saturday As manager you always have to front up Moyes said Im a big boy Ive left jobs at other times in the past and if that happens Ill have to go with that But I really like my job here Ive enjoyed my time here greatly and I really hope weve got a couple of big days ahead in the future skip past newsletter promotion Sign up to Football Daily Free daily newsletter Kick off your evenings with the Guardians take on the world of football Privacy Notice Newsletters may contain info about charities online ads and content funded by outside parties For more information see our Newsletters may contain info about charities online ads and content funded by outside parties For more information see our Privacy Policy  We use Google reCaptcha to protect our website and the Google Privacy Policy and Terms of Service apply after newsletter promotion There have been 12 managerial sackings in the Premier League this season but Moyes insisted that he retains the support of West Hams board Ive got no doubt they are behind me he said Im confident in the way they work and what they think but if youre a manager and you lose badly like I did tonight youre always in jeopardy and I understand that West Ham paid for an awful defensive performance Callum Wilson and Joelinton both grabbed two goals and Alexander Isak came off the bench to score as Newcastle closed in on Champions League qualification Moyes did not complain about supporters leaving early I might have walked out tonight as well he said But sometimes when things arent going so well you need everyone behind you Thats when you stand up and be a true supporter But I have no qualms with them leaving with a result like that Declan Rice admitted that West Ham were not good enough When you play for this shirt the fans want desire and hard work West Hams captain said The effort was there but when youre five goals down its really tough to keep going mentally I dont think weve conceded five worse goals since Ive played for West Ham,entertainment
