URL,Title,Description,Content,full_content,topic
https://www.cnn.com/2023/04/04/politics/jill-biden-king-charles-iii-coronation/index.html,First lady Jill Biden will attend the coronation of King Charles III White House announces,First lady Dr Jill Biden is set to travel to London next month for the coronation of King Charles III of the United Kingdom leading the US delegation to the highly anticipated event,First lady Dr Jill Biden is set to travel to London next month for the coronation of King Charles III of the United Kingdom leading the US delegation to the highly anticipated event President Joe 2172 chars,CNN  First lady Dr Jill Biden is set to travel to London next month for the coronation of King Charles III of the United Kingdom leading the US delegation to the highly anticipated event President Joe Biden spoke by phone Tuesday with King Charles the White House said offering his congratulations to the monarch as he reaffirmed the strong ties between the US and the UK The President congratulated the King on his upcoming Coronation and informed him that First Lady Jill Biden looks forward to attending on behalf of the United States a White House readout of the call said As reports surfaced that President Biden would not attend the coronation despite the expected presence of dozens of world leaders US officials downplayed the possibility and noted that no previous US president has attended a British monarchs coronation Instead the first lady will attend the event set for Saturday May 6 and President Biden made clear in the Tuesday call that he plans to meet with King Charles in the future The President also conveyed his desire to meet with the King in the United Kingdom at a future date the readout said The coronation itself will be a solemn religious service as well as an occasion for celebration and pageantry conducted by the Archbishop of Canterbury Justin Welby Buckingham Palace announced earlier this year The last coronation ceremony took place nearly 70 years ago as King Charles mother Queen Elizabeth II was crowned in June 1953 Both the president and first lady traveled to London in September to attend the funeral of the late queen Jill Biden told CNN last year that she had spoken with King Charles about his mother during a private reception with the royal family and other visiting dignitaries on the eve of the funeral service We really talked about the woman and who she was and what she meant really to the whole world she said in a phone interview from London in September adding that she noted to King Charles the human toll of grief He is the king but you know no one should forget he lost his mother and Prince William lost a grandmother and sometimes we tend to forget the really human piece there and the sorrow they have to bear  and how they have to grieve in public But  they seem to be doing OK the first lady said,entertainment
https://consent.google.com/ml?continue=https://news.google.com/rss/articles/CBMiW2h0dHBzOi8vd3d3LnJldXRlcnMuY29tL2xpZmVzdHlsZS9zcG90bGlnaHQtbG9uZG9uLWhvc3RzLW9saXZpZXItYXdhcmRzLXRoZWF0cmUtMjAyMy0wNC0wMi_SAQA?oc%3D5&gl=FR&hl=en-US&cm=2&pc=n&src=1,In the spotlight London hosts Olivier Awards for theatre  Reuters,In the spotlight London hosts Olivier Awards for theatre Reuters,We use cookies and data toulliDeliver and maintain Google servicesliliTrack outages and protect against spam fraud and abuseliliMeasure audience engagement and site statistics to unde 1131 chars,13 Jodie Comer poses with the award for Best Actress for Prima Facie accompanied by Paul Mescal at the Olivier Awards at the Royal Albert Hall in London Britain April 2 2023 REUTERSMay James LONDON April 2 Reuters  A stage adaptation of Studio Ghiblis 1988 animated film My Neighbour Totoro was the big winner at the Olivier Awards on Sunday picking up six prizes at Britains top theatre extravaganza The Royal Shakespeare Companys RSC critically acclaimed production based on the muchloved film by Japanese animator Hayao Miyazaki about two sisters who discover friendly forest spirits when they move to a new country house with their father in postwar Japan had led nominations with nine nods It won best entertainment or comedy play as well as the director set lighting sound and costume design category prizes My Neighbour Totoro is a story about kindness courage and imagination and we will forever be grateful for the kindness courage and imagination of the extraordinary people that came together to make this production Griselda Yorke executive producer at the RSC said A revival of Tennessee Williams A Streetcar Named Desire won three awards at the event that celebrates the best shows in the capital and is named after the famed British actor Laurence Olivier It won best revival best actor for Paul Mescal for his role as Stanley Kowalski and best actress in a supporting role for Anjana Vasan for her portrayal of Stella I just have to thank Tennessee Williams really  he gave us magic instead of realism and thats what we all needed director Rebecca Frecknall who last year won best director for Cabaret said Standing at the Skys Edge about three families living for a period of over 60 years in a council housing estate in the English city of Sheffield won best new musical and best original score or new orchestrations for musician Richard Hawley and composer Tom Deering Killing Eve star Jodie Comer won best actress in onewoman play Prima Facie in which she portrays a barrister who defends men accused of sexual assault before herself being assaulted The production was named best new play and the 30yearold who won rave reviews for her West End debut reprises the role on Broadway this month This play has changed my life so much she said in her acceptance speech A new production of Rodgers and Hammersteins Oklahoma won best musical revival and best actor in a musical for Arthur Darvill Katie Brayben won the best actress equivalent for musical Tammy Faye Other honourees included veteran actor and twotime Olivier winner Derek Jacobi who was given a lifetime achievement award It feels wonderful particularly to be given an award in his name because he was a vital part of my early career Jacobi told Reuters of Olivier Reporting by MarieLouise Gumuchian Additional reporting by Hannah Ellison Editing by Sharon Singleton and Matthew Lewis Our Standards The Thomson Reuters Trust Principles,entertainment
https://www.theguardian.com/food/2023/apr/02/jay-rayner-restaurant-review-speedboat-bar-london-completely-irresistible-style,Speedboat Bar London Completely irresistible style  restaurant review,The neonbright Bangkok flavours of Londons Speedboat Bar will soon have your lips tinglingSpeedboat Bar 30 Rupert Street London W1D 6DL Snacks 51250 salads stirfries 1014 curries specials 1225 dessert 8 cocktails 75010 wines from ,Speedboat Bar 30 Rupert Street London W1D 6DL Snacks 51250 salads stirfries 1014 curries specials 1225 dessert 8 cocktails 75010 wines from 30 The restaurant at 30 Rupert  8072 chars,Speedboat Bar 30 Rupert Street London W1D 6DL Snacks 51250 salads stirfries 1014 curries specials 1225 dessert 8 cocktails 75010 wines from 30 The restaurant at 30 Rupert Street on the edge of Londons Chinatown was once one of the most beautiful in the city Now its one of the most dynamic As Xu a Taiwanesestyle tea house it was a stage set of 1920s polish and clean lines The walls were partpanelled in block marquetry and there were booths upholstered in leather the colour of caf au lait There were sexy wall sconces and flashes of marble trim and tiny private dining rooms built cleverly into the small space You came here for crisply fried pork buns and pleated dumplings in puddles of jadegreen broth It was at first shocking to see all of that stripped out to make way for Speedboat Bar Now the downstairs walls are tiled in an institutional sludge green Upstairs theyre painted yellow against the turquoise window frames Theres a pool table to drink powerful cocktails over while you play and giant TVs screening sports There are stainlesssteel tables and dozens of tiny pictures of Bangkok street life as if acquired over decades of trade rather than put up for the opening a couple of months ago And oh the clamour Top marks for upholstering the underneath of the tables to help deaden the sound Clams arrive in a broth thick with sweet chilli jam and outrageously blousy aromatic Thai basil clams in chilli broth Photograph Sophia EvansThe Observer An 80s soundtrack of Depeche Mode and Soft Cell accompanies the delivery of whisky sodas and King Kushti lager by the bottle I order a bowl of deepfried chicken skins the brown of a velour sofa They are still warm and curled in on each other and an irresistible saltysour As I scarf the lot I finally clock that this new space is just as clever and just as beguiling an exercise in restaurant stagesetting as its previous incarnation This makes sense The restaurant may have changed but the business behind it remains the same Both involved the Sethi brothers company JKS Restaurants They have an impressive spread of ventures from the Mayfair Indian Gymkhana through the Iranian kebab house Berenjak to the Bao group of which the now closed Xu was a part JKS has many talents One of them is choosing their chefrestaurateur partners With Speedboat Bar its the British chef Luke Farrell who has been bouncing back and forth between Dorset London and Thailand for many years now investigating southern Thai cooking He brings in cuttings of Thai herbs and plants to grow here in glasshouses on his fathers farm because they are diminished by being imported frozen Warm and curled in on each other and an irresistible saltysour chicken skins Photograph Sophia EvansThe Observer The first restaurant he opened with JKS was Plaza Khao Gaeng a southern Thai caf in the upstairs space above their Arcade food court at the base of Centrepoint There he serves fierce dishes of dryfried pork or sea bream with permutations of chillies wild galangal and makrut limes Its food to make you gasp and blink and go back for more Farrell has described Speedboat Bar as his tribute to the fullon cafs along the neongilded Yaowarat Road in Bangkoks Chinatown Everything here is vivid and candycoloured and maximum wattage including the food Look at the bright orange sweetsour dipping sauce with the sweetcorn fritters the golden lacy batter pitted with the brilliant yellow of corn kernels Or theres the ludicrously green prawn ceviche served whole and peeled apart from the tail which can act as a handle Use it to help you dredge the prawn through the rugged lake of lime chilli and fish sauce that makes your lips tingle and your brow sweat Speedboats homage to the restaurants of Bangkoks Chinatown is felt in various ways A salad of pickled mustard greens comes layered with slices of dense deepred winddried Chinese sausage Drunkards seafood and beef noodles is so named our Thai waiter explains because it was first devised as a hangover cure from whatever was hanging around in the fridge Its a good reason to get liquored up There are broad ribbon noodles and slices of quickfried beef and curls of squid in a thickened sweet soy Cantonesestyle sauce If youre with nonmeat eaters watch out for the Naem fried rice mined with tiny cubes of pork Introduce some of the sweet vinegary dressing from the saucer on the side Allow sliced red and green chillies according to taste Ludicrously green prawn ceviche Photograph Sophia EvansThe Observer Other things come from the more obviously Thai side of the ledger Clams steamed open in their shells for maximum suckage arrive in a broth thick with sweet chilli jam and outrageously blousy aromatic Thai basil Chunks of aubergine served in a similar sauce are cooked down until their skins are crinkled and their flesh creamy A crispy pork curry walks both sides of the line The sliced meat has crackling with the crunch and shatter that I associate with Cantonese roast meats The dark brown sauce has the coconut and palm sugar sweetness that I associate with a massaman Taken dish by dish its obviously huge fun To keep to the retro 60s vibe each one is like a frame from an old Batman comic fight scene Kapow Wham Biff The problem is that cumulatively like the bar upstairs throbbing and thronging with young people necking those whisky sodas it can all become a little relentless Wave after wave of sweet and fiery and sour crashes on the wilder shores of your tongue This may however be down to the nature of reviewing which demands overordering for I am nothing if not conscientious Perhaps come here for a beer and just a couple of plates and then move on Outside is a ropedoff area of the pavement with red plastic stools around the tables On warm summer nights people passing by will want to be inside that rope rather than outside A flaky golden rectangle pineapple pie Photograph Sophia EvansThe Observer There is just one dessert a flaky golden rectangle of deepfried pineapple pie It reminds me fondly of a McDonalds apple pie Its in keeping with the louche laidback mood If you want something else remember youre in Soho There are dessert alternatives Speedboat Bar sits alongside places like Kiln Som Saa and the now closed District in Manchester restaurants created by British chefs with a deep fascination with Thai traditions They are not a replacement for restaurants like the recently reviewed Thairun Supawan Big cities have space for many things When presented with the vivacity of Speedboat Bar the style is completely irresistible News bites The Manchesterborn chain Rudys Pizza Napoletana which has opened over a dozen sites across the UK since its 2015 launch in Ancoats has announced a new 8000 sq ft outpost on Portland Street in the city As well as space for 120 diners it will be home to Rudys Pizza Academy a training school in the craft of pizza and an interesting response to a shortage of kitchen staff across the hospitality business It will also house the Rudys Bake at Home business which will make their pizzas available across much of the UK from later in the spring At rudyspizzacouk Leamington Spa is to get a new Greek restaurant born out of a lockdown business During the pandemic Matt and Alex Crowther who run the Pugs Pub business in and around the Warwickshire town launched a Greek food delivery service based on Matt Crowthers four years of experience working in Greece That has now spawned Taverna Meraki on the site of what was a Caf Rouge It will open towards the end of May Visit tavernamerakicom And sad but perhaps inevitable news from Edinburgh Following the sudden death in December of the muchadmired chef Paul Kitching his restaurant 21212 is to close The passing of Paul has devastated all the team and the passion that runs through every fibre of the restaurant is not as evident as it was when he was alive his partner Katie OBrian told industry journal The Caterer To us that is unacceptable to his memory Email Jay at jayraynerobservercouk or follow him on Twitter jayrayner1,entertainment
https://www.theguardian.com/stage/2023/apr/02/olivier-awards-2023-full-list-of-winners,Olivier awards 2023 full list of winners,My Neighbour Totoro A Streetcar Named Desire and Prima Facie were among the winners at the Royal Albert Hall ceremonyJack and the Beanstalk at the London PalladiumMy Neighbour Totoro at Barbican theatre  WINNERMy Sons a Queer But What Can You Do at Gar,Nol Coward award for best entertainment or comedy play Jack and the Beanstalk at the London PalladiumMy Neighbour Totoro at Barbican theatre WINNERMy Sons a Queer But What Can You Do at Garrick 7472 chars,Nol Coward award for best entertainment or comedy play Jack and the Beanstalk at the London Palladium My Neighbour Totoro at Barbican theatre  WINNER My Sons a Queer But What Can You Do at Garrick theatre and Ambassadors theatre One Woman Show at Ambassadors theatre Best family show Blippi the Musical at Apollo theatre Hey Duggee The Live Theatre Show at Royal Festival Hall  WINNER Midsummer Mechanicals at Sam Wanamaker Playhouse The Smartest Giant in Town at St Martins theatre Gillian Lynne award for best theatre choreographer Matt Cole for Newsies at Troubadour Wembley Park theatre  WINNER Lynne Page for Standing at the Skys Edge at National Theatre Kate Prince for Sylvia at the Old Vic Basil Twist for puppetry direction for My Neighbour Totoro at Barbican theatre Best costume design Frankie Bradshaw for Blues for An Alabama Sky at National Theatre Hugh Durrant for Jack and the Beanstalk at the London Palladium Jean Paul Gaultier for Jean Paul Gaultier Fashion Freak Show at Roundhouse Kimie Nakano for My Neighbour Totoro at Barbican theatre  WINNER My Neighbour Totoro with costumes designed by Kimie Nakano Photograph Manuel HarlanRSCNippon TV Best revival The Crucible at National Theatre Good at Harold Pinter theatre Jerusalem at Apollo theatre A Streetcar Named Desire at Almeida theatre  WINNER Best musical revival My Fair Lady at London Coliseum Rodgers  Hammersteins Oklahoma at Young Vic  WINNER Sister Act at Eventim Apollo South Pacific at Sadlers Wells Best sound design Bobby Aitken for Standing at the Skys Edge at National Theatre Tony Gayle for My Neighbour Totoro at Barbican theatre  WINNER Drew Levy for Rodgers  Hammersteins Oklahoma at Young Vic Ben and Max Ringham for Prima Facie at Harold Pinter theatre Best original score or new orchestrations David Yazbek Jamshied Sharifi and Andrea Grody for The Bands Visit at Donmar Warehouse Joe Hisaishi and Will Stuart for My Neighbour Totoro at Barbican theatre Daniel Kluger and Nathan Koci for Rodgers  Hammersteins Oklahoma at the Young Vic Richard Hawley and Tom Deering for Standing at the Skys Edge at National Theatre  WINNER Best actor in a supporting role Mark Akintimehin Emmanuel Akwafo Nnabiko Ejimofor Darragh Hand Aruna Jalloh and Kaine Lawrence for For Black Boys Who Have Considered Suicide When the Hue Gets Too Heavy at the Royal Court theatre Will Keen for Patriots at Almeida theatre  WINNER Elliot Levey for Good at Harold Pinter theatre David Moorst for To Kill a Mockingbird at Gielgud theatre Sule Rimi for Blues for An Alabama Sky at National Theatre Beverley Knight as Emmeline Pankhurst in Sylvia Photograph Manuel Harlan Best actress in a supporting role Rose AylingEllis for As You Like It at sohoplace Pamela Nomvete for To Kill a Mockingbird at Gielgud theatre Caroline Quentin for Jack Absolute Flies Again at National Theatre Sharon Small for Good at Harold Pinter theatre Anjana Vasan for A Streetcar Named Desire at Almeida theatre  WINNER Best set design Miriam Buether for To Kill a Mockingbird at Gielgud theatre Tom Pye for My Neighbour Totoro at Barbican theatre  WINNER Ben Stones for Standing at the Skys Edge at National Theatre Mark Walters for Jack and the Beanstalk at the London Palladium Best lighting design Natasha Chivers for Prima Facie at Harold Pinter theatre Lee Curran for A Streetcar Named Desire at Almeida theatre Jessica Hung Han Yun for My Neighbour Totoro at Barbican theatre  WINNER Tim Lutkin for The Crucible at National Theatre Best actress in a supporting role in a musical Beverley Knight for Sylvia at the Old Vic  WINNER Maimuna Memon for Standing at the Skys Edge at the National Theatre Liza Sadovy for Rodgers  Hammersteins Oklahoma at Young Vic Marisha Wallace for Rodgers  Hammersteins Oklahoma at Young Vic Best actor in a supporting role in a musical Sharif Afifi for The Bands Visit at Donmar Warehouse Peter Polycarpou for The Bands Visit at Donmar Warehouse Clive Rowe for Sister Act at Eventim Apollo Zubin Varla for Tammy Faye at Almeida theatre  WINNER Alcina at the Royal Opera House directed by Richard Jones Photograph Tristram KentonThe Guardian Best new opera production Alcina by Royal Opera at Royal Opera House  WINNER Least Like the Other by Irish National Opera and Royal Opera at the Royal Opera House Peter Grimes by Royal Opera at Royal Opera House Sibyl at Barbican theatre Outstanding achievement in opera Sinad CampbellWallace for her performance in Tosca by English National Opera at London Coliseum William Kentridge for his conception and direction of Sibyl at Barbican theatre  WINNER Antony McDonald for his design of Alcina at Royal Opera House Best actor in a musical Alon Moni Aboutboul for The Bands Visit at Donmar Warehouse Arthur Darvill for Rodgers  Hammersteins Oklahoma at Young Vic  WINNER Julian Ovenden for South Pacific at Sadlers Wells Andrew Rannells for Tammy Faye at Almeida theatre Best actress in a musical Katie Brayben for Tammy Faye at Almeida theatre  WINNER Anoushka Lucas for Rodgers  Hammersteins Oklahoma at Young Vic Miri Mesika for The Bands Visit at Donmar Warehouse Faith Omole for Standing at the Skys Edge at National Theatre Best new dance production Light of Passage by Crystal Pite at Royal Opera House Pasionaria by La Veronal at Sadlers Wells Traplord by Ivan Michael Blackstock at 180 Studios The Strand  WINNER Triptych The Missing Door The Lost Room and The Hidden Floor by Peeping Tom at Barbican theatre Traplord by Ivan Michael Blackstock Photograph Tristram KentonThe Guardian Outstanding achievement in dance Manuel Lin for his choreography of Viva at Sadlers Wells Dickson Mbi for his choreography of Enowate at Sadlers Wells  WINNER Raquel Meseguer Zafe for her dramaturgy of Ruination by Lost Dog at Royal Opera House  Linbury theatre Catrina Nisbett for her performance in Family Honour by Spoken Movement at Sadlers Wells Outstanding achievement in affiliate theatre Age Is a Feeling at Soho theatre Blackout Songs at Hampstead theatre The P Word at Bush theatre  WINNER Paradise Now at Bush theatre Two Palestinians Go Dogging at the Royal Court theatre Sir Peter Hall award for best director Rebecca Frecknall for A Streetcar Named Desire at Almeida theatre Robert Hastie for Standing at the Skys Edge at National Theatre Justin Martin for Prima Facie at Harold Pinter theatre Phelim McDermott for My Neighbour Totoro at Barbican theatre  WINNER Bartlett Sher for To Kill a Mockingbird at Gielgud theatre Best actress Jodie Comer for Prima Facie at Harold Pinter theatre  WINNER Patsy Ferran for A Streetcar Named Desire at Almeida theatre Mei Mac for My Neighbour Totoro at Barbican theatre Janet McTeer for Phaedra at National Theatre Nicola Walker for The Corn Is Green at National Theatre Best actor Tom Hollander for Patriots at Almeida theatre Paul Mescal for A Streetcar Named Desire at Almeida theatre  WINNER Rafe Spall for To Kill a Mockingbird at Gielgud theatre David Tennant for Good at Harold Pinter theatre Giles Terera for Blues for An Alabama Sky at National Theatre Standing at the Skys Edge directed by Robert Hastie Photograph Tristram KentonThe Guardian Best new play For Black Boys Who Have Considered Suicide When the Hue Gets Too Heavy at Jerwood Theatre Downstairs at the Royal Court theatre Patriots at Almeida theatre Prima Facie at Harold Pinter theatre  WINNER To Kill a Mockingbird at Gielgud theatre Best new musical The Bands Visit at Donmar Warehouse Standing at the Skys Edge at National Theatre  WINNER Sylvia at the Old Vic Tammy Faye at Almeida theatre Special award Dame Arlene Phillips Lifetime achievement award Sir Derek Jacobi,entertainment
